Sheet: Arkusz1
A1: IR emitting diodes
A3: VAT rate | B3: 0.23 | C3: of:=1+[.B3] -> 1.23
A5: SMD ones have to be wide angle because they cannot be directed after mounting
A7: Vendor | B7: Model | C7: Price | D7: URL | E7: Wavelength [nm] | F7: Case | G7: Angle [deg] | H7: Power dissipation [mW] | I7: Forward current [mA] | J7: Peak forward current [mA] | K7: Forward voltage [V]
A8: Kingbright | B8: KP-3216F3C | C8: of:=0.47*vat -> 0.5781 | D8: http://www.tme.eu/pl/details/kp-3216f3c/diody-nadawcze-ir/kingbright-electronic/# | E8: 940 | F8: SMD | G8: 120 | H8: 100 | I8: 50 | J8: 1200 | K8: 1.6
A9: Excelitas | B9: CR50IRK | C9: of:=2.35*vat -> 2.8905 | D9: http://www.tme.eu/pl/details/cr50irk/diody-nadawcze-ir/excelitas/# | E9: 950 | F9: SMD | G9: 90 | I9: 50 | J9: 800 | K9: 1.7
A10: Everlight | B10: IR11-21C | C10: 0.3202 | D10: https://sklep.eltron.pl/product-view.html?id=175407&gn=4&productGroup=85 | E10: 940 | F10: SMD | G10: 100 | H10: 130 | I10: 65 | J10: 1000 | K10: 1.8
A11: Everlight | B11: IR17-21C | C11: 0.3202 | D11: https://sklep.eltron.pl/product-view.html?id=175408&gn=4&productGroup=85 | E11: 940 | F11: SMD | G11: 120 | H11: 130 | I11: 65 | J11: 1000 | K11: 1.85
A12: Everlight | B12: IR67-21C | C12: 0.453 | D12: https://sklep.eltron.pl/product-view.html?id=175413&gn=4&productGroup=85 | E12: 940 | F12: SMD | G12: 120 | H12: 130 | I12: 65 | K12: 1.8
A13: Osram | B13: SFH487FP | C13: 1.5523 | D13: https://sklep.eltron.pl/product-view.html?id=187570&gn=4&productGroup=85 | E13: 880 | F13: SMD | G13: 130 | H13: 200 | I13: 100 | J13: 2500 | K13: 1.8
A14: Everlight | B14: HIR204/H0 | C14: 0.8304 | D14: https://sklep.eltron.pl/product-view.html?id=175404&gn=4&productGroup=85 | E14: 850 | F14: straight | G14: 40 | H14: 150 | I14: 100 | J14: 1000 | K14: 2.4
A15: Everlight | B15: HIR333/H0 | C15: 0.8761 | D15: https://sklep.eltron.pl/product-view.html?id=175406&gn=4&productGroup=85 | E15: 850 | F15: straight | G15: 30 | H15: 150 | I15: 100 | J15: 1000 | K15: 2.4
A16: Everlight | B16: IR204-A | C16: 0.3202 | D16: https://sklep.eltron.pl/product-view.html?id=175a409&gn=4&productGroup=85 | E16: 940 | F16: straight | G16: 35 | H16: 150 | I16: 100 | J16: 1000 | K16: 1.8
A17: Everlight | B17: IR323/H0-A | C17: 0.3202 | D17: https://sklep.eltron.pl/product-view.html?id=175410&gn=4&productGroup=85 | E17: 940 | F17: straight | G17: 60 | H17: 150 | I17: 100 | J17: 1000 | K17: 1.8
A18: Everlight | B18: IR333C/H0/L10 | C18: 0.3202 | D18: https://sklep.eltron.pl/product-view.html?id=175411&gn=4&productGroup=85 | E18: 940 | F18: straight | G18: 40 | H18: 150 | I18: 100 | J18: 1000 | K18: 1.8
A19: Everlight | B19: IR7393C | C19: 0.675 | D19: https://sklep.eltron.pl/product-view.html?id=175414&gn=4&productGroup=85 | E19: 940 | F19: straight | G19: 60 | H19: 150 | I19: 100 | J19: 1000 | K19: 1.8
A20: Everlight | B20: IR908-7C | C20: 0.3941 | D20: https://sklep.eltron.pl/product-view.html?id=175415&gn=4&productGroup=85 | E20: 940 | F20: side | G20: 60 | H20: 75 | I20: 50 | J20: 1000 | K20: 1.5
A21: Everlight | B21: SIR204-A | C21: 0.5187 | D21: https://sklep.eltron.pl/product-view.html?id=175490&gn=4&productGroup=85 | E21: 875 | F21: straight | G21: 30 | H21: 150 | I21: 100 | J21: 1000 | K21: 1.8
A22: Everlight | B22: SIR333-A | C22: 0.5187 | D22: https://sklep.eltron.pl/product-view.html?id=175491&gn=4&productGroup=85 | E22: 875 | F22: straight | G22: 20 | H22: 150 | I22: 100 | J22: 1000 | K22: 1.8
A23: Liteon | B23: HSDL4220 | C23: 2.0087 | D23: https://sklep.eltron.pl/product-view.html?id=177683&gn=4&productGroup=85 | E23: 875 | F23: straight | G23: 30 | H23: 260 | I23: 100 | J23: 500 | K23: 1.7
A24: Liteon | B24: HSDL4230 | C24: 2.0087 | D24: https://sklep.eltron.pl/product-view.html?id=177684&gn=4&productGroup=85 | E24: 875 | F24: straight | G24: 17 | H24: 260 | I24: 100 | J24: 500 | K24: 1.7
A25: Liteon | B25: HSDL4420 | C25: 1.9528 | D25: https://sklep.eltron.pl/product-view.html?id=177685&gn=4&productGroup=85 | E25: 875 | F25: SMD | G25: 24 | H25: 100 | I25: 100 | J25: 500 | K25: 1.7
A26: Liteon | B26: IRS5 | C26: 0.3445 | D26: https://sklep.eltron.pl/product-view.html?id=178666&gn=4&productGroup=85 | E26: 940 | F26: straight | G26: 20 | H26: 150 | I26: 100 | J26: 2000 | K26: 1.6
A27: Osram | B27: LD261-5 | C27: 3.4802 | D27: https://sklep.eltron.pl/product-view.html?id=179635&gn=4&productGroup=85 | E27: 950 | F27: SMD/straight | G27: 15 | H27: 70 | I27: 50 | J27: 1600 | K27: 1.4
A28: Liteon | B28: LTE2871 | C28: 0.2429 | D28: https://sklep.eltron.pl/product-view.html?id=180518&gn=4&productGroup=85 | E28: 940 | F28: straight | G28: 16 | H28: 90 | I28: 60 | J28: 1000 | K28: 1.6
A29: Liteon | B29: LTE5208AC | C29: 0.4432 | D29: https://sklep.eltron.pl/product-view.html?id=180519&gn=4&productGroup=85 | E29: 940 | F29: straight | G29: 40 | H29: 150 | I29: 100 | J29: 2000 | K29: 1.6
A30: Osram | B30: SFH4550 | C30: 1.7461 | D30: https://sklep.eltron.pl/product-view.html?id=187566&gn=4&productGroup=85 | E30: 850 | F30: straight | G30: 3 | H30: 180 | I30: 100 | J30: 1000 | K30: 1.8
A31: Osram | B31: SFH4580 | C31: 1.4904 | D31: https://sklep.eltron.pl/product-view.html?id=187567&gn=4&productGroup=85 | E31: 880 | F31: SMR | G31: 15 | H31: 200 | I31: 100 | J31: 2500 | K31: 1.8
A32: Osram | B32: SFH484-2 | C32: 1.0076 | D32: https://sklep.eltron.pl/product-view.html?id=187568&gn=4&productGroup=85 | E32: 880 | F32: straight | G32: 8 | H32: 200 | I32: 100 | J32: 2500 | K32: 1.8
A33: Osram | B33: SFH485 | C33: 1.0665 | D33: https://sklep.eltron.pl/product-view.html?id=187569&gn=4&productGroup=85 | E33: 880 | F33: straight | G33: 20 | H33: 200 | I33: 100 | J33: 2500 | K33: 1.8
A34: Vishay | B34: TSAL4400 | C34: 0.3774 | D34: https://sklep.eltron.pl/product-view.html?id=189724&gn=4&productGroup=85 | E34: 940 | F34: straight | G34: 25 | H34: 160 | I34: 100 | J34: 1500 | K34: 1.6
A35: Vishay | B35: TSAL5100 | C35: 0.3087 | D35: https://sklep.eltron.pl/product-view.html?id=189725&gn=4&productGroup=85 | E35: 940 | F35: straight | G35: 10 | H35: 160 | I35: 100 | J35: 1500 | K35: 1.6
A36: Vishay | B36: TSAL6200 | C36: 0.2788 | D36: https://sklep.eltron.pl/product-view.html?id=189726&gn=4&productGroup=85 | E36: 940 | F36: straight | G36: 17 | H36: 160 | I36: 100 | J36: 1500 | K36: 1.6
A37: Vishay | B37: TSAL6400 | C37: 0.2788 | D37: https://sklep.eltron.pl/product-view.html?id=189727&gn=4&productGroup=85 | E37: 940 | F37: straight | G37: 25 | H37: 160 | I37: 100 | J37: 1500 | K37: 1.6
A38: Vishay | B38: TSFF5210 | C38: 1.1783 | D38: https://sklep.eltron.pl/product-view.html?id=189748&gn=4&productGroup=85 | E38: 870 | F38: straight | G38: 10 | H38: 180 | I38: 100 | J38: 1000 | K38: 1.8
A39: Vishay | B39: TSHF5410 | C39: 0.7057 | D39: https://sklep.eltron.pl/product-view.html?id=189751&gn=4&productGroup=85 | E39: 890 | F39: straight | G39: 22 | H39: 160 | I39: 100 | J39: 1500 | K39: 1.6
A40: Kingbright | B40: KM-4457F3C | C40: of:=0.356*vat -> 0.43788 | D40: http://www.tme.eu/pl/details/km4457f3c/diody-nadawcze-ir/kingbright-electronic/km-4457f3c/# | E40: 940 | F40: side | G40: of:=150/2 -> 75 | H40: 100 | I40: 50 | J40: 1200 | K40: 1.5
A41: Fairchild | B41: QEE113 | C41: of:=0.71*vat -> 0.8733 | D41: http://www.tme.eu/pl/details/qee113/diody-nadawcze-ir/# | E41: 940 | F41: side | G41: 50 | H41: 100 | I41: 50 | J41: 100 | K41: 1.5