Sheet: Arkusz1
A1: IC infrared receivers
A3: VAT rate | B3: 0.23 | C3: of:=1+[.B3] -> 1.23
A4: Supply min | B4: 2.5 | C4: V
A5: Supply max | B5: 4.5 | C5: V
G6: Supply voltage [V]
A7: Vendor | B7: Model | C7: Price | D7: URL | E7: Wavelength [nm] | F7: Frequency [kHz] | G7: min | H7: max | I7: Supply current [mA] | J7: Min pulse len [ms] | K7: Bitrate [kbps]
A8: Huey Jann Electronic | B8: IR2638 | C8: of:=2.99*vat -> 3.6777 | D8: http://www.tme.eu/pl/details/ir2638/odbiorniki-podczerwieni-scalone/huey-jann-electronic/ | E8: 940 | F8: 38 | G8: 4.5 | H8: 5.5 | I8: 3 | J8: 0.8 | K8: of:=1/[.J8]/2 -> 0.625
A9: Huey Jann Electronic | B9: IR5040 | C9: of:=1.86*vat -> 2.2878 | D9: http://www.tme.eu/pl/details/ir5040/odbiorniki-podczerwieni-scalone/huey-jann-electronic/# | E9: 940 | F9: 38 | G9: 2.7 | H9: 5 | I9: 1.5 | J9: 0.8 | K9: of:=1/[.J9]/2 -> 0.625
A10: Huey Jann Electronic | B10: IR5240 | C10: of:=2.04*vat -> 2.5092 | D10: http://www.tme.eu/pl/details/ir5240/odbiorniki-podczerwieni-scalone/huey-jann-electronic/# | E10: 940 | F10: 40 | G10: 2.7 | H10: 5 | I10: 1.5 | J10: 0.8 | K10: of:=1/[.J10]/2 -> 0.625
A11: Huey Jann Electronic | B11: IR5440 | C11: of:=1.3*vat -> 1.599 | D11: http://www.tme.eu/pl/details/ir5440/odbiorniki-podczerwieni-scalone/huey-jann-electronic/# | E11: 940 | F11: 36 | G11: 2.7 | H11: 5 | I11: 1.5 | J11: 0.8 | K11: of:=1/[.J11]/2 -> 0.625
A12: Optosupply | B12: OSRB38C9AA | C12: of:=0.81*vat -> 0.9963 | D12: http://www.tme.eu/pl/details/osrb38c9aa/odbiorniki-podczerwieni-scalone/optosupply/# | E12: 940 | F12: 37.9 | G12: 2.7 | H12: 5.5 | I12: 0.9 | J12: 0.8 | K12: of:=1/[.J12]/2 -> 0.625
A13: Optosupply | B13: OSRB38C9BA | C13: of:=0.77*vat -> 0.9471 | D13: http://www.tme.eu/pl/details/osrb38c9ba/odbiorniki-podczerwieni-scalone/optosupply/# | E13: 940 | F13: 37.9 | G13: 2.7 | H13: 5.5 | I13: 0.9 | J13: 0.8 | K13: of:=1/[.J13]/2 -> 0.625
A14: Vishay | B14: TSOP1133 | C14: 1.525 | D14: https://sklep.eltron.pl/product-view.html?id=189804&gn=4&productGroup=92 | E14: 940 | F14: 33 | G14: 4.5 | H14: 5.5 | I14: 1 | J14: of:=1000*1/2200/2 -> 0.227272727272727 | K14: of:=1/[.J14]/2 -> 2.2
A15: Vishay | B15: TSOP1138 | C15: of:=1.67*vat -> 2.0541 | D15: http://www.tme.eu/pl/details/tsop1138/odbiorniki-podczerwieni-scalone/# | E15: 940 | F15: 38 | G15: 4.5 | H15: 5.5 | I15: 1 | J15: of:=1000*1/2200/2 -> 0.227272727272727 | K15: of:=1/[.J15]/2 -> 2.2
A16: Vishay | B16: TSOP1238 | C16: of:=2.46*vat -> 3.0258 | D16: http://www.tme.eu/pl/details/tsop1238/odbiorniki-podczerwieni-scalone/vishay/# | E16: 940 | F16: 38 | G16: 4.5 | H16: 5.5 | I16: 1.5 | J16: of:=1000*1/800/2 -> 0.625 | K16: of:=1/[.J16]/2 -> 0.8
A17: Vishay | B17: TSOP2236 | C17: 1.8119 | D17: https://sklep.eltron.pl/product-view.html?id=189811&gn=4&productGroup=92 | E17: 940 | F17: 36 | G17: 4.5 | H17: 5.5 | I17: 1.1 | J17: of:=1000*1/800/2 -> 0.625 | K17: of:=1/[.J17]/2 -> 0.8
A18: Vishay | B18: TSOP2238 | C18: 1.6304 | D18: https://sklep.eltron.pl/product-view.html?id=189812&gn=4&productGroup=92 | E18: 940 | F18: 38 | G18: 4.5 | H18: 5.5 | I18: 1.1 | J18: of:=1000*1/800/2 -> 0.625 | K18: of:=1/[.J18]/2 -> 0.8
A19: Vishay | B19: TSOP31236 | C19: 1.5007 | D19: https://sklep.eltron.pl/product-view.html?id=200097&gn=4&productGroup | E19: 940 | F19: 36 | G19: 2.5 | H19: 5.5 | I19: 0.35 | J19: of:=1000*1/1800/2 -> 0.277777777777778 | K19: of:=1/[.J19]/2 -> 1.8
A20: Vishay | B20: TSOP31238 | C20: 1.5007 | D20: https://sklep.eltron.pl/product-view.html?id=200098&gn=4&productGroup | E20: 940 | F20: 38 | G20: 2.5 | H20: 5.5 | I20: 0.35 | J20: of:=1000*1/1800/2 -> 0.277777777777778 | K20: of:=1/[.J20]/2 -> 1.8
A21: Vishay | B21: TSOP31240 | C21: 1.7666 | D21: https://sklep.eltron.pl/product-view.html?id=189813&gn=4&productGroup=92 | E21: 940 | F21: 40 | G21: 2.5 | H21: 5.5 | I21: 0.35 | J21: of:=1000*1/1800 -> 0.555555555555556 | K21: of:=1/[.J21]/2 -> 0.9
A22: Vishay | B22: TSOP32156 | C22: of:=1.54*vat -> 1.8942 | D22: http://www.tme.eu/pl/details/tsop32156/odbiorniki-podczerwieni-scalone/vishay/# | E22: 950 | F22: 56 | G22: 2.7 | H22: 5.5 | I22: 1.2 | J22: of:=1000*1/2200/2 -> 0.227272727272727 | K22: of:=1/[.J22]/2 -> 2.2
A23: Vishay | B23: TSOP32230 | C23: of:=2.02*vat -> 2.4846 | D23: http://www.tme.eu/pl/details/tsop32230/odbiorniki-podczerwieni-scalone/vishay/# | E23: 950 | F23: 30 | G23: 2.7 | H23: 5.5 | I23: 1.2 | J23: of:=1000*1/800/2 -> 0.625 | K23: of:=1/[.J23]/2 -> 0.8
A24: Vishay | B24: TSOP34830 | C24: of:=1.48*vat -> 1.8204 | D24: http://www.tme.eu/pl/details/tsop34830/odbiorniki-podczerwieni-scalone/vishay/# | E24: 950 | F24: 30 | G24: 2.7 | H24: 5.5 | I24: 1.2 | J24: of:=1000*1/800/2 -> 0.625 | K24: of:=1/[.J24]/2 -> 0.8
A25: Vishay | B25: TSOP34836 | C25: 1.4131 | D25: https://sklep.eltron.pl/product-view.html?id=189815&gn=4&productGroup=92 | E25: 950 | F25: 36 | G25: 2.7 | H25: 5.5 | I25: 1.2 | J25: of:=1000*1/800 -> 1.25 | K25: of:=1/[.J25]/2 -> 0.4
A26: Vishay | B26: TSOP34838 | C26: 1.4494 | D26: https://sklep.eltron.pl/product-view.html?id=189816&gn=4&productGroup=92 | E26: 950 | F26: 38 | G26: 2.7 | H26: 5.5 | I26: 1.2 | J26: of:=1000*1/800/2 -> 0.625 | K26: of:=1/[.J26]/2 -> 0.8
A27: Vishay | B27: TSOP4133 | C27: of:=2.14*vat -> 2.6322 | D27: http://www.tme.eu/pl/details/tsop4133/odbiorniki-podczerwieni-scalone/vishay/# | E27: 950 | F27: 33 | G27: 4.5 | H27: 5.5 | I27: 1.2 | J27: of:=1000*1/2200/2 -> 0.227272727272727 | K27: of:=1/[.J27]/2 -> 2.2
A28: Vishay | B28: TSOP4833 | C28: of:=1.42*vat -> 1.7466 | D28: http://www.tme.eu/pl/details/tsop4833/odbiorniki-podczerwieni-scalone/vishay/# | E28: 950 | F28: 33 | G28: 4.5 | H28: 5.5 | I28: 1.2 | J28: of:=1000*1/800/2 -> 0.625 | K28: of:=1/[.J28]/2 -> 0.8
A29: Vishay | B29: TSOP4836 | C29: of:=1.86*vat -> 2.2878 | D29: http://www.tme.eu/pl/details/tsop4836/odbiorniki-podczerwieni-scalone/vishay/# | E29: 950 | F29: 36 | G29: 4.5 | H29: 5.5 | I29: 1.2 | J29: of:=1000*1/800/2 -> 0.625 | K29: of:=1/[.J29]/2 -> 0.8
A30: Vishay | B30: TSOP4838 | C30: of:=1.67*vat -> 2.0541 | D30: http://www.tme.eu/pl/details/tsop4838/odbiorniki-podczerwieni-scalone/vishay/# | E30: 950 | F30: 38 | G30: 4.5 | H30: 5.5 | I30: 1.2 | J30: of:=1000*1/800/2 -> 0.625 | K30: of:=1/[.J30]/2 -> 0.8
A31: Vishay | B31: TSOP4840 | C31: 1.5186 | D31: https://sklep.eltron.pl/product-view.html?id=189818&gn=4&productGroup=92 | E31: 950 | F31: 40 | G31: 4.5 | H31: 5.5 | I31: 1.2 | J31: of:=1000*1/800/2 -> 0.625 | K31: of:=1/[.J31]/2 -> 0.8
A32: Everlight | B32: ELIRM2638 | C32: 1.3167 | D32: https://sklep.eltron.pl/product-view.html?id=175418&gn=4&productGroup=92 | E32: 940 | F32: 38 | G32: 5 | H32: 5 | I32: 1.2 | J32: 0.8 | K32: of:=1/[.J32]/2 -> 0.625
A33: Everlight | B33: ELIRM2638F4 | C33: 1.794 | D33: https://sklep.eltron.pl/product-view.html?id=175420&gn=4&productGroup=92 | E33: 940 | F33: 38 | G33: 5 | H33: 5 | I33: 1.2 | J33: 0.8 | K33: of:=1/[.J33]/2 -> 0.625
A34: Everlight | B34: ELIRM2756 | C34: 2.6692 | D34: https://sklep.eltron.pl/product-view.html?id=175425&gn=4&productGroup=92 | E34: 940 | F34: 56 | G34: 5 | H34: 5 | I34: 1.2 | J34: 0.8 | K34: of:=1/[.J34]/2 -> 0.625
A35: Everlight | B35: ELIRM8752M2 | C35: 2.1923 | D35: https://sklep.eltron.pl/product-view.html?id=192862&gn=4&productGroup=92 | E35: 940 | F35: 56 | G35: 5 | H35: 5 | I35: 2 | J35: 0.8 | K35: of:=1/[.J35]/2 -> 0.625
A36: Siemens | B36: SFH506 | E36: 950 | F36: 30,33,36 | G36: 4.5 | H36: 5.5 | I36: 0.6 | L36: EOLed
A37: Siemens | B37: SFH5110 | E37: 940 | F37: 30,33,36,38,40 | G37: 4.5 | H37: 5.5 | I37: 1.3