Sheet: Arkusz1
A1: MCU Comparison
A3: VAT rate | B3: 0.23 | C3: of:=1+[.B3] -> 1.23
A4: Supply min | B4: 2.5 | C4: V
A5: Supply max | B5: 4.5 | C5: V
K6: Oscillator
A7: Vendor | B7: Model | C7: Price | D7: URL | E7: Package | F7: I/Os | G7: Program memory | H7: RAM memory | I7: NV memory | J7: Timers | K7: Drift | L7: Accuracy | M7: ADC channels | N7: ADC accuracy | O7: Comparators | P7: DAC channels | Q7: DAC accuracy | R7: Min voltage | S7: Max voltage | T7: Suspend current [nA] | U7: Active current [uA] | V7: OSS toolchain | W7: OSS programmer | X7: Temp range | Y7: bootloader
A8: Atmel | B8: ATtiny13A-SU | C8: of:=1.98*vat -> 2.4354 | D8: http://www.tme.eu/pl/details/attiny13a-su/mikrokontrolery-atmel-avr-smd/atmel/# | E8: SOIC8 | F8: 5 | G8: 1024 | H8: 64 | I8: 64 | J8: 1x8, 0x16 | R8: 1.8 | S8: 5.5
A9: Atmel | B9: ATtiny13A-SSU | C9: 2.3682 | D9: https://sklep.eltron.pl/product-view.html?id=170953&gn=4&productGroup=123 | E9: SOIC8 | F9: 5 | G9: 1024 | H9: 64 | I9: 64 | J9: 1x8, 0x16 | R9: 1.8 | S9: 5.5
A10: Microchip | B10: PIC10F204T-I/OT | C10: 1.7905 | D10: https://sklep.eltron.pl/product-view.html?id=183334&gn=4&productGroup=124 | E10: SOT23-6 | F10: 4? | G10: 375 | H10: 16 | J10: 1x8, 0x16 | R10: 2 | S10: 5.5
A11: Microchip | B11: PIC10F206T-I/OT | C11: 1.9639 | D11: https://sklep.eltron.pl/product-view.html?id=183336&gn=4&productGroup=124 | E11: SOT23-6 | F11: 4? | G11: 750 | H11: 24 | R11: 2 | S11: 5.5
A12: Microchip | B12: PIC16F54-I/SO | C12: 2.1948 | D12: https://sklep.eltron.pl/product-view.html?id=183424&gn=4&productGroup=124 | E12: SO18 | F12: 12 | G12: 750 | H12: 25 | J12: 1x8, 0x16 | R12: 2 | S12: 5.5
A13: Microchip | B13: ATtiny10-T8SR | C13: of:=2.7*vat -> 3.321 | D13: http://www.tme.eu/pl/details/attiny10-ts8r/mikrokontrolery-atmel-avr-smd/atmel/# | E13: SOT23-6 | F13: 3? | G13: 1024 | H13: 32 | R13: 1.8 | S13: 5.5
A14: Microchip | B14: PIC10LF320-I/OT | C14: of:=1.9*vat -> 2.337 | D14: http://www.tme.eu/pl/details/pic10lf320-i_ot/mikrokontrolery-microchip-8-bit/microchip-technology/# | E14: SOT23-6 | F14: 4? | G14: 448 | H14: 64 | J14: 2x8, ?x16b | R14: 1.8 | S14: 5.5
A15: Atmel | B15: ATtiny24A-SSU | C15: of:=1.96*vat -> 2.4108 | D15: http://www.tme.eu/pl/details/attiny24a-ssu/mikrokontrolery-atmel-avr-smd/atmel/# | E15: SOIC14 | F15: 11? | G15: 2048 | H15: 128 | I15: 128 | J15: 1x8, 1x16 | R15: 1.8 | S15: 5.5
A16: Microchip | B16: PIC16F505-I/SL | C16: of:=1.95*vat -> 2.3985 | D16: http://www.tme.eu/pl/details/pic16f505-i_sl/mikrokontrolery-microchip-8-bit/microchip-technology/# | E16: SO14 | F16: 12? | G16: 1500 | H16: 72 | J16: 1x8, ?x16 | R16: 2 | S16: 5.5
A17: Atmel | B17: ATTiny10-TSHR | C17: of:=2.6*vat -> 3.198 | D17: http://www.tme.eu/pl/details/attiny10-tshr/mikrokontrolery-atmel-avr-smd/atmel/# | E17: SOT23-6 | F17: 4? | G17: 1024 | H17: 32 | R17: 1.8 | S17: 5.5
A18: Microchip | B18: PIC10F222T-I/OT | C18: 2.2529 | D18: https://sklep.eltron.pl/product-view.html?id=183338&gn=4&productGroup=124 | E18: SOT23-6 | F18: 4? | G18: 750 | H18: 23 | J18: 1x8, ?x16 | R18: 2 | S18: 5.5
A19: Microchip | B19: PIC12F508-E/SN | C19: of:=2.35*vat -> 2.8905 | D19: http://www.tme.eu/pl/details/pic12f508-e_sn/mikrokontrolery-microchip-8-bit/microchip-technology/# | E19: SO8 | F19: 6? | G19: 750 | H19: 25 | J19: 1x8, ?x16 | R19: 2 | S19: 5.5
A20: Microchip | B20: PIC12F509-I/SN | C20: 2.4262 | D20: https://sklep.eltron.pl/product-view.html?id=183357&gn=4&productGroup=124 | E20: SO8 | F20: 6? | G20: 1500 | H20: 41 | J20: 1x8, ?x16 | R20: 2 | S20: 5.5
A21: Microchip | B21: PIC12F510-I/SN | C21: 2.6572 | D21: https://sklep.eltron.pl/product-view.html?id=183359&gn=4&productGroup=124 | E21: SO8 | F21: 6? | G21: 1500 | H21: 38 | J21: 1x8, ?x16 | R21: 2 | S21: 5.5
A22: Microchip | B22: PIC16F54-I/SS | C22: of:=2.45*vat -> 3.0135 | D22: http://www.tme.eu/pl/details/pic16f54-i_ss/mikrokontrolery-microchip-8-bit/microchip-technology/# | E22: SSOP18 | F22: 12? | G22: 750 | H22: 25 | J22: 1x8, 0x16 | R22: 2 | S22: 5.5
A23: Microchip | B23: PIC12F609-I/SN | C23: 2.8305 | D23: https://sklep.eltron.pl/product-view.html?id=183363&gn=4&productGroup=124 | E23: SO8 | F23: 5? | G23: 1750 | H23: 64 | J23: 1x8, 1x16 | R23: 2 | S23: 5.5
A24: Microchip | B24: PIC12F615-I/SN | C24: 2.9458 | D24: https://sklep.eltron.pl/product-view.html?id=183365&gn=4&productGroup=124 | E24: SO8 | F24: 6? | G24: 1750 | H24: 64 | J24: 2x8, 1x16b | R24: 2 | S24: 5.5
A25: Microchip | B25: PIC12F1501-E/SN | C25: of:=2.8*vat -> 3.444 | D25: http://www.tme.eu/pl/details/pic12f1501-e_sn/mikrokontrolery-microchip-8-bit/microchip-technology/# | E25: SO8 | F25: 6? | G25: 1750 | H25: 64 | J25: 2x8, 1x16b | R25: 1.8 | S25: 5.5
A26: Microchip | B26: PIC12LF1501-E/MS | C26: of:=2.8*vat -> 3.444 | D26: http://www.tme.eu/pl/details/pic12lf1501-e_ms/mikrokontrolery-microchip-8-bit/microchip-technology/# | E26: MSOP8 | F26: 6? | G26: 1750 | H26: 64 | J26: 2x8, 1x16b | R26: 1.8 | S26: 5.5
A27: Microchip | B27: PIC12LF1501-E/SN | C27: of:=2.8*vat -> 3.444 | D27: http://www.tme.eu/pl/details/pic12lf1501-e_sn/mikrokontrolery-microchip-8-bit/microchip-technology/# | E27: SO8 | F27: 6? | G27: 1750 | H27: 64 | J27: 2x8, 1x16b | R27: 1.8 | S27: 5.5
A28: Microchip | B28: PIC12F1822-I/SN | C28: of:=2.9*vat -> 3.567 | D28: http://www.tme.eu/pl/details/pic12f1822-i_sn/mikrokontrolery-microchip-8-bit/microchip-technology/# | E28: SO8 | F28: 6? | G28: 3500 | H28: 128 | I28: 256 | J28: 2x8, 1x16b | R28: 1.8 | S28: 5.5
A29: Atmel | B29: ATTINY44A-SSU | C29: 3.2925 | D29: https://sklep.eltron.pl/product-view.html?id=170982&gn=4&productGroup=123 | E29: SO14 | F29: 12? | G29: 4096 | H29: 256 | I29: 256 | J29: 2x8, 1x16b | R29: 1.8 | S29: 5.5
A30: Microchip | B30: PIC12F609-E/SN | C30: of:=3.05*vat -> 3.7515 | D30: http://www.tme.eu/pl/details/pic12f609-e_sn/mikrokontrolery-microchip-8-bit/microchip-technology/# | E30: SO8 | F30: 5? | G30: 1750 | H30: 64 | J30: 1x8, 1x16 | R30: 2 | S30: 5.5
A31: Microchip | B31: PIC12F752-I/SN | C31: of:=3.05*vat -> 3.7515 | D31: http://www.tme.eu/pl/details/pic12f752-i_sn/mikrokontrolery-microchip-8-bit/microchip-technology/# | E31: SO8 | F31: 6? | G31: 1750 | H31: 64 | J31: 2x8, 1x16b | R31: 2 | S31: 5.5
A32: Microchip | B32: PIC12HV609-I/SN | C32: of:=3*vat -> 3.69 | D32: http://www.tme.eu/pl/details/pic12hv609-i_sn/mikrokontrolery-microchip-8-bit/microchip-technology/# | E32: SO8 | F32: 5? | G32: 1750 | H32: 64 | J32: 1x8, 1x16 | R32: 2 | S32: 15
A33: Microchip | B33: PIC12HV615-I/SN | C33: of:=3.05*vat -> 3.7515 | D33: http://www.tme.eu/pl/details/pic12hv615-i_sn/mikrokontrolery-microchip-8-bit/microchip-technology/# | E33: SO8 | F33: 6? | G33: 1750 | H33: 64 | J33: 2x8, 1x16b | R33: 2 | S33: 15
A34: Atmel | B34: ATMEGA48V-10AU | C34: of:=3.19*vat -> 3.9237 | D34: http://www.tme.eu/pl/details/atmega48v-10au/mikrokontrolery-atmel-avr-smd/atmel/# | E34: TQFP32 | F34: 23? | G34: 4096 | H34: 512 | I34: 256 | J34: 2x8, 1x16b | R34: 1.8 | S34: 5.5
A35: Microchip | B35: PIC12F617-I/SN | C35: of:=3.15*vat -> 3.8745 | D35: http://www.tme.eu/pl/details/pic12f617-i_sn/mikrokontrolery-microchip-8-bit/microchip-technology/# | E35: SO8 | F35: 6? | G35: 3500 | H35: 128 | J35: 2x8, 1x16b | R35: 2 | S35: 5.5
A36: Microchip | B36: PIC16F610-I/SL | C36: 3.1772 | D36: https://sklep.eltron.pl/product-view.html?id=183429&gn=4&productGroup=124 | E36: SO14 | F36: 12? | G36: 1750 | H36: 64 | J36: 1x8, 1x16 | R36: 2 | S36: 5.5
A37: Microchip | B37: PIC12F1840-I/SN | C37: of:=3.2*vat -> 3.936 | D37: http://www.tme.eu/pl/details/pic12f1840-i_sn/mikrokontrolery-microchip-8-bit/microchip-technology/# | E37: SO8 | F37: 6? | G37: 7000 | H37: 256 | I37: 256 | J37: 2x8, 1x16b | R37: 1.8 | S37: 5.5
A38: Microchip | B38: PIC12F629-I/SN | C38: 3.8125 | D38: https://sklep.eltron.pl/product-list.html?combined1=PIC12F629-I%2FSN | E38: SO8 | F38: 6? | G38: 1750 | H38: 64 | I38: 128 | J38: 1x8, 1x16 | R38: 2 | S38: 5.5
A39: Microchip | B39: PIC16F57-I/SS | C39: of:=3.25*vat -> 3.9975 | D39: http://www.tme.eu/pl/details/pic16f57-i_ss/mikrokontrolery-microchip-8-bit/microchip-technology/# | E39: SSOP28 | F39: 20? | G39: 3000 | H39: 72 | J39: 1x8, 0x16 | R39: 2 | S39: 5.5
A40: Atmel | B40: ATTINY2313A-SU | C40: of:=3.12*vat -> 3.8376 | D40: http://www.tme.eu/pl/details/attiny2313a-su/mikrokontrolery-atmel-avr-smd/atmel/# | E40: SOIC20 | F40: 18? | G40: 2048 | H40: 128 | I40: 128 | J40: 1x8, 1x16 | R40: 1.8 | S40: 5.5
A41: Microchip | B41: PIC12HV609-E/SN | C41: of:=3.35*vat -> 4.1205 | D41: http://www.tme.eu/pl/details/pic12hv609-e_sn/mikrokontrolery-microchip-8-bit/microchip-technology/# | E41: SO8 | F41: 5? | G41: 1750 | H41: 64 | J41: 1x8, 1x16 | R41: 2 | S41: 15
A42: Microchip | B42: PIC16F616-I/SL | C42: 3.7548 | D42: https://sklep.eltron.pl/product-list.html?combined1=PIC16F616-I%2FSL | E42: SO14 | F42: 12? | G42: 3500 | H42: 128 | J42: 2x8, 1x16b | R42: 2 | S42: 15
A43: Microchip | B43: PIC16F720-I/SS | C43: of:=3.4*vat -> 4.182 | D43: http://www.tme.eu/pl/details/pic16f720-i_ss/mikrokontrolery-microchip-8-bit/microchip-technology/# | E43: SSOP20 | F43: 18? | G43: 3500 | H43: 128 | J43: 2x8, 1x16b | R43: 1.8 | S43: 5.5
A44: Atmel | B44: ATTINY24A-SSF | C44: of:=3.57*vat -> 4.3911 | D44: http://www.tme.eu/pl/details/attiny24a-ssf/mikrokontrolery-atmel-avr-smd/atmel/# | E44: SOIC14 | F44: 12? | G44: 2048 | H44: 128 | I44: 128 | J44: 1x8, 1x16 | R44: 1.8 | S44: 5.5
A45: Microchip | B45: PIC12F617-I/MS | C45: of:=3.45*vat -> 4.2435 | D45: http://www.tme.eu/pl/details/pic12f617-i_ms/mikrokontrolery-microchip-8-bit/microchip-technology/# | E45: MSOP8 | F45: 6? | G45: 3500 | H45: 128 | J45: 2x8, 1x16b | R45: 2 | S45: 5.5
A46: Microchip | B46: PIC16HV610-I/SL | C46: of:=3.45*vat -> 4.2435 | D46: http://www.tme.eu/pl/details/pic16hv610-i_sl/mikrokontrolery-microchip-8-bit/microchip-technology/# | E46: SO14 | F46: 12? | G46: 1750 | H46: 64 | J46: 1x8, 1x16 | R46: 2 | S46: 15
A47: Microchip | B47: PIC16LF1826-I/SS | C47: of:=3*vat -> 3.69 | D47: http://www.tme.eu/pl/details/pic16lf1826-iss/mikrokontrolery-microchip-8-bit/microchip-technology/pic16lf1826-iss/# | E47: SSOP20 | F47: 16? | G47: 3500 | H47: 256 | I47: 256 | J47: 2x8, 1x16b | R47: 1.8 | S47: 5.5
A48: Microchip | B48: PIC12F617-E/SN | C48: of:=3.5*vat -> 4.305 | D48: http://www.tme.eu/pl/details/pic12f617-e_sn/mikrokontrolery-microchip-8-bit/microchip-technology/# | E48: SO8 | F48: 6? | G48: 3500 | H48: 128 | J48: 2x8, 1x16b | R48: 2 | S48: 5.5
A49: Microchip | B49: PIC12F675-I/SN | C49: 4.2168 | D49: https://sklep.eltron.pl/product-list.html?combined1=PIC12F675-I%2FSN | E49: SO8 | F49: 6? | G49: 1750 | H49: 64 | I49: 128 | J49: 1x8, 1x16 | R49: 2 | S49: 5.5
A50: Microchip | B50: PIC16F610-E/SL | C50: of:=3.5*vat -> 4.305 | D50: http://www.tme.eu/pl/details/pic16f610-e_sl/mikrokontrolery-microchip-8-bit/microchip-technology/# | E50: SO14 | F50: 12? | G50: 1750 | H50: 64 | J50: 1x8, 1x16 | R50: 2 | S50: 5.5
A51: Microchip | B51: PIC12F617-E/MS | C51: of:=3.65*vat -> 4.4895 | D51: http://www.tme.eu/pl/details/pic12f617-e_ms/mikrokontrolery-microchip-8-bit/microchip-technology/# | E51: MSOP8 | F51: 6? | G51: 3500 | H51: 128 | J51: 2x8, 1x16b | R51: 2 | S51: 5.5
A52: Microchip | B52: PIC16F610-I/ST | C52: of:=3.65*vat -> 4.4895 | D52: http://www.tme.eu/pl/details/pic16f610-i_st/mikrokontrolery-microchip-8-bit/microchip-technology/# | E52: TSSOP14 | F52: 12? | G52: 1750 | H52: 64 | J52: 1x8, 1x16 | R52: 2 | S52: 5.5
A53: Microchip | B53: PIC16F610-E/ST | C53: of:=3.3*vat -> 4.059 | D53: http://www.tme.eu/pl/details/pic16f610-e_st/mikrokontrolery-microchip-8-bit/microchip-technology/# | E53: TSSOP14 | F53: 12? | G53: 1750 | H53: 64 | J53: 1x8, 1x16 | R53: 2 | S53: 5.5
A54: Atmel | B54: ATMEGA88PA-AU | C54: of:=3.86*vat -> 4.7478 | D54: http://www.tme.eu/pl/details/atmega88pa-au/mikrokontrolery-atmel-avr-smd/atmel/# | E54: TQFP32 | F54: 23? | G54: 8192 | H54: 1024 | I54: 512 | J54: 2x8, 1x16b | R54: 1.8 | S54: 5.5
A55: Microchip | B55: PIC16HV610-E/SL | C55: of:=3.85*vat -> 4.7355 | D55: http://www.tme.eu/pl/details/pic16hv610-e_sl/mikrokontrolery-microchip-8-bit/microchip-technology/# | E55: SO14 | F55: 12? | G55: 1750 | H55: 72 | J55: 1x8, 1x16 | R55: 2 | S55: 15
A56: Microchip | B56: PIC16HV610-I/ST | C56: of:=3.9*vat -> 4.797 | D56: http://www.tme.eu/pl/details/pic16hv610-i_st/mikrokontrolery-microchip-8-bit/microchip-technology/# | E56: TSSOP14 | F56: 12? | G56: 1750 | H56: 64 | J56: 1x8, 1x16 | R56: 2 | S56: 15
A57: Microchip | B57: PIC16LF1826-I/SO | C57: of:=3.9*vat -> 4.797 | D57: http://www.tme.eu/pl/details/pic16lf1826-iso/mikrokontrolery-microchip-8-bit/microchip-technology/pic16lf1826-iso/# | E57: SO18 | F57: 16? | G57: 3500 | H57: 256 | I57: 256 | J57: 2x8, 1x16b | R57: 1.8 | S57: 5.5
A58: Microchip | B58: PIC16F721-I/SS | C58: of:=4.15*vat -> 5.1045 | D58: http://www.tme.eu/pl/details/pic16f721-i_ss/mikrokontrolery-microchip-8-bit/microchip-technology/# | E58: SSOP20 | F58: 18? | G58: 7000 | H58: 256 | J58: 2x8, 1x16b | R58: 1.8 | S58: 5.5
A59: Microchip | B59: PIC16F1508-I/SS | C59: of:=3.95*vat -> 4.8585 | D59: http://www.tme.eu/pl/details/pic16f1508-i_ss/mikrokontrolery-microchip-8-bit/microchip-technology/# | E59: SSOP20 | F59: 18? | G59: 7000 | H59: 256 | J59: 2x8, 1x16b | R59: 1.8 | S59: 5.5
A60: Microchip | B60: PIC16LF1508-I/SS | C60: of:=3.95*vat -> 4.8585 | D60: http://www.tme.eu/pl/details/pic16lf1508-i_ss/mikrokontrolery-microchip-8-bit/microchip-technology/# | E60: SSOP20 | F60: 18? | G60: 7000 | H60: 256 | J60: 2x8, 1x16b | R60: 1.8 | S60: 5.5
A61: Microchip | B61: PIC12F683-I/SN | C61: 5.0254 | D61: https://sklep.eltron.pl/product-view.html?id=183372&gn=4&productGroup=124 | E61: SO8 | F61: 6? | G61: 3500 | H61: 256 | I61: 128 | J61: 2x8, 1x16b | R61: 2 | S61: 5.5
A62: Microchip | B62: PIC16F720-I/SO | C62: of:=4.4*vat -> 5.412 | D62: http://www.tme.eu/pl/details/pic16f720-i_so/mikrokontrolery-microchip-8-bit/microchip-technology/# | E62: SO20 | F62: 18? | G62: 3500 | H62: 128 | J62: 2x8, 1x16b | R62: 1.8 | S62: 5.5
A63: Microchip | B63: PIC16HV610-E/ST | C63: of:=4.2*vat -> 5.166 | D63: http://www.tme.eu/pl/details/pic16hv610-e_st/mikrokontrolery-microchip-8-bit/microchip-technology/# | E63: TSSOP14 | F63: 12? | G63: 1750 | H63: 72 | J63: 1x8, 1x16 | R63: 2 | S63: 15
A64: Microchip | B64: PIC16LF1827-I/SO | C64: of:=4.3*vat -> 5.289 | D64: http://www.tme.eu/pl/details/pic16lf1827-iso/mikrokontrolery-microchip-8-bit/microchip-technology/pic16lf1827-iso/# | E64: SO18 | F64: 16? | G64: 7000 | H64: 384 | I64: 256 | J64: 4x8, 1x16b | R64: 1.8 | S64: 5.5
A65: Atmel | B65: ATTINY4313-SU | C65: of:=4.32*vat -> 5.3136 | D65: http://www.tme.eu/pl/details/attiny4313-su/mikrokontrolery-atmel-avr-smd/atmel/# | E65: SO20 | F65: 18? | G65: 4096 | H65: 256 | I65: 256 | J65: 1x8, 1x16 | R65: 1.8 | S65: 5.5
A66: Microchip | B66: PIC16F1509-I/SS | C66: of:=4.15*vat -> 5.1045 | D66: http://www.tme.eu/pl/details/pic16f1509-i_ss/mikrokontrolery-microchip-8-bit/microchip-technology/# | E66: SSOP20 | F66: 18? | G66: 14000 | H66: 512 | J66: 2x8, 1x16b | R66: 1.8 | S66: 5.5
A67: Microchip | B67: PIC16LF1509-I/SS | C67: of:=4.15*vat -> 5.1045 | D67: http://www.tme.eu/pl/details/pic16lf1509-i_ss/mikrokontrolery-microchip-8-bit/microchip-technology/# | E67: SSOP20 | F67: 18? | G67: 14000 | H67: 512 | J67: 2x8, 1x16b | R67: 1.8 | S67: 5.5
A68: Microchip | B68: PIC16F716-I/SO | C68: 4.2168 | D68: https://sklep.eltron.pl/product-view.html?id=183470&gn=4&productGroup=124 | E68: SO18 | F68: 13? | G68: 3500 | H68: 128 | J68: 2x8, 1x16b | R68: 2 | S68: 5.5
A69: Microchip | B69: PIC16F721-I/SO | C69: of:=4.35*vat -> 5.3505 | D69: http://www.tme.eu/pl/details/pic16f721-i_so/mikrokontrolery-microchip-8-bit/microchip-technology/# | E69: SO20 | F69: 18? | G69: 7000 | H69: 256 | J69: 2x8, 1x16b | R69: 1.8 | S69: 5.5
A70: Microchip | B70: PIC16HV616-I/SL | C70: of:=4.35*vat -> 5.3505 | D70: http://www.tme.eu/pl/details/pic16hv616-i_sl/mikrokontrolery-microchip-8-bit/microchip-technology/# | E70: SO14 | F70: 12? | G70: 3500 | H70: 128 | J70: 2x8, 1x16b | R70: 2 | S70: 15
A71: Microchip | B71: PIC12F1840-E/SN | C71: of:=4.45*vat -> 5.4735 | D71: http://www.tme.eu/pl/details/pic12f1840-e_sn/mikrokontrolery-microchip-8-bit/microchip-technology/# | E71: SO8 | F71: 6? | G71: 7000 | H71: 256 | I71: 256 | J71: 2x8, 1x16b | R71: 1.8 | S71: 5.5
A72: Microchip | B72: PIC16F1508-E/SS | C72: of:=4.3*vat -> 5.289 | D72: http://www.tme.eu/pl/details/pic16f1508-e_ss/mikrokontrolery-microchip-8-bit/microchip-technology/# | E72: SSOP20 | F72: 18? | G72: 7000 | H72: 256 | J72: 2x8, 1x16b | R72: 1.8 | S72: 5.5
A73: Microchip | B73: PIC16LF1508-E/SS | C73: of:=4.3*vat -> 5.289 | D73: http://www.tme.eu/pl/details/pic16lf1508-e_ss/mikrokontrolery-microchip-8-bit/microchip-technology/# | E73: SSOP20 | F73: 18? | G73: 7000 | H73: 256 | J73: 2x8, 1x16b | R73: 1.8 | S73: 5.5
A74: Microchip | B74: PIC12F629-E/SN | C74: of:=4.55*vat -> 5.5965 | D74: http://www.tme.eu/pl/details/pic12f629-e_sn/mikrokontrolery-microchip-8-bit/microchip-technology/# | E74: SO8 | F74: 6? | G74: 1750 | H74: 128 | I74: 64 | J74: 1x8, 1x16 | R74: 2 | S74: 5.5
A75: Microchip | B75: PIC16F1824-I/SL | C75: of:=4.35*vat -> 5.3505 | D75: http://www.tme.eu/pl/details/pic16f1824-i_sl/mikrokontrolery-microchip-8-bit/microchip-technology/# | E75: SO14 | F75: 12? | G75: 7000 | H75: 256 | I75: 256 | J75: 4x8, 1x16b | R75: 1.8 | S75: 5.5