Sheet: Sheet1
A1: AC induction motor power, currents and voltages
A3: Data | B3: value | C3: unit | D3: source
A4: Discharging battery voltage | B4: 3 | C4: V | D4: http://en.winston-battery.com/index.php/products/power-battery/item/wb-lyp60aha?category_id=176
A5: Charged battery voltage | B5: 4 | C5: V | D5: http://en.winston-battery.com/index.php/products/power-battery/item/wb-lyp60aha?category_id=176
A6: Cell internal resistance | B6: 0.0007 | C6: Ω | D6: http://www.ev-power.eu/docs/pdf/Winston-InternalResistance.pdf
A7: Amount of cells in series | B7: 43
A8: Motor power factor | B8: 0.83 | D8: http://tamel.pl/pdf/data-sheets/aluminium/4pole/b35/data%20sheet%20-%20WU-DA132MVX-H%204P-132W327421T-7,5%20kW%20IE2.pdf
A9: Motor efficiency | B9: 0.887 | D9: http://tamel.pl/pdf/data-sheets/aluminium/4pole/b35/data%20sheet%20-%20WU-DA132MVX-H%204P-132W327421T-7,5%20kW%20IE2.pdf
A10: Desired controller efficiency | B10: 0.97
A11: Desired output power | B11: 15000 | C11: W
A12: Voltage safety margin | B12: 0.5
A14: Intermediate values
A15: Electrical output power | B15: of:=mechanical_power/motor_eff -> 16910.9357384442 | C15: W | D15: http://en.wikipedia.org/wiki/Energy_conversion_efficiency#Overview
A16: Electrical input power | B16: of:=motor_power/controller_eff -> 17433.9543695301 | C16: W | D16: http://en.wikipedia.org/wiki/Energy_conversion_efficiency#Overview
A17: Pack internal resistance | B17: of:=cell_resistance*cell_count -> 0.0301 | C17: Ω | D17: http://en.wikipedia.org/wiki/Series_and_parallel_circuits#Resistors
A18: Idle battery pack voltage | B18: of:=cell_voltage*cell_count -> 129 | C18: V | D18: http://en.wikipedia.org/wiki/Series_and_parallel_circuits#Cells_and_batteries
A19: Charged battery pack voltage | B19: of:=cell_charged_voltage*cell_count -> 172 | C19: V | D19: http://en.wikipedia.org/wiki/Series_and_parallel_circuits#Cells_and_batteries
A20: Battery pack current | B20: of:=(pack_voltage-SQRT(pack_voltage^2-4*pack_resistance*supply_power))/(2*pack_resistance) -> 139.70073537194 | C20: A | D20: http://en.wikipedia.org/wiki/Electric_power#Definition
A21: Battery pack sag | B21: of:=pack_resistance*pack_current -> 4.2049921346954 | C21: V | D21: http://en.wikipedia.org/wiki/Ohm's_law#Circuit_analysis
A22: Pack voltage under load | B22: of:=pack_voltage-pack_sag -> 124.795007865305 | C22: V | D22: http://en.wikipedia.org/wiki/Kirchhoff's_circuit_laws#Kirchhoff.27s_voltage_law_.28KVL.29
A23: Max pack voltage on regen | B23: of:=pack_charged_voltage+pack_sag -> 176.204992134695 | C23: V | D23: http://en.wikipedia.org/wiki/Kirchhoff's_circuit_laws#Kirchhoff.27s_voltage_law_.28KVL.29
A24: Apparent power | B24: of:=motor_power/pf -> 20374.6213716195 | C24: VA | D24: http://en.wikipedia.org/wiki/Power_factor#Definition_and_calculation
A25: Peak to peak phase voltage | B25: of:=pack_load_voltage/controller_eff -> 128.654647283819 | C25: V
A26: Peak phase voltage | B26: of:=phase_p2p_voltage/2 -> 64.3273236419096 | C26: V | D26: http://en.wikipedia.org/wiki/Amplitude
A27: RMS phase voltage | B27: of:=phase_peak_voltage/SQRT(2) -> 45.486286762776 | C27: V | D27: http://en.wikipedia.org/wiki/Root_mean_square#RMS_of_common_waveforms
A28: Phase-phase voltage | B28: of:=phase_rms_voltage*SQRT(3) -> 78.7845597207757 | C28: V | D28: http://en.wikipedia.org/wiki/Three-phase_electric_power#Single-phase_loads
A29: RMS Motor current | B29: of:=apparent_power/phase_phase_voltage/SQRT(3) -> 149.309625835723 | C29: A | D29: http://www.cerusind.com/catalog/documents/calculators/MotorEngineeringFormulas.pdf
A30: Motor peak current | B30: of:=motor_rms_current*SQRT(2) -> 211.155697849732 | C30: A | D30: http://en.wikipedia.org/wiki/Root_mean_square#RMS_of_common_waveforms
A31: Inverter power losses | B31: of:=supply_power-motor_power -> 523.018631085903 | C31: W
A32: Total controller voltage drop | B32: of:=pack_load_voltage*(1-controller_eff) -> 3.74385023595914 | C32: V
A34: Switching transistor requirements
A35: Switch resistance (Rdson) | B35: of:=inverter_losses/3/(motor_rms_current^2) -> 0.00782024376508086 | C35: Ω | D35: http://en.wikipedia.org/wiki/Electric_power#Resistive_circuits
A36: Switch voltage drop (Vcesat) | B36: of:=inverter_losses/3/motor_rms_current -> 1.16763767050837 | C36: V | D36: http://en.wikipedia.org/wiki/Electric_power#Definition
A37: Switch power dissipation | B37: of:=inverter_losses/6 -> 87.1697718476504 | C37: W
A38: Switch open voltage | B38: of:=pack_regen_voltage*(1+voltage_margin) -> 264.307488202043 | C38: V
A39: Continuous current | B39: of:=motor_rms_current/2 -> 74.6548129178617 | C39: A
A40: Peak current | B40: of:=motor_peak_current -> 211.155697849732 | C40: A
A42: Things not taken into account:
A43: switching losses
A44: cable/connector losses