Sheet: General
A1: General data
A3: VAT tax rate | B3: 0.23 | C3: multiplier | D3: of:=1+[.B3] -> 1.23
A4: USD/PLN rate | B4: 3.15 | C4: multiplier | D4: of:=[.D3]*[.B4] -> 3.8745
A5: Copper resistivity | B5: of:=1.678*10^-8 -> 0.00000001678 | C5: Ωm
A6: Copper cable max current density | B6: 4 | C6: A/mm^2
A7: Vehicle Passenger mass | B7: 68 | C7: kg
A8: Vehicle driver mass | B8: 75 | C8: kg
A9: Air density | B9: 1.2922 | C9: kg/m^3
A10: Gravitational acceleration | B10: 9.8105 | C10: m/s^2

Sheet: Commute
A1: Commute tracks
G2: Steepest incline
A3: Name | B3: length [km] | C3: Duration [min] | D3: Max speed on flat [km/h] | E3: total climb [m] | F3: total descent [m] | G3: Length [m] | H3: start height [m] | I3: end height [m] | J3: speed [km/h] | K3: Roundtrip
A4: Work | B4: 22 | C4: 35 | D4: 90 | E4: 353 | F4: 444 | G4: 754 | H4: 309 | I4: 377 | J4: 30 | K4: true
A32: Choose the commute:
A33: Work | B33: of:=VLOOKUP(commute_name; [.$A$4:.$P$11]; 2; 0) -> 22 | C33: of:=VLOOKUP(commute_name; [.$A$4:.$P$11]; 3; 0) -> 35 | D33: of:=VLOOKUP(commute_name; [.$A$4:.$P$11]; 4; 0) -> 90 | E33: of:=VLOOKUP(commute_name; [.$A$4:.$P$11]; 5; 0) -> 353 | F33: of:=VLOOKUP(commute_name; [.$A$4:.$P$11]; 6; 0) -> 444 | G33: of:=VLOOKUP(commute_name; [.$A$4:.$P$11]; 7; 0) -> 754 | H33: of:=VLOOKUP(commute_name; [.$A$4:.$P$11]; 8; 0) -> 309 | I33: of:=VLOOKUP(commute_name; [.$A$4:.$P$11]; 9; 0) -> 377 | J33: of:=VLOOKUP(commute_name; [.$A$4:.$P$11]; 10; 0) -> 30 | K33: of:=VLOOKUP(commute_name; [.$A$4:.$P$11]; 10; 0) -> 30
A34: Roundtrip (if enabled) | B34: of:=IF(commute_roundtrip; 2; 1)*[.B33] -> 44 | C34: of:=IF(commute_roundtrip; 2; 1)*[.C33] -> 70 | E34: of:=IF(commute_roundtrip; [.E33]+[.F33]; [.E33]) -> 797 | F34: of:=IF(commute_roundtrip; [.E33]+[.F33]; [.F33]) -> 797

Sheet: Donor models
A1: Donor cars
H3: Front tyres | K3: Rear tyres | Q3: Gearbox ratios
A4: Model | B4: Frontal area [m^2] | C4: Drag coefficient (Cd) | D4: Cda | E4: Mass | F4: Gross mass | G4: ICE mass | H4: width [mm] | I4: height ratio | J4: rim diameter [inch] | K4: width [mm] | L4: height ratio | M4: rim diameter [inch] | N4: Seats | O4: Max Luggage mass [kg] | P4: FWD | Q4: 1 | R4: 2 | S4: 3 | T4: 4 | U4: 5 | V4: 6
A5: Smart Fortwo W450 | B5: 1.95 | C5: 0.37 | D5: of:=[.B5]*[.C5] -> 0.7215 | E5: of:=805-75-0.9*719.7*33/1000 -> 708.62491 | F5: 990 | G5: 70 | H5: 135 | I5: 70 | J5: 15 | K5: 175 | L5: 55 | M5: 15 | N5: 2 | O5: of:=[.F5]-[.E5]-[General.B8]-[General.B7]*([.N5]-1) -> 138.37509 | P5: false | Q5: 14.203 | R5: 10.31 | S5: 7.407 | T5: 5.625 | U5: 4.083 | V5: 2.933
A6: Audi A2 | B6: of:=[.D6]/[.C6] -> 1.94285714285714 | C6: 0.28 | D6: 0.544 | E6: 895 | F6: 1365 | G6: 90 | H6: 175 | I6: 60 | J6: 15 | K6: 175 | L6: 60 | M6: 15 | N6: 5 | O6: of:=[.F6]-[.E6]-[General.B8]-[General.B8]*([.N6]-1) -> 95 | P6: true
A7: Fiat Panda 169 1,1 | B7: 2.11 | C7: 0.33 | D7: of:=[.B7]*[.C7] -> 0.6963 | E7: 840 | F7: 1255 | G7: 66 | H7: 155 | I7: 80 | J7: 13 | K7: 155 | L7: 80 | M7: 13 | N7: 5 | O7: of:=[.F7]-[.E7]-[General.B9]-[General.B8]*([.N7]-1) -> 113.7078 | P7: true
A32: Select the donor:
A33: Smart Fortwo W450 | B33: of:=VLOOKUP(car_model; [.$A$5:.$V$11]; 2; 0) -> 1.95 | C33: of:=VLOOKUP(car_model; [.$A$5:.$V$11]; 3; 0) -> 0.37 | D33: of:=VLOOKUP(car_model; [.$A$5:.$V$11]; 4; 0) -> 0.7215 | E33: of:=VLOOKUP(car_model; [.$A$5:.$V$11]; 5; 0) -> 708.62491 | F33: of:=VLOOKUP(car_model; [.$A$5:.$V$11]; 6; 0) -> 990 | G33: of:=VLOOKUP(car_model; [.$A$5:.$V$11]; 7; 0) -> 70 | H33: of:=VLOOKUP(car_model; [.$A$5:.$V$11]; 8; 0) -> 135 | I33: of:=VLOOKUP(car_model; [.$A$5:.$V$11]; 9; 0) -> 70 | J33: of:=VLOOKUP(car_model; [.$A$5:.$V$11]; 10; 0) -> 15 | K33: of:=VLOOKUP(car_model; [.$A$5:.$V$11]; 11; 0) -> 175 | L33: of:=VLOOKUP(car_model; [.$A$5:.$V$11]; 12; 0) -> 55 | M33: of:=VLOOKUP(car_model; [.$A$5:.$V$11]; 13; 0) -> 15 | N33: of:=VLOOKUP(car_model; [.$A$5:.$V$11]; 14; 0) -> 2 | O33: of:=VLOOKUP(car_model; [.$A$5:.$V$11]; 15; 0) -> 138.37509 | P33: of:=VLOOKUP(car_model; [.$A$5:.$V$11]; 16; 0) -> false | Q33: of:=VLOOKUP(car_model; [.$A$5:.$V$11]; 17; 0) -> 14.203 | R33: of:=VLOOKUP(car_model; [.$A$5:.$V$11]; 18; 0) -> 10.31 | S33: of:=VLOOKUP(car_model; [.$A$5:.$V$11]; 19; 0) -> 7.407 | T33: of:=VLOOKUP(car_model; [.$A$5:.$V$11]; 20; 0) -> 5.625 | U33: of:=VLOOKUP(car_model; [.$A$5:.$V$11]; 21; 0) -> 4.083 | V33: of:=VLOOKUP(car_model; [.$A$5:.$V$11]; 22; 0) -> 2.933

Sheet: Tyres
A1: Tyres | L1: Tyre fuel efficiency classes
L2: For C1 class (passenger vehicles, driving license B)
A3: Model | B3: width [mm] | C3: height ratio | D3: rim diameter [inch] | E3: efficiency class | F3: rolling resistance coefficient [kg/kg] | G3: Winter | H3: Matches donor front | I3: Matches donor back | L3: Values determined by EU
A4: Kumho KW17 | B4: 135 | C4: 70 | D4: 15 | E4: F | F4: of:=VLOOKUP([.E4]; [.$L6:.$P$12]; 5; 0) -> 0.0113 | G4: true | H4: of:=AND([.B4]=tyre_front_width; [.C4]=tyre_front_ratio; [.D4]=tyre_front_rim) -> true | I4: of:=AND([.B4]=tyre_rear_width; [.C4]=tyre_rear_ratio; [.D4]=tyre_rear_rim) -> false | M4: rolling resistance [kg/t]
A5: Kumho KW23 | B5: 175 | C5: 55 | D5: 15 | E5: E | F5: of:=VLOOKUP([.E5]; [.$L7:.$P$12]; 5; 0) -> 0.0098 | G5: true | H5: of:=AND([.B5]=tyre_front_width; [.C5]=tyre_front_ratio; [.D5]=tyre_front_rim) -> false | I5: of:=AND([.B5]=tyre_rear_width; [.C5]=tyre_rear_ratio; [.D5]=tyre_rear_rim) -> true | L5: Class | M5: min | N5: max | O5: avg | P5: avg kg/kg
L6: A | N6: 6.5 | O6: of:=AVERAGE([.M6];[.N6]) -> 6.5 | P6: of:=[.O6]/1000 -> 0.0065
L7: B | M7: 6.6 | N7: 7.7 | O7: of:=AVERAGE([.M7];[.N7]) -> 7.15 | P7: of:=[.O7]/1000 -> 0.00715
L8: C | M8: 7.8 | N8: 9 | O8: of:=AVERAGE([.M8];[.N8]) -> 8.4 | P8: of:=[.O8]/1000 -> 0.0084
L9: D
L10: E | M10: 9.1 | N10: 10.5 | O10: of:=AVERAGE([.M10];[.N10]) -> 9.8 | P10: of:=[.O10]/1000 -> 0.0098
L11: F | M11: 10.6 | N11: 12 | O11: of:=AVERAGE([.M11];[.N11]) -> 11.3 | P11: of:=[.O11]/1000 -> 0.0113
L12: G | M12: 12.1 | O12: of:=AVERAGE([.M12];[.N12]) -> 12.1 | P12: of:=[.O12]/1000 -> 0.0121
A18: Select front tyre: | H18: Matches donor
A19: Kumho KW17 | B19: of:=VLOOKUP(front_tyre_model; [.$A$4:.$I$11]; 2; 0) -> 135 | C19: of:=VLOOKUP(front_tyre_model; [.$A$4:.$I$11]; 3; 0) -> 70 | D19: of:=VLOOKUP(front_tyre_model; [.$A$4:.$I$11]; 4; 0) -> 15 | E19: of:=VLOOKUP(front_tyre_model; [.$A$4:.$I$11]; 5; 0) -> F | F19: of:=VLOOKUP(front_tyre_model; [.$A$4:.$I$11]; 6; 0) -> 0.0113 | G19: of:=VLOOKUP(front_tyre_model; [.$A$4:.$I$11]; 7; 0) -> true | H19: of:=VLOOKUP(front_tyre_model; [.$A$4:.$I$11]; 8; 0) -> true
A21: Select back tyre:
A22: Kumho KW23 | B22: of:=VLOOKUP(rear_tyre_model; [.$A$4:.$I$11]; 2; 0) -> 175 | C22: of:=VLOOKUP(rear_tyre_model; [.$A$4:.$I$11]; 3; 0) -> 55 | D22: of:=VLOOKUP(rear_tyre_model; [.$A$4:.$I$11]; 4; 0) -> 15 | E22: of:=VLOOKUP(rear_tyre_model; [.$A$4:.$I$11]; 5; 0) -> E | F22: of:=VLOOKUP(rear_tyre_model; [.$A$4:.$I$11]; 6; 0) -> 0.0098 | G22: of:=VLOOKUP(rear_tyre_model; [.$A$4:.$I$11]; 7; 0) -> true | H22: of:=VLOOKUP(rear_tyre_model; [.$A$4:.$I$11]; 9; 0) -> true

Sheet: AC Motors
A1: AC Motors
A3: Model | B3: Power @ 50Hz [kW] | C3: Efficiency @ 100% load | D3: Torque [Nm] | E3: Mass [kg] | F3: Diameter [mm] | G3: Flange diameter [mm] | H3: Length with shaft [mm] | I3: Length of shaft [mm] | J3: Length of fan [mm] | K3: Length without fan [mm] | L3: Length without fan and shaft [mm] | M3: Environment rating | N3: Insulation class | O3: Price
A4: Tamel 3SLg112M-4-IE2 | B4: 4 | C4: 86.6 | D4: 26.5 | E4: of:=29.4*1.1 -> 32.34 | F4: 215 | G4: 250 | H4: 382 | I4: 60 | J4: 48 | K4: of:=[.H4]-[.I4] -> 322 | L4: of:=[.K4]-[.J4] -> 274 | M4: IP 55 | N4: F | O4: 1199
A5: Tamel 3SLg132S-4-IE2 | B5: 5.5 | C5: 87.7 | D5: 36 | E5: of:=57*1.1 -> 62.7 | F5: 255 | G5: 300 | H5: 489 | I5: 80 | J5: 55 | K5: of:=[.H5]-[.I5] -> 409 | L5: of:=[.K5]-[.J5] -> 354 | M5: IP 55 | N5: F
A6: Tamel 3SLg132M-4-IE2 | B6: 7.5 | C6: 88.7 | D6: 49.1 | E6: of:=60.5*1.1 -> 66.55 | F6: 255 | G6: 300 | H6: 489 | I6: 80 | J6: 55 | K6: of:=[.H6]-[.I6] -> 409 | L6: of:=[.K6]-[.J6] -> 354 | M6: IP 55 | N6: F
A7: Indukta 2SIE 112M4 | B7: 4 | C7: 87 | D7: 26.3 | E7: of:=35.5*1.1 -> 39.05 | F7: 215 | G7: 250 | H7: 384 | I7: 60 | J7: 30 | K7: of:=[.H7]-[.I7] -> 324 | L7: of:=[.K7]-[.J7] -> 294 | M7: IP 55 | N7: F
A8: Indukta 2SIE 132S4 | B8: 5.5 | C8: 88 | D8: 36 | E8: of:=69*1.1 -> 75.9 | F8: 265 | G8: 300 | H8: 463 | I8: 80 | J8: 30 | K8: of:=[.H8]-[.I8] -> 383 | L8: of:=[.K8]-[.J8] -> 353 | M8: IP 55 | N8: F
A9: Indukta 2SIE 132M4 | B9: 7.5 | C9: 88.7 | D9: 49.1 | E9: of:=73.5*1.1 -> 80.85 | F9: 265 | G9: 300 | H9: 501 | I9: 80 | J9: 30 | K9: of:=[.H9]-[.I9] -> 421 | L9: of:=[.K9]-[.J9] -> 391 | M9: IP 55 | N9: F
A10: Indukta Slg 112M-4 | B10: 4 | C10: 85.1 | D10: 26.62 | E10: of:=34*1.1 -> 37.4 | F10: 215 | G10: 250 | H10: 383 | I10: 60 | J10: 44 | K10: of:=[.H10]-[.I10] -> 323 | L10: of:=[.K10]-[.J10] -> 279 | M10: IP 55 | N10: F
A11: Indukta Slg 132S-4 | B11: 5.5 | C11: 85.9 | D11: 36.22 | E11: of:=62*1.1 -> 68.2 | F11: 265 | G11: 300 | H11: 461 | I11: 80 | J11: 38 | K11: of:=[.H11]-[.I11] -> 381 | L11: of:=[.K11]-[.J11] -> 343 | M11: IP 55 | N11: F
A12: Indukta Slg 132M-4 | B12: 7.5 | C12: 87 | D12: 49.4 | E12: of:=73*1.1 -> 80.3 | F12: 265 | G12: 300 | H12: 499 | I12: 80 | J12: 38 | K12: of:=[.H12]-[.I12] -> 419 | L12: of:=[.K12]-[.J12] -> 381 | M12: IP 55 | N12: F
A13: Indukta Pslg 100L-4 | B13: 4 | C13: 80.8 | D13: 26.81 | E13: of:=28.9*1.1 -> 31.79 | F13: 215 | G13: 250 | H13: 416 | I13: 60 | J13: 22 | K13: of:=[.H13]-[.I13] -> 356 | L13: of:=[.K13]-[.J13] -> 334 | M13: IP 55 | N13: F
A14: Indukta Pslg 112M-4A | B14: 5.5 | C14: 83.9 | D14: 36.86 | E14: of:=39*1.1 -> 42.9 | F14: 215 | G14: 250 | H14: 410 | I14: 60 | J14: 44 | K14: of:=[.H14]-[.I14] -> 350 | L14: of:=[.K14]-[.J14] -> 306 | M14: IP 55 | N14: F
A15: Indukta Pslg 132M-4 | B15: 9.2 | C15: 87.3 | D15: 60.38 | E15: of:=77*1.1 -> 84.7 | F15: 265 | G15: 300 | H15: 531 | I15: 80 | J15: 38 | K15: of:=[.H15]-[.I15] -> 451 | L15: of:=[.K15]-[.J15] -> 413 | M15: IP 55 | N15: F
A16: Indukta Psg 132M-4A | B16: 11 | C16: 87 | D16: 72.45 | E16: of:=82*1.1 -> 90.2 | F16: 265 | G16: 300 | H16: 531 | I16: 80 | J16: 38 | K16: of:=[.H16]-[.I16] -> 451 | L16: of:=[.K16]-[.J16] -> 413 | M16: IP 55 | N16: F

Sheet: Power & Energy
A2: Power requirements
A4: Data | B4: value | C4: unit
A5: passengers | B5: 0
A6: gearbox efficiency | B6: 0.9
A7: controller efficiency | B7: 0.95

Sheet: Battery models
A1: Battery cells
A3: Model | B3: Capacity [Ah] | C3: Nominal voltage [V] | D3: Energy capacity [Wh] | E3: Charging voltage [V] | F3: Internal resistance [mΩ] | G3: Max continuous current [A] | H3: Max impulse current [A] | I3: Width [mm] | J3: Height [mm] | K3: Depth [mm] | L3: Mass [kg] | M3: Energy density [Wh/kg] | N3: Price | O3: Price | P3: Price / Wh
A4: GBS GBS-LFMP60AH | B4: 60 | C4: 3.2 | D4: of:=[.B4]*[.C4] -> 192 | E4: 3.55 | F4: 1.2 | G4: 180 | H4: 600 | I4: 126 | J4: 180 | K4: 65 | L4: 2 | M4: of:=[.D4]/[.L4] -> 96 | N4: 66 | O4: of:=250.46*vat_factor -> 308.0658 | P4: of:=[.N4]/[.D4] -> 0.34375
A5: Winston WB-LYP60AHA | B5: 60 | C5: 3 | D5: of:=[.B5]*[.C5] -> 180 | E5: 4 | F5: 0.7 | G5: of:=[.B5]*3 -> 180 | H5: of:=[.B5]*20 -> 1200 | I5: 115 | J5: 203 | K5: 61 | L5: 2.3 | M5: of:=[.D5]/[.L5] -> 78.2608695652174 | N5: 66 | O5: of:=250.46*vat_factor -> 308.0658 | P5: of:=[.N5]/[.D5] -> 0.366666666666667
A6: Winston WB-LYP100AHA | B6: 100 | C6: 3 | D6: of:=[.B6]*[.C6] -> 300 | E6: 4 | F6: 0.6 | G6: of:=[.B6]*3 -> 300 | H6: of:=[.B6]*20 -> 2000 | I6: 142 | J6: 218 | K6: 67 | L6: 3.3 | M6: of:=[.D6]/[.L6] -> 90.9090909090909 | N6: 110 | O6: of:=425.28*vat_factor -> 523.0944 | P6: of:=[.N6]/[.D6] -> 0.366666666666667
A7: Winston WB-LYP160AHA | B7: 160 | C7: 3 | D7: of:=[.B7]*[.C7] -> 480 | E7: 4 | F7: 0.5 | G7: of:=[.B7]*3 -> 480 | H7: of:=[.B7]*20 -> 3200 | I7: 209 | J7: 280 | K7: 65 | L7: 5.6 | M7: of:=[.D7]/[.L7] -> 85.7142857142857 | N7: 176 | O7: of:=250.46*vat_factor -> 308.0658 | P7: of:=[.N7]/[.D7] -> 0.366666666666667
A8: CALB SE60AHA | B8: 60 | C8: 3.2 | D8: of:=[.B8]*[.C8] -> 192 | E8: 3.6 | F8: 1 | G8: of:=[.B8]*2 -> 120 | H8: 600 | I8: 142 | J8: 217 | K8: 50 | L8: 2.5 | M8: of:=[.D8]/[.L8] -> 76.8 | N8: 78 | O8: of:=294.98*vat_factor -> 362.8254 | P8: of:=[.N8]/[.D8] -> 0.40625
A32: Select the battery model:
A33: Winston WB-LYP60AHA | B33: of:=VLOOKUP(battery_model; [.$A$4:.$P$13]; 2; 0) -> 60 | C33: of:=VLOOKUP(battery_model; [.$A$4:.$P$13]; 3; 0) -> 3 | D33: of:=VLOOKUP(battery_model; [.$A$4:.$P$13]; 4; 0) -> 180 | E33: of:=VLOOKUP(battery_model; [.$A$4:.$P$13]; 5; 0) -> 4 | F33: of:=VLOOKUP(battery_model; [.$A$4:.$P$13]; 6; 0) -> 0.7 | G33: of:=VLOOKUP(battery_model; [.$A$4:.$P$13]; 7; 0) -> 180 | H33: of:=VLOOKUP(battery_model; [.$A$4:.$P$13]; 8; 0) -> 1200 | I33: of:=VLOOKUP(battery_model; [.$A$4:.$P$13]; 9; 0) -> 115 | J33: of:=VLOOKUP(battery_model; [.$A$4:.$P$13]; 10; 0) -> 203 | K33: of:=VLOOKUP(battery_model; [.$A$4:.$P$13]; 11; 0) -> 61 | L33: of:=VLOOKUP(battery_model; [.$A$4:.$P$13]; 12; 0) -> 2.3 | M33: of:=VLOOKUP(battery_model; [.$A$4:.$P$13]; 13; 0) -> 78.2608695652174 | N33: of:=VLOOKUP(battery_model; [.$A$4:.$P$13]; 14; 0) -> 66 | O33: of:=VLOOKUP(battery_model; [.$A$4:.$P$13]; 15; 0) -> 308.0658 | P33: of:=VLOOKUP(battery_model; [.$A$4:.$P$13]; 16; 0) -> 0.366666666666667

Sheet: Battery pack
A1: Battery Pack | J1: Number of cells in parallel | K1: parallel pack resistance | L1: This is a recursive formula – observe what is added to a parallel pack when a next cell is added. See http://en.wikipedia.org/wiki/Series_and_parallel_circuits#Resistors and http://en.wikipedia.org/wiki/Series_and_parallel_circuits#Resistors2
J2: 1 | K2: of:=cell_resistance/1000 -> 0.0007
A3: Electrical | F3: Mechanical | J3: 2 | K3: of:=1/(1/([.K2]+connector_resistance)+1/(cell_resistance+connector_resistance)) -> 0.00072274502472074
J4: 3 | K4: of:=1/(1/([.K3]+connector_resistance)+1/(cell_resistance+connector_resistance)) -> 0.00074544237039422
A5: Battery pack data | B5: value | C5: unit | D5: notes | F5: data | G5: value | H5: unit | I5: notes | J5: 4 | K5: of:=1/(1/([.K4]+connector_resistance)+1/(cell_resistance+connector_resistance)) -> 0.000768090668259715
A6: Amount of cells in parallel | B6: 1 | D6: conversion dependent | F6: Cell volume | G6: of:=cell_width*cell_height*cell_depth/100^3 -> 1.424045 | H6: L
A7: Desired current | B7: of:=cell_max_continuous_current*cells_parallel -> 180 | C7: A | F7: Amount of cells | G7: of:=cells_series*cells_parallel -> 43
A8: Desired regen current | B8: of:=pack_current -> 180 | C8: A | F8: Pack volume | G8: of:=cell_volume*cell_count -> 61.233935 | H8: L | I8: excluding connectors etc.
A9: Amount of parallell packs in series | B9: 43 | F9: Pack mass | G9: of:=cell_mass*cell_count -> 98.9 | H9: kg
A10: Pack cable length | B10: of:=2*1.5 -> 3 | C10: m | F10: Pack cable cross section | G10: of:=ROUNDUP(pack_current/cable_current_density; 5) -> 45 | H10: mm^2
A11: Contactor resistance | B11: 0.0002 | C11: Ω | F11: Pack cable diameter | G11: of:=SQRT([.G10]/PI()) -> 3.78469878303024 | H11: mm
A12: Fuse losses @ Amps | B12: 15 | C12: W @ | D12: 200
A13: Fuse base losses @ Amps | B13: 8.6 | C13: W @ | D13: 250
F14: Financial
A15: Calculated data
A16: Pack cable resistance | B16: of:=copper_resistivity*pack_cable_length/pack_cable_cross_section -> 0.00000000111866666666667 | C16: Ω | F16: Pack cost | G16: of:=cell_count*cell_price_usd -> 2838
A17: Fuse resistance | B17: of:=fuse_losses/fuse_losses_current^2 -> 0.000375 | C17: Ω | F17: Pack cost | G17: of:=cell_count*cell_price_pln -> 13246.8294
A18: Fuse base resistance | B18: of:=fuse_base_losses/fuse_base_losses_current^2 -> 0.0001376 | C18: Ω
A19: Cell connector resistance | B19: of:=copper_resistivity*(70/1000)/(25*2/1000^2) -> 0.000023492 | C19: Ω
A20: Parallel pack internal resistance | B20: of:=VLOOKUP(cells_parallel; [.$J$2:.$K$5]; 2; 0) -> 0.0007 | C20: Ω
A21: Pack internal resistance | B21: of:=parallel_pack_resistance*cells_series+cell_connector_resistance*(cells_series-1)+fuse_resistance+fuse_base_resistance+pack_cable_resistance -> 0.0315992651186667 | C21: Ω
A22: Pack nominal voltage | B22: of:=cell_nominal_voltage*cells_series -> 129 | C22: V
A23: Pack nominal charging voltage | B23: of:=cell_charging_voltage*cells_series -> 172 | C23: V
A24: Pack short circuit current | B24: of:=pack_nominal_voltage/pack_resistance -> 4082.37341962094 | C24: A
A25: Pack sag voltage | B25: of:=pack_current*pack_resistance -> 5.68786772136 | C25: V
A26: Pack surplus regen voltage | B26: of:=pack_regen_current*pack_resistance -> 5.68786772136 | C26: V
A27: Pack discharge voltage | B27: of:=pack_nominal_voltage-pack_sag_voltage -> 123.31213227864 | C27: V
A28: Pack regen max voltage | B28: of:=pack_nominal_charging_voltage+pack_surplus_regen_voltage -> 177.68786772136 | C28: V
A29: Pack output power | B29: of:=pack_discharge_voltage*pack_current -> 22196.1838101552 | C29: W
A30: Pack heat losses | B30: of:=pack_sag_voltage*pack_current -> 1023.8161898448 | C30: W
A31: Pack discharge efficiency | B31: of:=pack_power/(pack_power+pack_losses) -> 0.95590800216
A32: Pack regen input power | B32: of:=pack_regen_voltage*pack_regen_current -> 31983.8161898448 | C32: W
A33: Pack regen heat losses | B33: of:=pack_surplus_regen_voltage*pack_regen_current -> 1023.8161898448 | C33: W
A34: Pack regen efficiency | B34: of:=pack_regen_power/(pack_regen_power+pack_regen_losses) -> 0.968982440846779