Sheet: data
A1: Part | B1: Family | C1: Package | D1: Circuit | E1: Switching | F1: Switching Speed | G1: VCES (V) | H1: IC @ 25C (A) | I1: IC @ 100C (A) | J1: VCE(ON)@25C typ (V) | K1: VCE(ON)@25C max (V) | L1: Ets typ (mJ) | M1: Ets max (mJ) | N1: PD @25C (W) | O1: Qual Level | P1: MSL | Q1: Environmental Options | R1: 1K Budgetary Pricing (USD)
A2: IRGP4066-E | B2: IGBT Discretes | C2: TO-247AD | D2: Discrete | E2: Hard | F2: ULTRAFAST 8-30 kHz | G2: 600 | H2: 140 | I2: 90 | J2: 1.7 | K2: 2.1 | L2: 4.62 | M2: 6.4 | N2: 454 | O2: Industrial | Q2: PbF | R2: 5.45
A3: IRG7PH35U | B3: IGBT Discretes | C3: TO-247 | D3: Discrete | F3: ULTRAFAST 8-30 kHz | G3: 1200 | H3: 55 | I3: 35 | J3: 1.9 | K3: 2.2 | L3: 1.68 | M3: 2.15 | N3: 210 | O3: Industrial | Q3: PbF | R3: 2.912
A4: IRG4BC20U | B4: IGBT Discretes | C4: TO-220AB | D4: Discrete | E4: Hard | F4: ULTRAFAST 8-30 kHz | G4: 600 | H4: 13 | I4: 6.5 | J4: 1.85 | K4: 2.1 | L4: 0.22 | M4: 0.4 | N4: 60 | O4: Industrial | Q4: PbF and Leaded | R4: 0.886
A5: IRG4BC30W-S | B5: IGBT Discretes | C5: D2-Pak | D5: Discrete | E5: Hard | F5: WARP 30-150 kHz | G5: 600 | H5: 23 | I5: 12 | J5: 2.1 | K5: 2.7 | L5: 0.26 | M5: 0.35 | N5: 100 | O5: Industrial | P5: 1 | Q5: PbF | R5: 1.25
A6: IRGP4069 | B6: IGBT Discretes | C6: TO-247 | D6: Discrete | E6: Hard | F6: ULTRAFAST 8-30 kHz | G6: 600 | H6: 76 | I6: 50 | J6: 1.6 | K6: 1.85 | L6: 1.02 | M6: 1.261 | N6: 268 | O6: Industrial | Q6: PbF | R6: 2.875
A7: IRGB8B60K | B7: IGBT Discretes | C7: TO-220AB | D7: Discrete | E7: Hard | F7: ULTRAFAST 8-30 kHz | G7: 600 | H7: 28 | I7: 19 | J7: 1.8 | K7: 2.2 | L7: 0.32 | M7: 0.433 | N7: 167 | O7: Industrial | Q7: PbF | R7: 1.144
A8: IRG4PH20K | B8: IGBT Discretes | C8: TO-247 | D8: Discrete | E8: Hard | F8: ULTRAFAST 8-30 kHz | G8: 1200 | H8: 11 | I8: 5 | J8: 3.17 | K8: 4.3 | L8: 0.89 | M8: 1.2 | N8: 60 | O8: Industrial | Q8: PbF | R8: 1.6
A9: IRG4PC50W | B9: IGBT Discretes | C9: TO-247 | D9: Discrete | E9: Hard | F9: WARP 30-150 kHz | G9: 600 | H9: 55 | I9: 27 | J9: 1.93 | K9: 2.3 | L9: 0.4 | M9: 0.5 | N9: 200 | O9: Industrial | Q9: PbF | R9: 3.069
A10: IRG4PC40U | B10: IGBT Discretes | C10: TO-247 | D10: Discrete | E10: Hard | F10: ULTRAFAST 8-30 kHz | G10: 600 | H10: 40 | I10: 20 | J10: 1.72 | K10: 2.1 | L10: 0.67 | M10: 1 | N10: 160 | O10: Industrial | Q10: PbF and Leaded | R10: 2.128
A11: IRGB4B60K | B11: IGBT Discretes | C11: TO-220AB | D11: Discrete | E11: Hard | F11: ULTRAFAST 8-30 kHz | G11: 600 | H11: 12 | I11: 6.8 | J11: 2.1 | K11: 2.5 | L11: 0.12 | M11: 0.13 | N11: 63 | O11: Industrial | Q11: PbF | R11: 0.94
A12: IRGP4066 | B12: IGBT Discretes | C12: TO-247 | D12: Discrete | E12: Hard | F12: ULTRAFAST 8-30 kHz | G12: 600 | H12: 140 | I12: 90 | J12: 1.7 | K12: 2.1 | L12: 4.62 | M12: 6.4 | N12: 454 | O12: Industrial | Q12: PbF | R12: 5.375
A13: IRG4BH20K-L | B13: IGBT Discretes | C13: TO-262 | D13: Discrete | E13: Hard | F13: ULTRAFAST 8-30 kHz | G13: 1200 | H13: 11 | I13: 5 | J13: 3.17 | K13: 4.3 | L13: 0.89 | M13: 1.2 | N13: 60 | O13: Industrial | P13: 1 | Q13: PbF | R13: 0.97
A14: IRG4PC40K | B14: IGBT Discretes | C14: TO-247 | D14: Discrete | E14: Hard | F14: ULTRAFAST 8-30 kHz | G14: 600 | H14: 42 | I14: 25 | J14: 2.1 | K14: 2.6 | L14: 0.95 | M14: 1.4 | N14: 160 | O14: Industrial | Q14: PbF | R14: 2.112
A15: IRG4PH30K | B15: IGBT Discretes | C15: TO-247 | D15: Discrete | E15: Hard | F15: ULTRAFAST 8-30 kHz | G15: 1200 | H15: 20 | I15: 10 | J15: 3.1 | K15: 4.2 | L15: 1.56 | M15: 2.4 | N15: 100 | O15: Industrial | Q15: PbF and Leaded | R15: 1.9
A16: IRG4PC50U | B16: IGBT Discretes | C16: TO-247 | D16: Discrete | E16: Hard | F16: ULTRAFAST 8-30 kHz | G16: 600 | H16: 55 | I16: 27 | J16: 1.65 | K16: 2 | L16: 0.66 | M16: 0.9 | N16: 200 | O16: Industrial | Q16: PbF and Leaded | R16: 2.771
A17: IRG4PSC71U | B17: IGBT Discretes | C17: TO-274AA | D17: Discrete | E17: Hard | F17: ULTRAFAST 8-30 kHz | G17: 600 | H17: 85 | I17: 60 | J17: 1.67 | K17: 2 | L17: 2.41 | M17: 3.2 | N17: 350 | O17: Industrial | Q17: PbF | R17: 5.411
A18: IRG7P313U | B18: IGBT Discretes | C18: TO-247 | D18: Discrete | E18: Soft | F18: ULTRAFAST 8-30 kHz | G18: 330 | H18: 40 | I18: 20 | J18: 1.21 | K18: 1.45 | N18: 89 | O18: Industrial | Q18: PbF
A19: IRG7PH42U | B19: IGBT Discretes | C19: TO-247 | D19: Discrete | F19: ULTRAFAST 8-30 kHz | G19: 1200 | H19: 90 | I19: 60 | J19: 1.7 | K19: 2 | L19: 3.29 | M19: 3.8 | N19: 385 | O19: Industrial | Q19: PbF | R19: 4.395
A20: IRG4PC30U | B20: IGBT Discretes | C20: TO-247 | D20: Discrete | E20: Hard | F20: ULTRAFAST 8-30 kHz | G20: 600 | H20: 23 | I20: 12 | J20: 1.95 | K20: 2.1 | L20: 0.36 | M20: 0.5 | N20: 100 | O20: Industrial | Q20: PbF | R20: 1.785
A21: IRG7IC28U | B21: IGBT Discretes | C21: TO-220 FullPak | D21: Discrete | E21: Soft | F21: ULTRAFAST 8-30 kHz | G21: 600 | H21: 25 | I21: 12 | J21: 1.7 | K21: 1.95 | N21: 40 | O21: Industrial | Q21: PbF
A22: IRG4PC30W | B22: IGBT Discretes | C22: TO-247 | D22: Discrete | E22: Hard | F22: WARP 30-150 kHz | G22: 600 | H22: 23 | I22: 12 | J22: 2.1 | K22: 2.7 | L22: 0.26 | M22: 0.35 | N22: 100 | O22: Industrial | Q22: PbF | R22: 1.8
A23: IRG4BC40K | B23: IGBT Discretes | C23: TO-220AB | D23: Discrete | E23: Hard | F23: ULTRAFAST 8-30 kHz | G23: 600 | H23: 42 | I23: 25 | J23: 2.1 | K23: 2.6 | L23: 0.95 | M23: 1.4 | N23: 160 | O23: Industrial | Q23: PbF | R23: 1.443
A24: IRGS30B60K | B24: IGBT Discretes | C24: D2-Pak | D24: Discrete | E24: Hard | F24: ULTRAFAST 8-30 kHz | G24: 600 | H24: 78 | I24: 50 | J24: 1.95 | K24: 2.35 | L24: 1.175 | M24: 1.575 | N24: 370 | O24: Industrial | P24: 1 | Q24: PbF | R24: 1.85
A25: IRG4BH20K-S | B25: IGBT Discretes | C25: D2-Pak | D25: Discrete | E25: Hard | F25: ULTRAFAST 8-30 kHz | G25: 1200 | H25: 11 | I25: 5 | J25: 3.17 | K25: 4.3 | L25: 0.89 | M25: 1.2 | N25: 60 | O25: Industrial | P25: 1 | Q25: PbF | R25: 1.229
A26: IRG4IBC30W | B26: IGBT Discretes | C26: TO-220 FullPak | D26: Discrete | E26: Hard | F26: WARP 30-150 kHz | G26: 600 | H26: 17 | I26: 8.4 | J26: 2.1 | K26: 2.7 | L26: 0.26 | M26: 0.35 | N26: 45 | O26: Industrial | Q26: PbF and Leaded | R26: 1.27
A27: IRG7S319U | B27: IGBT Discretes | C27: D2-Pak | D27: Discrete | E27: Soft | F27: ULTRAFAST 8-30 kHz | G27: 330 | H27: 45 | I27: 20 | J27: 1.26 | K27: 1.43 | N27: 96 | O27: Industrial | P27: 1 | Q27: PbF | R27: 1.176
A28: IRG7I319U | B28: IGBT Discretes | C28: TO-220 FullPak | D28: Discrete | E28: Soft | F28: ULTRAFAST 8-30 kHz | G28: 330 | H28: 30 | I28: 15 | J28: 1.2 | K28: 1.45 | N28: 34 | O28: Industrial | Q28: PbF | R28: 1.25
A29: IRG7PC28U | B29: IGBT Discretes | C29: TO-247 | D29: Discrete | E29: Soft | F29: ULTRAFAST 8-30 kHz | G29: 600 | H29: 61 | I29: 33 | J29: 1.7 | K29: 1.95 | N29: 160 | O29: Industrial | Q29: PbF
A30: IRG4BC30U | B30: IGBT Discretes | C30: TO-220AB | D30: Discrete | E30: Hard | F30: ULTRAFAST 8-30 kHz | G30: 600 | H30: 23 | I30: 12 | J30: 1.95 | K30: 2.1 | L30: 0.36 | M30: 0.5 | N30: 100 | O30: Industrial | Q30: PbF and Leaded | R30: 1.115
A31: IRGSL30B60K | B31: IGBT Discretes | C31: TO-262 | D31: Discrete | E31: Hard | F31: ULTRAFAST 8-30 kHz | G31: 600 | H31: 78 | I31: 50 | J31: 1.95 | K31: 2.35 | L31: 1.175 | M31: 1.575 | N31: 370 | O31: Industrial | P31: 1 | Q31: PbF | R31: 1.87
A32: IRGP4263 | B32: IGBT Discretes | C32: TO-247 | D32: Discrete | E32: Hard | F32: ULTRAFAST 8-30 kHz | G32: 650 | H32: 90 | I32: 60 | J32: 1.7 | K32: 2.1 | L32: 2.7 | M32: 4.5 | N32: 300 | Q32: PbF | R32: 3.165
A33: IRG7RA13U | B33: IGBT Discretes | C33: D-Pak | D33: Discrete | E33: Hard | F33: ULTRAFAST 8-30 kHz | G33: 360 | H33: 20 | I33: 40 | J33: 1.26 | K33: 1.52 | N33: 78 | Q33: PbF | R33: 0.65
A34: IRG7PH50U | B34: IGBT Discretes | C34: TO-247 | D34: Discrete | F34: ULTRAFAST 8-30 kHz | G34: 1200 | H34: 140 | I34: 90 | J34: 1.7 | K34: 2 | L34: 5.8 | M34: 7.8 | N34: 556 | O34: Industrial | Q34: PbF | R34: 7.5
A35: IRG4PH50U | B35: IGBT Discretes | C35: TO-247 | D35: Discrete | E35: Hard | F35: ULTRAFAST 8-30 kHz | G35: 1200 | H35: 45 | I35: 24 | J35: 2.78 | K35: 3.7 | L35: 1.94 | M35: 2.6 | N35: 200 | O35: Industrial | Q35: PbF | R35: 3.414
A36: IRGS4B60K | B36: IGBT Discretes | C36: D2-Pak | D36: Discrete | E36: Hard | F36: ULTRAFAST 8-30 kHz | G36: 600 | H36: 12 | I36: 6.8 | J36: 2.1 | K36: 2.2 | L36: 0.12 | M36: 0.13 | N36: 63 | O36: Industrial | P36: 1 | Q36: PbF
A37: IRGB30B60K | B37: IGBT Discretes | C37: TO-220AB | D37: Discrete | E37: Hard | F37: ULTRAFAST 8-30 kHz | G37: 600 | H37: 78 | I37: 50 | J37: 1.95 | K37: 2.35 | L37: 1.175 | M37: 1.575 | N37: 370 | O37: Industrial | Q37: PbF | R37: 1.83
A38: IRG7PH50U-E | B38: IGBT Discretes | C38: TO-247AD | D38: Discrete | F38: ULTRAFAST 8-30 kHz | G38: 1200 | H38: 140 | I38: 90 | J38: 1.7 | K38: 2 | L38: 5.8 | M38: 7.8 | N38: 556 | O38: Industrial | Q38: PbF
A39: IRGS15B60K | B39: IGBT Discretes | C39: D2-Pak | D39: Discrete | E39: Hard | F39: ULTRAFAST 8-30 kHz | G39: 600 | H39: 31 | I39: 15 | J39: 1.8 | K39: 2.2 | L39: 0.56 | M39: 0.785 | N39: 208 | O39: Industrial | P39: 1 | Q39: PbF | R39: 2.312
A40: IRG4PC30K | B40: IGBT Discretes | C40: TO-247 | D40: Discrete | E40: Hard | F40: ULTRAFAST 8-30 kHz | G40: 600 | H40: 28 | I40: 16 | J40: 2.21 | K40: 2.7 | L40: 0.87 | M40: 1.3 | N40: 100 | O40: Industrial | Q40: PbF | R40: 1.775
A41: IRG4IBC20W | B41: IGBT Discretes | C41: TO-220 FullPak | D41: Discrete | E41: Hard | F41: WARP 30-150 kHz | G41: 600 | H41: 12 | I41: 6 | J41: 2.16 | K41: 2.6 | L41: 0.14 | M41: 0.2 | N41: 34 | O41: Industrial | Q41: PbF | R41: 1.008
A42: IRG4BC30W | B42: IGBT Discretes | C42: TO-220AB | D42: Discrete | E42: Hard | F42: WARP 30-150 kHz | G42: 600 | H42: 23 | I42: 12 | J42: 2.1 | K42: 2.7 | L42: 0.26 | M42: 0.35 | N42: 100 | O42: Industrial | Q42: PbF | R42: 1.13
A43: IRG4BC40U | B43: IGBT Discretes | C43: TO-220AB | D43: Discrete | E43: Hard | F43: ULTRAFAST 8-30 kHz | G43: 600 | H43: 40 | I43: 20 | J43: 1.72 | K43: 2.1 | L43: 0.67 | M43: 1 | N43: 160 | O43: Industrial | Q43: PbF | R43: 1.458
A44: IRG4PH40U | B44: IGBT Discretes | C44: TO-247 | D44: Discrete | E44: Hard | F44: ULTRAFAST 8-30 kHz | G44: 1200 | H44: 41 | I44: 21 | J44: 2.43 | K44: 3.1 | L44: 0.67 | M44: 1 | N44: 160 | O44: Industrial | Q44: PbF | R44: 2.503
A45: IRGS8B60K | B45: IGBT Discretes | C45: D2-Pak | D45: Discrete | E45: Hard | F45: ULTRAFAST 8-30 kHz | G45: 600 | H45: 28 | I45: 19 | J45: 1.8 | K45: 2.2 | L45: 0.32 | M45: 0.433 | N45: 167 | O45: Industrial | P45: 1 | Q45: PbF | R45: 1.164
A46: IRG4BC40WL | B46: IGBT Discretes | C46: TO-262 | D46: Discrete | E46: Hard | F46: WARP 30-150 kHz | G46: 600 | H46: 40 | I46: 20 | J46: 2.05 | K46: 2.5 | L46: 0.34 | M46: 0.45 | N46: 160 | O46: Industrial | P46: 1 | Q46: PbF | R46: 1.59
A47: IRG4PH50K | B47: IGBT Discretes | C47: TO-247 | D47: Discrete | E47: Hard | F47: ULTRAFAST 8-30 kHz | G47: 1200 | H47: 45 | I47: 24 | J47: 2.43 | K47: 3.5 | L47: 3.46 | M47: 4.1 | N47: 200 | O47: Industrial | Q47: PbF | R47: 3.148
A48: IRG7PH30K10 | B48: IGBT Discretes | C48: TO-247 | D48: Discrete | E48: Hard | F48: ULTRAFAST 8-30 kHz | G48: 1200 | H48: 33 | I48: 23 | J48: 2.05 | K48: 2.35 | L48: 0.91 | M48: 1.36 | N48: 210 | O48: Industrial | Q48: PbF | R48: 3.4
A49: IRGPS40B120U | B49: IGBT Discretes | C49: TO-274AA | D49: Discrete | E49: Hard | F49: ULTRAFAST 8-30 kHz | G49: 1200 | H49: 80 | I49: 40 | J49: 3.12 | K49: 3.4 | L49: 3.05 | M49: 3.8 | N49: 595 | O49: Industrial | Q49: PbF | R49: 5.295
A50: IRG7I313U | B50: IGBT Discretes | C50: TO-220 FullPak | D50: Discrete | E50: Soft | F50: ULTRAFAST 8-30 kHz | G50: 330 | H50: 20 | I50: 10 | J50: 1.21 | K50: 1.45 | N50: 34 | O50: Industrial | Q50: PbF | R50: 1.021
A51: IRGP20B120U-E | B51: IGBT Discretes | C51: TO-247 | D51: Discrete | E51: Hard | F51: ULTRAFAST 8-30 kHz | G51: 1200 | H51: 40 | I51: 20 | J51: 3.05 | K51: 3.45 | L51: 1.275 | M51: 1.8 | N51: 300 | O51: Industrial | Q51: PbF | R51: 3.488
A52: IRG4PC50K | B52: IGBT Discretes | C52: TO-247 | D52: Discrete | E52: Hard | F52: ULTRAFAST 8-30 kHz | G52: 600 | H52: 52 | I52: 30 | J52: 1.84 | K52: 2.2 | L52: 1.12 | M52: 1.4 | N52: 200 | O52: Industrial | Q52: PbF | R52: 2.748
A53: IRG4PF50W | B53: IGBT Discretes | C53: TO-247 | D53: Discrete | E53: Hard | F53: WARP 30-150 kHz | G53: 900 | H53: 51 | I53: 28 | J53: 2.25 | K53: 2.7 | L53: 1.25 | M53: 1.7 | N53: 200 | O53: Industrial | Q53: PbF | R53: 3.02
A54: IRG7PSH73K10 | B54: IGBT Discretes | C54: TO-274AA | D54: Discrete | E54: Hard | F54: ULTRAFAST 8-30 kHz | G54: 1200 | H54: 220 | I54: 130 | J54: 2 | K54: 2.3 | L54: 12.3 | M54: 14.3 | N54: 1150 | O54: Industrial | Q54: PbF | R54: 11.149
A55: IRG7R313U | B55: IGBT Discretes | C55: D-Pak | D55: Discrete | E55: Soft | F55: ULTRAFAST 8-30 kHz | G55: 330 | H55: 40 | I55: 20 | J55: 1.21 | K55: 1.45 | N55: 78 | O55: Industrial | P55: 1 | Q55: PbF | R55: 1.025
A56: IRG4PH40K | B56: IGBT Discretes | C56: TO-247 | D56: Discrete | E56: Hard | F56: ULTRAFAST 8-30 kHz | G56: 1200 | H56: 30 | I56: 15 | J56: 2.74 | K56: 3.4 | L56: 2.39 | M56: 2.9 | N56: 160 | O56: Industrial | Q56: PbF and Leaded | R56: 2.38
A57: IRG4BC20W-S | B57: IGBT Discretes | C57: D2-Pak | D57: Discrete | E57: Hard | F57: WARP 30-150 kHz | G57: 600 | H57: 13 | I57: 6.5 | J57: 2.16 | K57: 2.6 | L57: 0.14 | M57: 0.2 | N57: 60 | O57: Industrial | P57: 1 | Q57: PbF | R57: 0.888
A58: IRG7IA13U | B58: IGBT Discretes | C58: TO-220 FullPak | D58: Discrete | E58: Soft | F58: ULTRAFAST 8-30 kHz | G58: 360 | H58: 20 | I58: 10 | J58: 1.26 | K58: 1.52 | N58: 34 | O58: Industrial | Q58: PbF | R58: 1.312
A59: IRG4PC60U | B59: IGBT Discretes | C59: TO-247 | D59: Discrete | E59: Hard | F59: ULTRAFAST 8-30 kHz | G59: 600 | H59: 75 | I59: 40 | J59: 1.7 | K59: 2 | L59: 1.3 | M59: 1.8 | N59: 520 | O59: Industrial | Q59: PbF and Leaded | R59: 4.112
A60: IRG4BC20W | B60: IGBT Discretes | C60: TO-220AB | D60: Discrete | E60: Hard | F60: WARP 30-150 kHz | G60: 600 | H60: 13 | I60: 6.5 | J60: 2.16 | K60: 2.6 | L60: 0.14 | M60: 0.2 | N60: 60 | O60: Industrial | Q60: PbF and Leaded | R60: 0.868
A61: IRG4RC10U | B61: IGBT Discretes | C61: D-Pak | D61: Discrete | E61: Hard | F61: ULTRAFAST 8-30 kHz | G61: 600 | H61: 8.5 | I61: 5 | J61: 2.15 | K61: 2.6 | L61: 0.24 | M61: 0.36 | N61: 38 | O61: Industrial | P61: 1 | Q61: PbF | R61: 0.656
A62: IRG4BC40W | B62: IGBT Discretes | C62: TO-220AB | D62: Discrete | E62: Hard | F62: WARP 30-150 kHz | G62: 600 | H62: 40 | I62: 20 | J62: 2.05 | K62: 2.5 | L62: 0.34 | M62: 0.45 | N62: 160 | O62: Industrial | Q62: PbF and Leaded | R62: 1.55
A63: IRG7PH46U | B63: IGBT Discretes | C63: TO-247 | D63: Discrete | F63: ULTRAFAST 8-30 kHz | G63: 1200 | H63: 130 | I63: 75 | J63: 1.7 | K63: 2 | M63: 4.5 | N63: 469 | O63: Industrial | Q63: PbF | R63: 6.125
A64: IRGP4266 | B64: IGBT Discretes | C64: TO-247 | D64: Discrete | E64: Hard | F64: Low-Vceon | G64: 650 | H64: 140 | I64: 90 | J64: 1.7 | K64: 2.1 | L64: 4.9 | M64: 6.8 | N64: 450 | O64: Industrial | Q64: PbF | R64: 4.838
A65: IRG7S313U | B65: IGBT Discretes | C65: D2-Pak | D65: Discrete | E65: Soft | F65: ULTRAFAST 8-30 kHz | G65: 330 | H65: 40 | I65: 20 | J65: 1.21 | K65: 1.45 | N65: 78 | O65: Industrial | P65: 1 | Q65: PbF | R65: 0.986
A66: IRG4BC40WS | B66: IGBT Discretes | C66: D2-Pak | D66: Discrete | E66: Hard | F66: WARP 30-150 kHz | G66: 600 | H66: 40 | I66: 20 | J66: 2.05 | K66: 2.5 | L66: 0.34 | M66: 0.45 | N66: 160 | O66: Industrial | P66: 1 | Q66: PbF | R66: 1.706
A67: IRGP4063 | B67: IGBT Discretes | C67: TO-247 | D67: Discrete | E67: Hard | F67: ULTRAFAST 8-30 kHz | G67: 600 | H67: 96 | I67: 48 | J67: 1.65 | K67: 2.14 | L67: 1.9 | M67: 2.622 | N67: 330 | O67: Industrial | Q67: PbF | R67: 3.35
A68: IRGP4062-E | B68: IGBT Discretes | C68: TO-247AD | D68: Discrete | E68: Hard | F68: ULTRAFAST 8-30 kHz | G68: 600 | H68: 48 | I68: 24 | J68: 1.6 | K68: 1.95 | L68: 0.715 | M68: 0.901 | N68: 250 | O68: Industrial | Q68: PbF | R68: 2.004
A69: IRG7IA19U | B69: IGBT Discretes | C69: TO-220AB | D69: Discrete | E69: Soft | F69: ULTRAFAST 8-30 kHz | G69: 360 | H69: 30 | I69: 15 | J69: 1.26 | K69: 1.52 | N69: 35 | O69: Industrial | Q69: PbF | R69: 1.388
A70: IRG7SC28U | B70: IGBT Discretes | C70: D2-Pak | D70: Discrete | E70: Soft | F70: ULTRAFAST 8-30 kHz | G70: 600 | H70: 60 | I70: 30 | J70: 1.7 | K70: 1.95 | N70: 171 | O70: Industrial | P70: 1 | Q70: PbF
A71: IRGB6B60K | B71: IGBT Discretes | C71: TO-220AB | D71: Discrete | E71: Hard | F71: ULTRAFAST 8-30 kHz | G71: 600 | H71: 13 | I71: 7 | J71: 1.8 | K71: 2.2 | L71: 0.245 | M71: 0.455 | N71: 90 | O71: Industrial | Q71: PbF | R71: 0.976
A72: IRGS6B60K | B72: IGBT Discretes | C72: D2-Pak | D72: Discrete | E72: Hard | F72: ULTRAFAST 8-30 kHz | G72: 600 | H72: 13 | I72: 7 | J72: 1.8 | K72: 1.8 | L72: 0.245 | M72: 0.455 | N72: 90 | O72: Industrial | P72: 1 | Q72: PbF | R72: 1.23
A73: IRG4PC40W | B73: IGBT Discretes | C73: TO-247 | D73: Discrete | E73: Hard | F73: WARP 30-150 kHz | G73: 600 | H73: 40 | I73: 20 | J73: 2.05 | K73: 2.5 | L73: 0.34 | M73: 0.45 | N73: 160 | O73: Industrial | Q73: PbF | R73: 2.22
A74: IRG4BC30K | B74: IGBT Discretes | C74: TO-220AB | D74: Discrete | E74: Hard | F74: ULTRAFAST 8-30 kHz | G74: 600 | H74: 28 | I74: 16 | J74: 2.21 | K74: 2.7 | L74: 0.87 | M74: 1.3 | N74: 100 | O74: Industrial | Q74: PbF | R74: 1.105
A75: IRG7PA19U | B75: IGBT Discretes | C75: TO-247 | D75: Discrete | E75: Soft | F75: ULTRAFAST 8-30 kHz | G75: 360 | H75: 50 | I75: 26 | J75: 1.26 | K75: 1.52 | N75: 104 | O75: Industrial | Q75: PbF | R75: 1.938
A76: IRG4PSC71K | B76: IGBT Discretes | C76: TO-274AA | D76: Discrete | E76: Hard | F76: ULTRAFAST 8-30 kHz | G76: 600 | H76: 85 | I76: 60 | J76: 1.83 | K76: 2.3 | L76: 2.77 | M76: 3.1 | N76: 350 | O76: Industrial | Q76: PbF | R76: 5.359
A78: IRGPS40B120UD | B78: IGBT Co-Packs: IGBT with Anti-Parallel Diode | C78: TO-274AA | D78: Co-Pack | E78: Hard | F78: ULTRAFAST 8-30 kHz | G78: 1200 | H78: 80 | I78: 40 | J78: 3.12 | K78: 3.4 | L78: 3.05 | M78: 3.8 | N78: 595 | O78: Industrial | Q78: PbF | R78: 7.741
A79: IRG4BC15UD | B79: IGBT Co-Packs: IGBT with Anti-Parallel Diode | C79: TO-220AB | D79: Co-Pack | E79: Hard | F79: ULTRAFAST 8-30 kHz | G79: 600 | H79: 14 | I79: 7.8 | J79: 2.02 | K79: 2.4 | L79: 0.5 | M79: 0.63 | N79: 49 | O79: Industrial | Q79: PbF and Leaded | R79: 1.009
A80: IRGB4059D | B80: IGBT Co-Packs: IGBT with Anti-Parallel Diode | C80: TO-220AB | D80: Co-Pack | E80: Hard | F80: ULTRAFAST 8-30 kHz | G80: 600 | H80: 8 | I80: 4 | J80: 1.75 | K80: 2.05 | L80: 0.11 | M80: 0.196 | N80: 56 | O80: Industrial | Q80: PbF | R80: 1.345
A81: IRGP4063D | B81: IGBT Co-Packs: IGBT with Anti-Parallel Diode | C81: TO-247 | D81: Co-Pack | E81: Hard | F81: ULTRAFAST 8-30 kHz | G81: 600 | H81: 96 | I81: 48 | J81: 1.65 | K81: 2.14 | L81: 1.9 | M81: 2.622 | N81: 330 | O81: Industrial | Q81: PbF | R81: 4.132
A82: IRGP4650D | B82: IGBT Co-Packs: IGBT with Anti-Parallel Diode | C82: TO-247 | D82: Co-Pack | E82: Hard | F82: Low-Vceon | G82: 600 | H82: 76 | I82: 50 | J82: 1.6 | K82: 1.9 | L82: 1.02 | M82: 1.261 | N82: 268 | O82: Industrial | Q82: PbF | R82: 2.979
A83: IRG4BC30KD | B83: IGBT Co-Packs: IGBT with Anti-Parallel Diode | C83: TO-220AB | D83: Co-Pack | E83: Hard | F83: ULTRAFAST 8-30 kHz | G83: 600 | H83: 28 | I83: 16 | J83: 2.21 | K83: 2.7 | L83: 1.18 | M83: 1.6 | N83: 100 | O83: Industrial | Q83: PbF | R83: 1.561
A84: IRGP35B60PD | B84: IGBT Co-Packs: IGBT with Anti-Parallel Diode | C84: TO-247 | D84: Co-Pack | E84: Hard | F84: WARP 30-150 kHz | G84: 600 | H84: 60 | I84: 34 | J84: 2.25 | K84: 2.15 | L84: 0.435 | M84: 0.535 | N84: 308 | O84: Industrial | Q84: PbF | R84: 3.578
A85: IRG7PH28UD1 | B85: IGBT Co-Packs: IGBT with Anti-Parallel Diode | C85: TO-247 | D85: Co-Pack | E85: Soft | F85: ULTRAFAST 8-30 kHz | G85: 1200 | H85: 30 | I85: 15 | J85: 1.95 | K85: 2.3 | L85: 0.54 | M85: 0.766 | N85: 115 | O85: Industrial | Q85: PbF | R85: 1.794
A86: IRG4PH40UD2-E | B86: IGBT Co-Packs: IGBT with Anti-Parallel Diode | C86: TO-247AD | D86: Co-Pack | E86: Hard | F86: ULTRAFAST 8-30 kHz | G86: 1200 | H86: 41 | I86: 21 | J86: 2.43 | K86: 3.1 | L86: 3.66 | M86: 4.49 | N86: 160 | O86: Industrial | Q86: PbF | R86: 3.234
A87: IRG4IBC20UD | B87: IGBT Co-Packs: IGBT with Anti-Parallel Diode | C87: TO-220 FullPak | D87: Co-Pack | E87: Hard | F87: ULTRAFAST 8-30 kHz | G87: 600 | H87: 11.4 | I87: 6 | J87: 1.85 | K87: 2.1 | L87: 0.29 | M87: 0.3 | N87: 34 | O87: Industrial | Q87: PbF | R87: 1.34
A88: IRG4PH40UD | B88: IGBT Co-Packs: IGBT with Anti-Parallel Diode | C88: TO-247 | D88: Co-Pack | E88: Hard | F88: ULTRAFAST 8-30 kHz | G88: 1200 | H88: 41 | I88: 21 | J88: 2.43 | K88: 3.1 | L88: 1.1 | M88: 1.5 | N88: 160 | O88: Industrial | Q88: PbF | R88: 3.484
A89: IRGP20B60PD | B89: IGBT Co-Packs: IGBT with Anti-Parallel Diode | C89: TO-247 | D89: Co-Pack | E89: Hard | F89: WARP 30-150 kHz | G89: 600 | H89: 40 | I89: 22 | J89: 2.5 | K89: 2.8 | L89: 0.195 | M89: 0.285 | N89: 220 | O89: Industrial | Q89: PbF and Leaded | R89: 2.755
A90: IRG4BC20UD-S | B90: IGBT Co-Packs: IGBT with Anti-Parallel Diode | C90: D2-Pak | D90: Co-Pack | E90: Hard | F90: ULTRAFAST 8-30 kHz | G90: 600 | H90: 13 | I90: 6.5 | J90: 1.85 | K90: 2.1 | L90: 0.29 | M90: 0.3 | N90: 60 | O90: Industrial | P90: 1 | Q90: PbF | R90: 1.22
A91: IRG4PH30KD | B91: IGBT Co-Packs: IGBT with Anti-Parallel Diode | C91: TO-247 | D91: Co-Pack | E91: Hard | F91: ULTRAFAST 8-30 kHz | G91: 1200 | H91: 20 | I91: 10 | J91: 3.1 | K91: 4.2 | L91: 2.1 | M91: 2.6 | N91: 100 | O91: Industrial | Q91: PbF and Leaded | R91: 2.5
A92: IRGP4068D-E | B92: IGBT Co-Packs: IGBT with Anti-Parallel Diode | C92: TO-247AD | D92: Co-Pack | E92: Hard | F92: ULTRAFAST 8-30 kHz | G92: 600 | H92: 96 | I92: 48 | J92: 1.65 | K92: 2.14 | N92: 330 | O92: Industrial | Q92: PbF | R92: 4.363
A93: IRGP4660D | B93: IGBT Co-Packs: IGBT with Anti-Parallel Diode | C93: TO-247 | D93: Co-Pack | E93: Hard | F93: Low-Vceon | G93: 600 | H93: 100 | I93: 60 | J93: 1.6 | K93: 1.9 | L93: 1.9 | M93: 2.622 | N93: 330 | O93: Industrial | Q93: PbF | R93: 3.409
A94: IRGIB7B60KD | B94: IGBT Co-Packs: IGBT with Anti-Parallel Diode | C94: TO-220 FullPak | D94: Co-Pack | E94: Hard | F94: ULTRAFAST 8-30 kHz | G94: 600 | H94: 12 | I94: 8 | J94: 1.8 | K94: 2.2 | L94: 0.32 | M94: 0.433 | N94: 39 | O94: Industrial | Q94: PbF | R94: 1.713
A95: IRG4PC40KD | B95: IGBT Co-Packs: IGBT with Anti-Parallel Diode | C95: TO-247 | D95: Co-Pack | E95: Hard | F95: ULTRAFAST 8-30 kHz | G95: 600 | H95: 42 | I95: 25 | J95: 2.1 | K95: 2.6 | L95: 1.71 | M95: 2.3 | N95: 160 | O95: Industrial | Q95: PbF | R95: 2.832
A96: IRG4PH50UD | B96: IGBT Co-Packs: IGBT with Anti-Parallel Diode | C96: TO-247 | D96: Co-Pack | E96: Hard | F96: ULTRAFAST 8-30 kHz | G96: 1200 | H96: 45 | I96: 24 | J96: 2.78 | K96: 3.7 | L96: 3.6 | M96: 4.1 | N96: 200 | O96: Industrial | Q96: PbF | R96: 5.034
A97: IRGB15B60KD | B97: IGBT Co-Packs: IGBT with Anti-Parallel Diode | C97: TO-220AB | D97: Co-Pack | E97: Hard | F97: ULTRAFAST 8-30 kHz | G97: 600 | H97: 31 | I97: 15 | J97: 1.8 | K97: 2.2 | L97: 0.56 | M97: 0.785 | N97: 139 | O97: Industrial | Q97: PbF | R97: 2.03
A98: IRG7PH42UD | B98: IGBT Co-Packs: IGBT with Anti-Parallel Diode | C98: TO-247 | D98: Co-Pack | E98: Hard | F98: ULTRAFAST 8-30 kHz | G98: 1200 | H98: 85 | I98: 45 | J98: 1.7 | K98: 2 | L98: 3.29 | M98: 3.8 | N98: 320 | O98: Industrial | Q98: PbF | R98: 5.712
A99: IRG4BC15UD-L | B99: IGBT Co-Packs: IGBT with Anti-Parallel Diode | C99: TO-262 | D99: Co-Pack | E99: Hard | F99: ULTRAFAST 8-30 kHz | G99: 600 | H99: 14 | I99: 7.8 | J99: 2.02 | K99: 2.4 | L99: 0.5 | M99: 0.63 | N99: 49 | O99: Industrial | P99: 1 | Q99: PbF | R99: 1.049
A100: IRG7PH35UD | B100: IGBT Co-Packs: IGBT with Anti-Parallel Diode | C100: TO-247 | D100: Co-Pack | E100: Hard | F100: ULTRAFAST 8-30 kHz | G100: 1200 | H100: 50 | I100: 25 | J100: 1.9 | K100: 2.2 | L100: 1.68 | M100: 2.15 | N100: 180 | O100: Industrial | Q100: PbF | R100: 4.5
A101: IRG4PC30KD | B101: IGBT Co-Packs: IGBT with Anti-Parallel Diode | C101: TO-247 | D101: Co-Pack | E101: Hard | F101: ULTRAFAST 8-30 kHz | G101: 600 | H101: 28 | I101: 16 | J101: 2.21 | K101: 2.7 | L101: 1.18 | M101: 1.6 | N101: 100 | O101: Industrial | Q101: PbF | R101: 2.231
A102: IRG4PC50KD | B102: IGBT Co-Packs: IGBT with Anti-Parallel Diode | C102: TO-247 | D102: Co-Pack | E102: Hard | F102: ULTRAFAST 8-30 kHz | G102: 600 | H102: 52 | I102: 30 | J102: 1.84 | K102: 2.2 | L102: 2.45 | M102: 3 | N102: 104 | O102: Industrial | Q102: PbF | R102: 3.859
A103: IRG4BC20KD | B103: IGBT Co-Packs: IGBT with Anti-Parallel Diode | C103: TO-220AB | D103: Co-Pack | E103: Hard | F103: ULTRAFAST 8-30 kHz | G103: 600 | H103: 16 | I103: 9 | J103: 2.27 | K103: 2.8 | L103: 0.64 | M103: 0.96 | N103: 60 | O103: Industrial | Q103: PbF | R103: 1.184
A104: IRGP4068D | B104: IGBT Co-Packs: IGBT with Anti-Parallel Diode | C104: TO-247 | D104: Co-Pack | E104: Hard | F104: ULTRAFAST 8-30 kHz | G104: 600 | H104: 96 | I104: 48 | J104: 1.65 | K104: 2.14 | N104: 330 | O104: Industrial | Q104: PbF | R104: 4.462
A105: IRGP35B60PD-E | B105: IGBT Co-Packs: IGBT with Anti-Parallel Diode | C105: TO-247AD | D105: Co-Pack | E105: Hard | F105: WARP 30-150 kHz | G105: 600 | H105: 60 | I105: 34 | J105: 2.25 | K105: 2.55 | L105: 0.435 | M105: 0.535 | N105: 308 | O105: Industrial | Q105: PbF | R105: 3.678
A106: IRGB4056D | B106: IGBT Co-Packs: IGBT with Anti-Parallel Diode | C106: TO-220AB | D106: Co-Pack | E106: Hard | F106: ULTRAFAST 8-30 kHz | G106: 600 | H106: 24 | I106: 12 | J106: 1.55 | K106: 1.85 | L106: 0.3 | M106: 0.391 | N106: 140 | O106: Industrial | Q106: PbF | R106: 1.98
A107: IRGP50B60PD | B107: IGBT Co-Packs: IGBT with Anti-Parallel Diode | C107: TO-247 | D107: Co-Pack | E107: Hard | F107: WARP 30-150 kHz | G107: 600 | H107: 75 | I107: 42 | J107: 2 | K107: 2.2 | L107: 0.74 | M107: 0.96 | N107: 370 | O107: Industrial | Q107: PbF | R107: 4.454
A108: IRG4IBC10UD | B108: IGBT Co-Packs: IGBT with Anti-Parallel Diode | C108: TO-220 FullPak | D108: Co-Pack | E108: Hard | F108: ULTRAFAST 8-30 kHz | G108: 600 | H108: 6.8 | I108: 3.9 | J108: 2.15 | K108: 2.6 | L108: 0.26 | M108: 0.33 | N108: 25 | O108: Industrial | Q108: PbF | R108: 1.082
A109: IRG7PH46UD | B109: IGBT Co-Packs: IGBT with Anti-Parallel Diode | C109: TO-247 | D109: Co-Pack | E109: Hard | F109: ULTRAFAST 8-30 kHz | G109: 1200 | H109: 108 | I109: 57 | J109: 1.7 | K109: 2 | L109: 4.45 | M109: 6.24 | N109: 390 | O109: Industrial | Q109: PbF | R109: 6.562
A110: IRG4PSH71KD | B110: IGBT Co-Packs: IGBT with Anti-Parallel Diode | C110: TO-274AA | D110: Co-Pack | E110: Hard | F110: ULTRAFAST 8-30 kHz | G110: 1200 | H110: 78 | I110: 42 | J110: 2.97 | K110: 3.9 | L110: 8.9 | M110: 11.6 | N110: 350 | O110: Industrial | Q110: PbF and Leaded | R110: 11.416
A111: IRGP30B60KD-E | B111: IGBT Co-Packs: IGBT with Anti-Parallel Diode | C111: TO-247 | D111: Co-Pack | E111: Hard | F111: ULTRAFAST 8-30 kHz | G111: 600 | H111: 60 | I111: 30 | J111: 1.95 | K111: 2.35 | L111: 1.175 | M111: 1.575 | N111: 304 | O111: Industrial | Q111: PbF | R111: 3.44
A112: IRGB4062D | B112: IGBT Co-Packs: IGBT with Anti-Parallel Diode | C112: TO-220AB | D112: Co-Pack | E112: Hard | F112: ULTRAFAST 8-30 kHz | G112: 600 | H112: 48 | I112: 24 | J112: 1.6 | K112: 1.95 | L112: 0.715 | M112: 0.901 | N112: 250 | O112: Industrial | Q112: PbF | R112: 2.755
A113: IRGSL4B60KD1 | B113: IGBT Co-Packs: IGBT with Anti-Parallel Diode | C113: TO-262 | D113: Co-Pack | E113: Hard | F113: ULTRAFAST 8-30 kHz | G113: 600 | H113: 11 | I113: 7.6 | J113: 2.1 | K113: 2.5 | L113: 0.12 | M113: 0.13 | N113: 63 | O113: Industrial | P113: 1 | Q113: PbF | R113: 1.21
A114: IRGR3B60KD2 | B114: IGBT Co-Packs: IGBT with Anti-Parallel Diode | C114: D-Pak | D114: Co-Pack | E114: Hard | F114: ULTRAFAST 8-30 kHz | G114: 600 | H114: 7.8 | I114: 4.2 | J114: 1.9 | K114: 2.4 | L114: 0.1 | M114: 0.12 | N114: 52 | O114: Industrial | P114: 1 | Q114: PbF | R114: 0.979
A115: IRGPS60B120KD | B115: IGBT Co-Packs: IGBT with Anti-Parallel Diode | C115: TO-274AA | D115: Co-Pack | E115: Hard | F115: ULTRAFAST 8-30 kHz | G115: 1200 | H115: 105 | I115: 60 | J115: 2.5 | K115: 2.75 | L115: 8 | M115: 10.32 | N115: 595 | O115: Industrial | Q115: PbF | R115: 9.758
A116: IRGP50B60PD1-E | B116: IGBT Co-Packs: IGBT with Anti-Parallel Diode | C116: TO-247AD | D116: Co-Pack | E116: Hard | F116: WARP 30-150 kHz | G116: 600 | H116: 75 | I116: 45 | J116: 2 | K116: 2.35 | L116: 0.63 | M116: 0.75 | N116: 390 | O116: Industrial | Q116: PbF | R116: 4.24
A117: IRGSL15B60KD | B117: IGBT Co-Packs: IGBT with Anti-Parallel Diode | C117: TO-262 | D117: Co-Pack | E117: Hard | F117: ULTRAFAST 8-30 kHz | G117: 600 | H117: 31 | I117: 15 | J117: 1.8 | K117: 2.2 | L117: 0.56 | M117: 0.785 | N117: 139 | O117: Industrial | P117: 1 | Q117: PbF
A118: IRGS4B60KD1 | B118: IGBT Co-Packs: IGBT with Anti-Parallel Diode | C118: D2-Pak | D118: Co-Pack | E118: Hard | F118: ULTRAFAST 8-30 kHz | G118: 600 | H118: 11 | I118: 7.6 | J118: 2.1 | K118: 2.5 | L118: 0.12 | M118: 0.13 | N118: 63 | O118: Industrial | P118: 1 | Q118: PbF | R118: 1.19
A119: IRGB6B60KD | B119: IGBT Co-Packs: IGBT with Anti-Parallel Diode | C119: TO-220AB | D119: Co-Pack | E119: Hard | F119: ULTRAFAST 8-30 kHz | G119: 600 | H119: 13 | I119: 7 | J119: 1.8 | K119: 2 | L119: 0.245 | M119: 0.455 | N119: 90 | O119: Industrial | Q119: PbF | R119: 1.304
A120: IRG4PH20KD | B120: IGBT Co-Packs: IGBT with Anti-Parallel Diode | C120: TO-247 | D120: Co-Pack | E120: Hard | F120: ULTRAFAST 8-30 kHz | G120: 1200 | H120: 11 | I120: 5 | J120: 3.17 | K120: 4.3 | L120: 0.92 | M120: 1.2 | N120: 60 | O120: Industrial | Q120: PbF | R120: 1.975
A121: IRG4IBC30UD | B121: IGBT Co-Packs: IGBT with Anti-Parallel Diode | C121: TO-220 FullPak | D121: Co-Pack | E121: Hard | F121: ULTRAFAST 8-30 kHz | G121: 600 | H121: 17 | I121: 8.9 | J121: 1.95 | K121: 2.1 | L121: 0.54 | M121: 0.9 | N121: 45 | O121: Industrial | Q121: PbF | R121: 1.724
A122: IRG4BC15UD-S | B122: IGBT Co-Packs: IGBT with Anti-Parallel Diode | C122: D2-Pak | D122: Co-Pack | E122: Hard | F122: ULTRAFAST 8-30 kHz | G122: 600 | H122: 14 | I122: 7.8 | J122: 2.02 | K122: 2.4 | L122: 0.5 | M122: 0.63 | N122: 49 | O122: Industrial | P122: 1 | Q122: PbF | R122: 1.029
A123: IRGSL6B60KD | B123: IGBT Co-Packs: IGBT with Anti-Parallel Diode | C123: TO-262 | D123: Co-Pack | E123: Hard | F123: ULTRAFAST 8-30 kHz | G123: 600 | H123: 13 | I123: 7 | J123: 1.8 | K123: 2 | L123: 0.245 | M123: 0.455 | N123: 90 | O123: Industrial | P123: 1 | Q123: PbF | R123: 1.344
A124: IRG7PH35UD1M | B124: IGBT Co-Packs: IGBT with Anti-Parallel Diode | C124: TO-247 | D124: Co-Pack | E124: Soft | F124: ULTRAFAST 8-30 kHz | G124: 1200 | H124: 50 | I124: 25 | J124: 1.9 | K124: 2.2 | N124: 179 | O124: Industrial | Q124: PbF
A125: IRGB20B60PD1 | B125: IGBT Co-Packs: IGBT with Anti-Parallel Diode | C125: TO-220AB | D125: Co-Pack | E125: Hard | F125: WARP 30-150 kHz | G125: 600 | H125: 40 | I125: 22 | J125: 2.5 | K125: 2.8 | L125: 0.195 | M125: 0.285 | N125: 215 | O125: Industrial | Q125: PbF and Leaded | R125: 1.93
A126: IRG7PSH50UD | B126: IGBT Co-Packs: IGBT with Anti-Parallel Diode | C126: TO-274AA | D126: Co-Pack | F126: ULTRAFAST 8-30 kHz | G126: 1200 | H126: 116 | I126: 70 | J126: 1.7 | K126: 2 | L126: 5.8 | M126: 7.8 | N126: 462 | O126: Industrial | Q126: PbF
A127: IRG4BC30KD-S | B127: IGBT Co-Packs: IGBT with Anti-Parallel Diode | C127: D2-Pak | D127: Co-Pack | E127: Hard | F127: ULTRAFAST 8-30 kHz | G127: 600 | H127: 28 | I127: 16 | J127: 2.21 | K127: 2.7 | L127: 1.18 | M127: 1.6 | N127: 100 | O127: Industrial | P127: 1 | Q127: PbF and Leaded | R127: 1.581
A128: IRG7PH30K10D | B128: IGBT Co-Packs: IGBT with Anti-Parallel Diode | C128: TO-247 | D128: Co-Pack | E128: Hard | F128: ULTRAFAST 8-30 kHz | G128: 1200 | H128: 30 | I128: 16 | J128: 2.05 | K128: 2.35 | L128: 0.91 | M128: 1.36 | N128: 180 | O128: Industrial | Q128: PbF | R128: 4.28
A129: IRG4PH40KD | B129: IGBT Co-Packs: IGBT with Anti-Parallel Diode | C129: TO-247 | D129: Co-Pack | E129: Hard | F129: ULTRAFAST 8-30 kHz | G129: 1200 | H129: 30 | I129: 15 | J129: 2.74 | K129: 3.4 | L129: 2.43 | M129: 2.8 | N129: 160 | O129: Industrial | Q129: PbF | R129: 3.34
A130: IRGP4072D | B130: IGBT Co-Packs: IGBT with Anti-Parallel Diode | C130: TO-247 | D130: Co-Pack | E130: Hard | F130: ULTRAFAST 8-30 kHz | G130: 300 | H130: 70 | I130: 40 | J130: 1.46 | K130: 1.7 | L130: 1.247 | M130: 1.542 | N130: 180 | O130: Industrial | Q130: PbF | R130: 3.425
A131: IRG7PH35UD1 | B131: IGBT Co-Packs: IGBT with Anti-Parallel Diode | C131: TO-247 | D131: Co-Pack | E131: Soft | F131: ULTRAFAST 8-30 kHz | G131: 1200 | H131: 50 | I131: 25 | J131: 1.9 | K131: 2.2 | L131: 1.68 | M131: 2.15 | N131: 179 | O131: Industrial | Q131: PbF | R131: 3.45
A132: IRG4BC30UD | B132: IGBT Co-Packs: IGBT with Anti-Parallel Diode | C132: TO-220AB | D132: Co-Pack | E132: Hard | F132: ULTRAFAST 8-30 kHz | G132: 600 | H132: 23 | I132: 12 | J132: 1.95 | K132: 2.1 | L132: 0.54 | M132: 0.9 | N132: 100 | O132: Industrial | Q132: PbF and Leaded | R132: 1.584
A133: IRGB5B120KD | B133: IGBT Co-Packs: IGBT with Anti-Parallel Diode | C133: TO-220AB | D133: Co-Pack | E133: Hard | F133: ULTRAFAST 8-30 kHz | G133: 1200 | H133: 12 | I133: 6 | J133: 2.75 | K133: 3 | L133: 0.72 | M133: 0.88 | N133: 89 | O133: Industrial | Q133: PbF | R133: 2.755
A134: IRG4PC30UD | B134: IGBT Co-Packs: IGBT with Anti-Parallel Diode | C134: TO-247 | D134: Co-Pack | E134: Hard | F134: ULTRAFAST 8-30 kHz | G134: 600 | H134: 23 | I134: 12 | J134: 1.95 | K134: 2.1 | L134: 0.54 | M134: 0.9 | N134: 100 | O134: Industrial | Q134: PbF | R134: 2.254
A135: IRG4IBC30KD | B135: IGBT Co-Packs: IGBT with Anti-Parallel Diode | C135: TO-220 FullPak | D135: Co-Pack | E135: Hard | F135: ULTRAFAST 8-30 kHz | G135: 600 | H135: 17 | I135: 9.2 | J135: 2.21 | K135: 2.7 | L135: 1.185 | M135: 1.6 | N135: 45 | O135: Industrial | Q135: PbF and Leaded | R135: 1.701
A136: IRGPS4067D | B136: IGBT Co-Packs: IGBT with Anti-Parallel Diode | C136: TO-274AA | D136: Co-Pack | E136: Hard | F136: ULTRAFAST 8-30 kHz | G136: 600 | H136: 240 | I136: 160 | J136: 1.7 | K136: 2.05 | N136: 750 | O136: Industrial | Q136: PbF | R136: 8.99
A137: IRGB4061D | B137: IGBT Co-Packs: IGBT with Anti-Parallel Diode | C137: TO-220AB | D137: Co-Pack | E137: Hard | F137: ULTRAFAST 8-30 kHz | G137: 600 | H137: 36 | I137: 18 | J137: 1.65 | K137: 1.95 | L137: 0.445 | M137: 0.545 | N137: 206 | O137: Industrial | Q137: PbF | R137: 2.18
A138: IRGP30B120KD-E | B138: IGBT Co-Packs: IGBT with Anti-Parallel Diode | C138: TO-247 | D138: Co-Pack | E138: Hard | F138: ULTRAFAST 8-30 kHz | G138: 1200 | H138: 60 | I138: 30 | J138: 2.46 | K138: 2.66 | L138: 2.559 | M138: 3.05 | N138: 300 | O138: Industrial | Q138: PbF | R138: 5.7
A139: IRG6B330UD | B139: IGBT Co-Packs: IGBT with Anti-Parallel Diode | C139: TO-220AB | D139: Co-Pack | E139: Hard | F139: ULTRAFAST 8-30 kHz | G139: 330 | H139: 70 | I139: 40 | J139: 1.36 | K139: 1.68 | N139: 160 | O139: Industrial | Q139: PbF
A140: IRG4BC10UD | B140: IGBT Co-Packs: IGBT with Anti-Parallel Diode | C140: TO-220AB | D140: Co-Pack | E140: Hard | F140: ULTRAFAST 8-30 kHz | G140: 600 | H140: 8.5 | I140: 5 | J140: 2.15 | K140: 2.6 | L140: 0.26 | M140: 0.33 | N140: 38 | O140: Industrial | Q140: PbF | R140: 0.942
A141: IRGP4066D | B141: IGBT Co-Packs: IGBT with Anti-Parallel Diode | C141: TO-247 | D141: Co-Pack | E141: Hard | F141: ULTRAFAST 8-30 kHz | G141: 600 | H141: 140 | I141: 90 | J141: 1.7 | K141: 2.1 | L141: 4.62 | M141: 6.4 | N141: 454 | O141: Industrial | Q141: PbF | R141: 6
A142: IRG4PSH71UD | B142: IGBT Co-Packs: IGBT with Anti-Parallel Diode | C142: TO-274AA | D142: Co-Pack | E142: Hard | F142: ULTRAFAST 8-30 kHz | G142: 1200 | H142: 99 | I142: 50 | J142: 2.52 | K142: 2.7 | L142: 18.2 | M142: 19.7 | N142: 350 | O142: Industrial | Q142: PbF | R142: 13.06
A143: IRG4PC40UD | B143: IGBT Co-Packs: IGBT with Anti-Parallel Diode | C143: TO-247 | D143: Co-Pack | E143: Hard | F143: ULTRAFAST 8-30 kHz | G143: 600 | H143: 40 | I143: 20 | J143: 1.72 | K143: 2.1 | L143: 1.1 | M143: 1.5 | N143: 160 | O143: Industrial | Q143: PbF | R143: 2.831
A144: IRGP4078D | B144: IGBT Co-Packs: IGBT with Anti-Parallel Diode | C144: TO-247 | D144: Co-Pack | E144: Soft | F144: Low-Vceon | G144: 600 | H144: 74 | I144: 50 | J144: 1.9 | K144: 2.2 | N144: 278 | O144: Industrial | Q144: PbF | R144: 2.365
A145: IRGB4B60KD1 | B145: IGBT Co-Packs: IGBT with Anti-Parallel Diode | C145: TO-220AB | D145: Co-Pack | E145: Hard | F145: ULTRAFAST 8-30 kHz | G145: 600 | H145: 11 | I145: 7.6 | J145: 2.1 | K145: 2.5 | L145: 0.12 | M145: 0.13 | N145: 63 | O145: Industrial | Q145: PbF | R145: 1.246
A146: IRG7PH50K10D | B146: IGBT Co-Packs: IGBT with Anti-Parallel Diode | C146: TO-247 | D146: Co-Pack | E146: Hard | F146: ULTRAFAST 8-30 kHz | G146: 1200 | H146: 90 | I146: 50 | J146: 1.9 | K146: 2.4 | L146: 4.2 | M146: 6 | N146: 400 | O146: Industrial | Q146: PbF | R146: 4.67
A147: IRGS15B60KD | B147: IGBT Co-Packs: IGBT with Anti-Parallel Diode | C147: D2-Pak | D147: Co-Pack | E147: Hard | F147: ULTRAFAST 8-30 kHz | G147: 600 | H147: 31 | I147: 15 | J147: 1.8 | K147: 2.2 | L147: 0.56 | M147: 0.785 | N147: 139 | O147: Industrial | P147: 1 | Q147: PbF | R147: 2.05
A148: IRGB4045D | B148: IGBT Co-Packs: IGBT with Anti-Parallel Diode | C148: TO-220AB | D148: Co-Pack | E148: Hard | F148: ULTRAFAST 8-30 kHz | G148: 600 | H148: 12 | I148: 6 | J148: 1.7 | K148: 2 | L148: 0.178 | M148: 0.229 | N148: 77 | O148: Industrial | Q148: PbF | R148: 1.464
A149: IRGSL4062D | B149: IGBT Co-Packs: IGBT with Anti-Parallel Diode | C149: TO-262 | D149: Co-Pack | E149: Hard | F149: ULTRAFAST 8-30 kHz | G149: 600 | H149: 48 | I149: 24 | J149: 1.6 | K149: 1.95 | L149: 0.715 | M149: 0.901 | N149: 250 | O149: Industrial | P149: 1 | Q149: PbF | R149: 2.795
A150: IRG4PH50KD | B150: IGBT Co-Packs: IGBT with Anti-Parallel Diode | C150: TO-247 | D150: Co-Pack | E150: Hard | F150: ULTRAFAST 8-30 kHz | G150: 1200 | H150: 45 | I150: 24 | J150: 2.77 | K150: 3.5 | L150: 5.73 | M150: 7.9 | N150: 200 | O150: Industrial | Q150: PbF | R150: 4.684
A151: IRG4PSC71UD | B151: IGBT Co-Packs: IGBT with Anti-Parallel Diode | C151: TO-274AA | D151: Co-Pack | E151: Hard | F151: ULTRAFAST 8-30 kHz | G151: 600 | H151: 85 | I151: 60 | J151: 1.67 | K151: 2 | L151: 5.53 | M151: 7.2 | N151: 350 | O151: Industrial | Q151: PbF | R151: 7.885
A152: IRG4IBC20KD | B152: IGBT Co-Packs: IGBT with Anti-Parallel Diode | C152: TO-220 FullPak | D152: Co-Pack | E152: Hard | F152: ULTRAFAST 8-30 kHz | G152: 600 | H152: 11.5 | I152: 6.3 | J152: 2.27 | K152: 2.8 | L152: 0.64 | M152: 0.96 | N152: 34 | O152: Industrial | Q152: PbF | R152: 1.324
A153: IRGB10B60KD | B153: IGBT Co-Packs: IGBT with Anti-Parallel Diode | C153: TO-220AB | D153: Co-Pack | E153: Hard | F153: ULTRAFAST 8-30 kHz | G153: 600 | H153: 22 | I153: 12 | J153: 1.8 | K153: 2.2 | L153: 0.39 | M153: 0.67 | N153: 104 | O153: Industrial | Q153: PbF | R153: 1.694
A154: IRGB4060D | B154: IGBT Co-Packs: IGBT with Anti-Parallel Diode | C154: TO-220AB | D154: Co-Pack | E154: Hard | F154: ULTRAFAST 8-30 kHz | G154: 600 | H154: 16 | I154: 8 | J154: 1.55 | K154: 1.85 | L154: 0.215 | M154: 0.31 | N154: 99 | O154: Industrial | Q154: PbF | R154: 1.55
A155: IRGP4062D | B155: IGBT Co-Packs: IGBT with Anti-Parallel Diode | C155: TO-247 | D155: Co-Pack | E155: Hard | F155: ULTRAFAST 8-30 kHz | G155: 600 | H155: 48 | I155: 24 | J155: 1.6 | K155: 1.95 | L155: 0.715 | M155: 0.901 | N155: 250 | O155: Industrial | Q155: PbF | R155: 3.425
A156: IRGIB6B60KD | B156: IGBT Co-Packs: IGBT with Anti-Parallel Diode | C156: TO-220 FullPak | D156: Co-Pack | E156: Hard | F156: ULTRAFAST 8-30 kHz | G156: 600 | H156: 11 | I156: 7 | J156: 1.8 | K156: 2.2 | L156: 0.245 | M156: 0.455 | N156: 32 | O156: Industrial | Q156: PbF | R156: 1.444
A157: IRGIB15B60KD1 | B157: IGBT Co-Packs: IGBT with Anti-Parallel Diode | C157: TO-220 FullPak | D157: Co-Pack | E157: Hard | F157: ULTRAFAST 8-30 kHz | G157: 600 | H157: 19 | I157: 12 | J157: 1.8 | K157: 2.2 | L157: 0.461 | M157: 0.556 | N157: 52 | O157: Industrial | Q157: PbF | R157: 2.02
A158: IRGS4045D | B158: IGBT Co-Packs: IGBT with Anti-Parallel Diode | C158: D2-Pak | D158: Co-Pack | E158: Soft | F158: ULTRAFAST 8-30 kHz | G158: 600 | H158: 12 | I158: 6 | J158: 1.7 | K158: 2 | L158: 0.178 | M158: 0.229 | N158: 77 | O158: Industrial | P158: 1 | Q158: PbF | R158: 1.106
A159: IRG4BC20UD | B159: IGBT Co-Packs: IGBT with Anti-Parallel Diode | C159: TO-220AB | D159: Co-Pack | E159: Hard | F159: ULTRAFAST 8-30 kHz | G159: 600 | H159: 13 | I159: 6.5 | J159: 1.85 | K159: 2.1 | L159: 0.29 | M159: 0.3 | N159: 60 | O159: Industrial | Q159: PbF | R159: 1.2
A160: IRG4PC50UD | B160: IGBT Co-Packs: IGBT with Anti-Parallel Diode | C160: TO-247 | D160: Co-Pack | E160: Hard | F160: ULTRAFAST 8-30 kHz | G160: 600 | H160: 55 | I160: 27 | J160: 1.65 | K160: 2 | L160: 1.58 | M160: 1.9 | N160: 200 | O160: Industrial | Q160: PbF | R160: 3.916
A161: IRGS4056D | B161: IGBT Co-Packs: IGBT with Anti-Parallel Diode | C161: D2-Pak | D161: Co-Pack | E161: Hard | F161: ULTRAFAST 8-30 kHz | G161: 600 | H161: 24 | I161: 12 | J161: 1.55 | K161: 1.85 | L161: 0.3 | M161: 0.391 | N161: 140 | O161: Industrial | P161: 1 | Q161: PbF | R161: 2
A162: IRGP4069D | B162: IGBT Co-Packs: IGBT with Anti-Parallel Diode | C162: TO-247 | D162: Co-Pack | E162: Hard | F162: ULTRAFAST 8-30 kHz | G162: 600 | H162: 76 | I162: 50 | J162: 1.6 | K162: 1.85 | L162: 1.02 | M162: 2.2 | N162: 268 | O162: Industrial | Q162: PbF | R162: 3.688
A163: IRGS6B60KD | B163: IGBT Co-Packs: IGBT with Anti-Parallel Diode | C163: D2-Pak | D163: Co-Pack | E163: Hard | F163: ULTRAFAST 8-30 kHz | G163: 600 | H163: 13 | I163: 7 | J163: 1.8 | K163: 2 | L163: 0.245 | M163: 0.455 | N163: 90 | O163: Industrial | P163: 1 | Q163: PbF | R163: 1.324
A164: IRGS4062D | B164: IGBT Co-Packs: IGBT with Anti-Parallel Diode | C164: D2-Pak | D164: Co-Pack | E164: Hard | F164: ULTRAFAST 8-30 kHz | G164: 600 | H164: 48 | I164: 24 | J164: 1.6 | K164: 1.95 | L164: 0.715 | M164: 0.901 | N164: 250 | O164: Industrial | P164: 1 | Q164: PbF | R164: 2.775
A165: IRGSL10B60KD | B165: IGBT Co-Packs: IGBT with Anti-Parallel Diode | C165: TO-262 | D165: Co-Pack | E165: Hard | F165: ULTRAFAST 8-30 kHz | G165: 600 | H165: 22 | I165: 12 | J165: 1.8 | K165: 2.2 | L165: 0.39 | M165: 0.67 | N165: 104 | O165: Industrial | P165: 1 | Q165: PbF | R165: 1.734
A166: IRG7PH42UD1M | B166: IGBT Co-Packs: IGBT with Anti-Parallel Diode | C166: TO-247AD | D166: Co-Pack | E166: Soft | F166: ULTRAFAST 8-30 kHz | G166: 1200 | H166: 85 | I166: 45 | J166: 1.7 | K166: 2 | N166: 313 | O166: Industrial | Q166: PbF
A167: IRGS10B60KD | B167: IGBT Co-Packs: IGBT with Anti-Parallel Diode | C167: D2-Pak | D167: Co-Pack | E167: Hard | F167: ULTRAFAST 8-30 kHz | G167: 600 | H167: 22 | I167: 12 | J167: 1.8 | K167: 2.2 | L167: 0.39 | M167: 0.607 | N167: 104 | O167: Industrial | P167: 1 | Q167: PbF | R167: 1.714
A168: IRGP4640D | B168: IGBT Co-Packs: IGBT with Anti-Parallel Diode | C168: TO-247 | D168: Co-Pack | E168: Hard | F168: Low-Vceon | G168: 600 | H168: 65 | I168: 40 | J168: 1.6 | K168: 1.9 | L168: 1.26 | N168: 250 | O168: Industrial | Q168: PbF | R168: 2.15
A169: IRGIB10B60KD1 | B169: IGBT Co-Packs: IGBT with Anti-Parallel Diode | C169: TO-220 FullPak | D169: Co-Pack | E169: Hard | F169: ULTRAFAST 8-30 kHz | G169: 600 | H169: 16 | I169: 10 | J169: 1.7 | K169: 2.1 | L169: 0.321 | M169: 0.434 | N169: 44 | O169: Industrial | Q169: PbF | R169: 1.716
A170: IRGR2B60KD | B170: IGBT Co-Packs: IGBT with Anti-Parallel Diode | C170: D-Pak | D170: Co-Pack | E170: Hard | F170: Low-Vceon | G170: 600 | H170: 6.3 | I170: 3.7 | J170: 1.95 | K170: 2.25 | L170: 0.11 | M170: 0.28 | N170: 35 | O170: Industrial | P170: 1 | Q170: PbF | R170: 0.39
A171: IRGB4064D | B171: IGBT Co-Packs: IGBT with Anti-Parallel Diode | C171: TO-220AB | D171: Co-Pack | E171: Hard | F171: ULTRAFAST 8-30 kHz | G171: 600 | H171: 20 | I171: 10 | J171: 1.6 | K171: 1.91 | L171: 0.229 | M171: 0.339 | N171: 101 | O171: Industrial | Q171: PbF | R171: 1.859
A172: IRG4BC10KD | B172: IGBT Co-Packs: IGBT with Anti-Parallel Diode | C172: TO-220AB | D172: Co-Pack | E172: Hard | F172: ULTRAFAST 8-30 kHz | G172: 600 | H172: 9 | I172: 5 | J172: 2.39 | K172: 2.62 | L172: 0.39 | M172: 0.48 | N172: 38 | O172: Industrial | Q172: PbF and Leaded | R172: 0.932
A173: IRG7PH42UD1 | B173: IGBT Co-Packs: IGBT with Anti-Parallel Diode | C173: TO-247 | D173: Co-Pack | E173: Soft | F173: ULTRAFAST 8-30 kHz | G173: 1200 | H173: 85 | I173: 45 | J173: 1.7 | K173: 2 | L173: 3.29 | M173: 3.8 | N173: 313 | O173: Industrial | Q173: PbF | R173: 4.875
A174: IRGP4066D-E | B174: IGBT Co-Packs: IGBT with Anti-Parallel Diode | C174: TO-247AD | D174: Co-Pack | E174: Hard | F174: ULTRAFAST 8-30 kHz | G174: 600 | H174: 140 | I174: 90 | J174: 1.7 | K174: 2.1 | L174: 4.62 | M174: 6.4 | N174: 454 | O174: Industrial | Q174: PbF | R174: 6.075
A175: IRGR4045D | B175: IGBT Co-Packs: IGBT with Anti-Parallel Diode | C175: D-Pak | D175: Co-Pack | E175: Soft | F175: ULTRAFAST 8-30 kHz | G175: 600 | H175: 12 | I175: 6 | J175: 1.7 | K175: 2 | L175: 0.178 | M175: 0.229 | N175: 77 | O175: Industrial | P175: 1 | Q175: PbF | R175: 1.318
A176: IRG4PF50WD | B176: IGBT Co-Packs: IGBT with Anti-Parallel Diode | C176: TO-247 | D176: Co-Pack | E176: Hard | F176: WARP 30-150 kHz | G176: 900 | H176: 51 | I176: 28 | J176: 2.25 | K176: 2.7 | L176: 3.97 | M176: 5.3 | N176: 200 | O176: Industrial | Q176: PbF | R176: 4.528
A177: IRG4PSC71KD | B177: IGBT Co-Packs: IGBT with Anti-Parallel Diode | C177: TO-274AA | D177: Co-Pack | E177: Hard | F177: ULTRAFAST 8-30 kHz | G177: 600 | H177: 85 | I177: 60 | J177: 1.83 | K177: 2.3 | L177: 6.28 | M177: 7.7 | N177: 350 | O177: Industrial | Q177: PbF | R177: 7.761
A178: IRGP4063D1 | B178: IGBT Co-Packs: IGBT with Anti-Parallel Diode | C178: TO-247 | D178: Co-Pack | E178: Hard | F178: ULTRAFAST 8-30 kHz | G178: 600 | H178: 100 | I178: 60 | J178: 1.65 | K178: 2.14 | L178: 2.5 | M178: 4.3 | N178: 330 | Q178: PbF | R178: 4.082
A179: IRG4BC20FD | B179: IGBT Co-Packs: IGBT with Anti-Parallel Diode | C179: TO-220AB | D179: Co-Pack | E179: Hard | F179: FAST 1-8 kHz | G179: 600 | H179: 16 | I179: 9 | J179: 1.66 | K179: 2 | L179: 0.89 | M179: 1.3 | N179: 60 | O179: Industrial | Q179: PbF | R179: 1.168
A180: IRGS4064D | B180: IGBT Co-Packs: IGBT with Anti-Parallel Diode | C180: D2-Pak | D180: Co-Pack | E180: Hard | F180: ULTRAFAST 8-30 kHz | G180: 600 | H180: 20 | I180: 10 | J180: 1.6 | K180: 1.91 | L180: 0.229 | M180: 0.313 | N180: 101 | Q180: PbF
A181: IRGP20B120UD-E | B181: IGBT Co-Packs: IGBT with Anti-Parallel Diode | C181: TO-247 | D181: Co-Pack | E181: Hard | F181: ULTRAFAST 8-30 kHz | G181: 1200 | H181: 40 | I181: 20 | J181: 3.05 | K181: 3.45 | L181: 1.275 | M181: 1.8 | N181: 300 | O181: Industrial | Q181: PbF | R181: 5.089
A182: IRG4RC10UD | B182: IGBT Co-Packs: IGBT with Anti-Parallel Diode | C182: D-Pak | D182: Co-Pack | E182: Hard | F182: ULTRAFAST 8-30 kHz | G182: 600 | H182: 8.5 | I182: 5 | J182: 2.15 | K182: 2.6 | L182: 0.26 | M182: 0.33 | N182: 38 | O182: Industrial | P182: 1 | Q182: PbF | R182: 1.099

Sheet: load
A1: AC induction motor power, currents and voltages
A3: Data | B3: value | C3: unit | D3: source
A4: Discharging battery voltage | B4: 3 | C4: V | D4: http://en.winston-battery.com/index.php/products/power-battery/item/wb-lyp60aha?category_id=176
A5: Charged battery voltage | B5: 4 | C5: V | D5: http://en.winston-battery.com/index.php/products/power-battery/item/wb-lyp60aha?category_id=176
A6: Cell internal resistance | B6: 0.0007 | C6: Ω | D6: http://www.ev-power.eu/docs/pdf/Winston-InternalResistance.pdf
A7: Amount of cells in series | B7: 43
A8: Motor power factor | B8: 0.83 | D8: http://tamel.pl/pdf/data-sheets/aluminium/4pole/b35/data%20sheet%20-%20WU-DA132MVX-H%204P-132W327421T-7,5%20kW%20IE2.pdf
A9: Motor efficiency | B9: 0.887 | D9: http://tamel.pl/pdf/data-sheets/aluminium/4pole/b35/data%20sheet%20-%20WU-DA132MVX-H%204P-132W327421T-7,5%20kW%20IE2.pdf
A10: Desired controller efficiency | B10: 0.97
A11: Desired output power | B11: 15000 | C11: W
A12: Voltage safety margin | B12: 0.5
A13: Max system voltage | B13: 370 | C13: V
A14: Max cells | B14: of:=ROUNDDOWN(max_voltage/cell_voltage; 0) -> 123
A16: Intermediate values
A17: Electrical output power | B17: of:=mechanical_power/motor_eff -> 16910.9357384442 | C17: W | D17: http://en.wikipedia.org/wiki/Energy_conversion_efficiency#Overview
A18: Electrical input power | B18: of:=motor_power/controller_eff -> 17433.9543695301 | C18: W | D18: http://en.wikipedia.org/wiki/Energy_conversion_efficiency#Overview
A19: Pack internal resistance | B19: of:=cell_resistance*cell_count -> 0.0301 | C19: Ω | D19: http://en.wikipedia.org/wiki/Series_and_parallel_circuits#Resistors
A20: Idle battery pack voltage | B20: of:=cell_voltage*cell_count -> 129 | C20: V | D20: http://en.wikipedia.org/wiki/Series_and_parallel_circuits#Cells_and_batteries
A21: Charged battery pack voltage | B21: of:=cell_charged_voltage*cell_count -> 172 | C21: V | D21: http://en.wikipedia.org/wiki/Series_and_parallel_circuits#Cells_and_batteries
A22: Battery pack current | B22: of:=(pack_voltage-SQRT(pack_voltage^2-4*pack_resistance*supply_power))/(2*pack_resistance) -> 139.70073537194 | C22: A | D22: http://en.wikipedia.org/wiki/Electric_power#Definition
A23: Battery pack sag | B23: of:=pack_resistance*pack_current -> 4.2049921346954 | C23: V | D23: http://en.wikipedia.org/wiki/Ohm's_law#Circuit_analysis
A24: Pack voltage under load | B24: of:=pack_voltage-pack_sag -> 124.795007865305 | C24: V | D24: http://en.wikipedia.org/wiki/Kirchhoff's_circuit_laws#Kirchhoff.27s_voltage_law_.28KVL.29
A25: Max pack voltage on regen | B25: of:=pack_charged_voltage+pack_sag -> 176.204992134695 | C25: V | D25: http://en.wikipedia.org/wiki/Kirchhoff's_circuit_laws#Kirchhoff.27s_voltage_law_.28KVL.29
A26: Apparent power | B26: of:=motor_power/pf -> 20374.6213716195 | C26: VA | D26: http://en.wikipedia.org/wiki/Power_factor#Definition_and_calculation
A27: Peak to peak phase voltage | B27: of:=pack_load_voltage/controller_eff -> 128.654647283819 | C27: V
A28: Peak phase voltage | B28: of:=phase_p2p_voltage/2 -> 64.3273236419096 | C28: V | D28: http://en.wikipedia.org/wiki/Amplitude
A29: RMS phase voltage | B29: of:=phase_peak_voltage/SQRT(2) -> 45.486286762776 | C29: V | D29: http://en.wikipedia.org/wiki/Root_mean_square#RMS_of_common_waveforms
A30: Phase-phase voltage | B30: of:=phase_rms_voltage*SQRT(3) -> 78.7845597207757 | C30: V | D30: http://en.wikipedia.org/wiki/Three-phase_electric_power#Single-phase_loads
A31: RMS Motor current | B31: of:=apparent_power/phase_phase_voltage/SQRT(3) -> 149.309625835723 | C31: A | D31: http://www.cerusind.com/catalog/documents/calculators/MotorEngineeringFormulas.pdf
A32: Motor peak current | B32: of:=motor_rms_current*SQRT(2) -> 211.155697849732 | C32: A | D32: http://en.wikipedia.org/wiki/Root_mean_square#RMS_of_common_waveforms
A33: Inverter power losses | B33: of:=supply_power-motor_power -> 523.018631085903 | C33: W
A34: Total controller voltage drop | B34: of:=pack_load_voltage*(1-controller_eff) -> 3.74385023595914 | C34: V
A36: Switching transistor requirements
A37: Switch resistance (Rdson) | B37: of:=inverter_losses/3/(motor_rms_current^2) -> 0.00782024376508086 | C37: Ω | D37: http://en.wikipedia.org/wiki/Electric_power#Resistive_circuits
A38: Switch voltage drop (Vcesat) | B38: of:=inverter_losses/3/motor_rms_current -> 1.16763767050837 | C38: V | D38: http://en.wikipedia.org/wiki/Electric_power#Definition
A39: Switch power dissipation | B39: of:=inverter_losses/6 -> 87.1697718476504 | C39: W
A40: Switch open voltage | B40: of:=pack_regen_voltage*(1+voltage_margin) -> 264.307488202043 | C40: V
A41: Continuous current | B41: of:=motor_rms_current/2 -> 74.6548129178617 | C41: A
A42: Peak current | B42: of:=motor_peak_current -> 211.155697849732 | C42: A
A44: Things not taken into account:
A45: switching losses
A46: cable/connector losses

Sheet: calculations
A1: Model | B1: Cells | C1: System voltage | D1: RMS phase-phase voltage | E1: RMS phase current | F1: Losses | G1: Current fits | H1: Heat fits | I1: Losses fit | J1: Fits
A2: of:=[data.A2:.A182] -> IRGP4066-E | B2: of:=MIN(ROUNDDOWN(([data.G2:.G182])/(cell_charged_voltage*(1+voltage_margin)); 0); max_cells) -> 100 | C2: of:=[.B2:.B182]*cell_voltage -> 300 | D2: of:=SQRT(3)*[.C2:.C182]/controller_eff/2/SQRT(2) -> 189.393536813132 | E2: of:=apparent_power/[.D2:.D182]/SQRT(3) -> 62.1103197684493 | F2: of:=[.$E2:.$E182]*[data.$J2:.$J182] -> 105.587543606364 | G2: of:=[.$E2:.$E182] < [data.$I2:.$I182] -> true | H2: of:=[.F2:.F182] < [data.N2:.N182] -> true | I2: of:=[.F2:.F182] < switch_losses -> false | J2: of:=AND([.G2]; [.H2]; [.I2]) -> false
A3: IRG7PH35U | B3: of:=MIN(ROUNDDOWN(([data.G3:.G183])/(cell_charged_voltage*(1+voltage_margin)); 0); max_cells) -> 123 | C3: 369 | D3: 232.954050280153 | E3: 50.4961949336986 | F3: 95.9427703740274 | G3: false | H3: true | I3: false | J3: of:=AND([.G3]; [.H3]; [.I3]) -> false
A4: IRG4BC20U | B4: of:=MIN(ROUNDDOWN(([data.G4:.G184])/(cell_charged_voltage*(1+voltage_margin)); 0); max_cells) -> 100 | C4: 300 | D4: 189.393536813132 | E4: 62.1103197684493 | F4: 114.904091571631 | G4: false | H4: false | I4: false | J4: of:=AND([.G4]; [.H4]; [.I4]) -> false
A5: IRG4BC30W-S | B5: of:=MIN(ROUNDDOWN(([data.G5:.G185])/(cell_charged_voltage*(1+voltage_margin)); 0); max_cells) -> 100 | C5: 300 | D5: 189.393536813132 | E5: 62.1103197684493 | F5: 130.431671513744 | G5: false | H5: false | I5: false | J5: of:=AND([.G5]; [.H5]; [.I5]) -> false
A6: IRGP4069 | B6: of:=MIN(ROUNDDOWN(([data.G6:.G186])/(cell_charged_voltage*(1+voltage_margin)); 0); max_cells) -> 100 | C6: 300 | D6: 189.393536813132 | E6: 62.1103197684493 | F6: 99.3765116295189 | G6: false | H6: true | I6: false | J6: of:=AND([.G6]; [.H6]; [.I6]) -> false
A7: IRGB8B60K | B7: of:=MIN(ROUNDDOWN(([data.G7:.G187])/(cell_charged_voltage*(1+voltage_margin)); 0); max_cells) -> 100 | C7: 300 | D7: 189.393536813132 | E7: 62.1103197684493 | F7: 111.798575583209 | G7: false | H7: true | I7: false | J7: of:=AND([.G7]; [.H7]; [.I7]) -> false
A8: IRG4PH20K | B8: of:=MIN(ROUNDDOWN(([data.G8:.G188])/(cell_charged_voltage*(1+voltage_margin)); 0); max_cells) -> 123 | C8: 369 | D8: 232.954050280153 | E8: 50.4961949336986 | F8: 160.072937939825 | G8: false | H8: false | I8: false | J8: of:=AND([.G8]; [.H8]; [.I8]) -> false
A9: IRG4PC50W | B9: of:=MIN(ROUNDDOWN(([data.G9:.G189])/(cell_charged_voltage*(1+voltage_margin)); 0); max_cells) -> 100 | C9: 300 | D9: 189.393536813132 | E9: 62.1103197684493 | F9: 119.872917153107 | G9: false | H9: true | I9: false | J9: of:=AND([.G9]; [.H9]; [.I9]) -> false
A10: IRG4PC40U | B10: of:=MIN(ROUNDDOWN(([data.G10:.G190])/(cell_charged_voltage*(1+voltage_margin)); 0); max_cells) -> 100 | C10: 300 | D10: 189.393536813132 | E10: 62.1103197684493 | F10: 106.829750001733 | G10: false | H10: true | I10: false | J10: of:=AND([.G10]; [.H10]; [.I10]) -> false
A11: IRGB4B60K | B11: of:=MIN(ROUNDDOWN(([data.G11:.G191])/(cell_charged_voltage*(1+voltage_margin)); 0); max_cells) -> 100 | C11: 300 | D11: 189.393536813132 | E11: 62.1103197684493 | F11: 130.431671513744 | G11: false | H11: false | I11: false | J11: of:=AND([.G11]; [.H11]; [.I11]) -> false
A12: IRGP4066 | B12: of:=MIN(ROUNDDOWN(([data.G12:.G192])/(cell_charged_voltage*(1+voltage_margin)); 0); max_cells) -> 100 | C12: 300 | D12: 189.393536813132 | E12: 62.1103197684493 | F12: 105.587543606364 | G12: true | H12: true | I12: false | J12: of:=AND([.G12]; [.H12]; [.I12]) -> false
A13: IRG4BH20K-L | B13: of:=MIN(ROUNDDOWN(([data.G13:.G193])/(cell_charged_voltage*(1+voltage_margin)); 0); max_cells) -> 123 | C13: 369 | D13: 232.954050280153 | E13: 50.4961949336986 | F13: 160.072937939825 | G13: false | H13: false | I13: false | J13: of:=AND([.G13]; [.H13]; [.I13]) -> false
A14: IRG4PC40K | B14: of:=MIN(ROUNDDOWN(([data.G14:.G194])/(cell_charged_voltage*(1+voltage_margin)); 0); max_cells) -> 100 | C14: 300 | D14: 189.393536813132 | E14: 62.1103197684493 | F14: 130.431671513744 | G14: false | H14: true | I14: false | J14: of:=AND([.G14]; [.H14]; [.I14]) -> false
A15: IRG4PH30K | B15: of:=MIN(ROUNDDOWN(([data.G15:.G195])/(cell_charged_voltage*(1+voltage_margin)); 0); max_cells) -> 123 | C15: 369 | D15: 232.954050280153 | E15: 50.4961949336986 | F15: 156.538204294466 | G15: false | H15: false | I15: false | J15: of:=AND([.G15]; [.H15]; [.I15]) -> false
A16: IRG4PC50U | B16: of:=MIN(ROUNDDOWN(([data.G16:.G196])/(cell_charged_voltage*(1+voltage_margin)); 0); max_cells) -> 100 | C16: 300 | D16: 189.393536813132 | E16: 62.1103197684493 | F16: 102.482027617941 | G16: false | H16: true | I16: false | J16: of:=AND([.G16]; [.H16]; [.I16]) -> false
A17: IRG4PSC71U | B17: of:=MIN(ROUNDDOWN(([data.G17:.G197])/(cell_charged_voltage*(1+voltage_margin)); 0); max_cells) -> 100 | C17: 300 | D17: 189.393536813132 | E17: 62.1103197684493 | F17: 103.72423401331 | G17: false | H17: true | I17: false | J17: of:=AND([.G17]; [.H17]; [.I17]) -> false
A18: IRG7P313U | B18: of:=MIN(ROUNDDOWN(([data.G18:.G198])/(cell_charged_voltage*(1+voltage_margin)); 0); max_cells) -> 55 | C18: 165 | D18: 104.166445247223 | E18: 112.927854124453 | F18: 136.642703490588 | G18: false | H18: false | I18: false | J18: of:=AND([.G18]; [.H18]; [.I18]) -> false
A19: IRG7PH42U | B19: of:=MIN(ROUNDDOWN(([data.G19:.G199])/(cell_charged_voltage*(1+voltage_margin)); 0); max_cells) -> 123 | C19: 369 | D19: 232.954050280153 | E19: 50.4961949336986 | F19: 85.8435313872877 | G19: true | H19: true | I19: true | J19: of:=AND([.G19]; [.H19]; [.I19]) -> true
A20: IRG4PC30U | B20: of:=MIN(ROUNDDOWN(([data.G20:.G200])/(cell_charged_voltage*(1+voltage_margin)); 0); max_cells) -> 100 | C20: 300 | D20: 189.393536813132 | E20: 62.1103197684493 | F20: 121.115123548476 | G20: false | H20: false | I20: false | J20: of:=AND([.G20]; [.H20]; [.I20]) -> false
A21: IRG7IC28U | B21: of:=MIN(ROUNDDOWN(([data.G21:.G201])/(cell_charged_voltage*(1+voltage_margin)); 0); max_cells) -> 100 | C21: 300 | D21: 189.393536813132 | E21: 62.1103197684493 | F21: 105.587543606364 | G21: false | H21: false | I21: false | J21: of:=AND([.G21]; [.H21]; [.I21]) -> false
A22: IRG4PC30W | B22: of:=MIN(ROUNDDOWN(([data.G22:.G202])/(cell_charged_voltage*(1+voltage_margin)); 0); max_cells) -> 100 | C22: 300 | D22: 189.393536813132 | E22: 62.1103197684493 | F22: 130.431671513744 | G22: false | H22: false | I22: false | J22: of:=AND([.G22]; [.H22]; [.I22]) -> false
A23: IRG4BC40K | B23: of:=MIN(ROUNDDOWN(([data.G23:.G203])/(cell_charged_voltage*(1+voltage_margin)); 0); max_cells) -> 100 | C23: 300 | D23: 189.393536813132 | E23: 62.1103197684493 | F23: 130.431671513744 | G23: false | H23: true | I23: false | J23: of:=AND([.G23]; [.H23]; [.I23]) -> false
A24: IRGS30B60K | B24: of:=MIN(ROUNDDOWN(([data.G24:.G204])/(cell_charged_voltage*(1+voltage_margin)); 0); max_cells) -> 100 | C24: 300 | D24: 189.393536813132 | E24: 62.1103197684493 | F24: 121.115123548476 | G24: false | H24: true | I24: false | J24: of:=AND([.G24]; [.H24]; [.I24]) -> false
A25: IRG4BH20K-S | B25: of:=MIN(ROUNDDOWN(([data.G25:.G205])/(cell_charged_voltage*(1+voltage_margin)); 0); max_cells) -> 123 | C25: 369 | D25: 232.954050280153 | E25: 50.4961949336986 | F25: 160.072937939825 | G25: false | H25: false | I25: false | J25: of:=AND([.G25]; [.H25]; [.I25]) -> false
A26: IRG4IBC30W | B26: of:=MIN(ROUNDDOWN(([data.G26:.G206])/(cell_charged_voltage*(1+voltage_margin)); 0); max_cells) -> 100 | C26: 300 | D26: 189.393536813132 | E26: 62.1103197684493 | F26: 130.431671513744 | G26: false | H26: false | I26: false | J26: of:=AND([.G26]; [.H26]; [.I26]) -> false
A27: IRG7S319U | B27: of:=MIN(ROUNDDOWN(([data.G27:.G207])/(cell_charged_voltage*(1+voltage_margin)); 0); max_cells) -> 55 | C27: 165 | D27: 104.166445247223 | E27: 112.927854124453 | F27: 142.289096196811 | G27: false | H27: false | I27: false | J27: of:=AND([.G27]; [.H27]; [.I27]) -> false
A28: IRG7I319U | B28: of:=MIN(ROUNDDOWN(([data.G28:.G208])/(cell_charged_voltage*(1+voltage_margin)); 0); max_cells) -> 55 | C28: 165 | D28: 104.166445247223 | E28: 112.927854124453 | F28: 135.513424949344 | G28: false | H28: false | I28: false | J28: of:=AND([.G28]; [.H28]; [.I28]) -> false
A29: IRG7PC28U | B29: of:=MIN(ROUNDDOWN(([data.G29:.G209])/(cell_charged_voltage*(1+voltage_margin)); 0); max_cells) -> 100 | C29: 300 | D29: 189.393536813132 | E29: 62.1103197684493 | F29: 105.587543606364 | G29: false | H29: true | I29: false | J29: of:=AND([.G29]; [.H29]; [.I29]) -> false
A30: IRG4BC30U | B30: of:=MIN(ROUNDDOWN(([data.G30:.G210])/(cell_charged_voltage*(1+voltage_margin)); 0); max_cells) -> 100 | C30: 300 | D30: 189.393536813132 | E30: 62.1103197684493 | F30: 121.115123548476 | G30: false | H30: false | I30: false | J30: of:=AND([.G30]; [.H30]; [.I30]) -> false
A31: IRGSL30B60K | B31: of:=MIN(ROUNDDOWN(([data.G31:.G211])/(cell_charged_voltage*(1+voltage_margin)); 0); max_cells) -> 100 | C31: 300 | D31: 189.393536813132 | E31: 62.1103197684493 | F31: 121.115123548476 | G31: false | H31: true | I31: false | J31: of:=AND([.G31]; [.H31]; [.I31]) -> false
A32: IRGP4263 | B32: of:=MIN(ROUNDDOWN(([data.G32:.G212])/(cell_charged_voltage*(1+voltage_margin)); 0); max_cells) -> 108 | C32: 324 | D32: 204.545019758183 | E32: 57.5095553411568 | F32: 97.7662440799665 | G32: true | H32: true | I32: false | J32: of:=AND([.G32]; [.H32]; [.I32]) -> false
A33: IRG7RA13U | B33: of:=MIN(ROUNDDOWN(([data.G33:.G213])/(cell_charged_voltage*(1+voltage_margin)); 0); max_cells) -> 60 | C33: 180 | D33: 113.636122087879 | E33: 103.517199614082 | F33: 130.431671513744 | G33: false | H33: false | I33: false | J33: of:=AND([.G33]; [.H33]; [.I33]) -> false
A34: IRG7PH50U | B34: of:=MIN(ROUNDDOWN(([data.G34:.G214])/(cell_charged_voltage*(1+voltage_margin)); 0); max_cells) -> 123 | C34: 369 | D34: 232.954050280153 | E34: 50.4961949336986 | F34: 85.8435313872877 | G34: true | H34: true | I34: true | J34: of:=AND([.G34]; [.H34]; [.I34]) -> true
A35: IRG4PH50U | B35: of:=MIN(ROUNDDOWN(([data.G35:.G215])/(cell_charged_voltage*(1+voltage_margin)); 0); max_cells) -> 123 | C35: 369 | D35: 232.954050280153 | E35: 50.4961949336986 | F35: 140.379421915682 | G35: false | H35: true | I35: false | J35: of:=AND([.G35]; [.H35]; [.I35]) -> false
A36: IRGS4B60K | B36: of:=MIN(ROUNDDOWN(([data.G36:.G216])/(cell_charged_voltage*(1+voltage_margin)); 0); max_cells) -> 100 | C36: 300 | D36: 189.393536813132 | E36: 62.1103197684493 | F36: 130.431671513744 | G36: false | H36: false | I36: false | J36: of:=AND([.G36]; [.H36]; [.I36]) -> false
A37: IRGB30B60K | B37: of:=MIN(ROUNDDOWN(([data.G37:.G217])/(cell_charged_voltage*(1+voltage_margin)); 0); max_cells) -> 100 | C37: 300 | D37: 189.393536813132 | E37: 62.1103197684493 | F37: 121.115123548476 | G37: false | H37: true | I37: false | J37: of:=AND([.G37]; [.H37]; [.I37]) -> false
A38: IRG7PH50U-E | B38: of:=MIN(ROUNDDOWN(([data.G38:.G218])/(cell_charged_voltage*(1+voltage_margin)); 0); max_cells) -> 123 | C38: 369 | D38: 232.954050280153 | E38: 50.4961949336986 | F38: 85.8435313872877 | G38: true | H38: true | I38: true | J38: of:=AND([.G38]; [.H38]; [.I38]) -> true
A39: IRGS15B60K | B39: of:=MIN(ROUNDDOWN(([data.G39:.G219])/(cell_charged_voltage*(1+voltage_margin)); 0); max_cells) -> 100 | C39: 300 | D39: 189.393536813132 | E39: 62.1103197684493 | F39: 111.798575583209 | G39: false | H39: true | I39: false | J39: of:=AND([.G39]; [.H39]; [.I39]) -> false
A40: IRG4PC30K | B40: of:=MIN(ROUNDDOWN(([data.G40:.G220])/(cell_charged_voltage*(1+voltage_margin)); 0); max_cells) -> 100 | C40: 300 | D40: 189.393536813132 | E40: 62.1103197684493 | F40: 137.263806688273 | G40: false | H40: false | I40: false | J40: of:=AND([.G40]; [.H40]; [.I40]) -> false
A41: IRG4IBC20W | B41: of:=MIN(ROUNDDOWN(([data.G41:.G221])/(cell_charged_voltage*(1+voltage_margin)); 0); max_cells) -> 100 | C41: 300 | D41: 189.393536813132 | E41: 62.1103197684493 | F41: 134.158290699851 | G41: false | H41: false | I41: false | J41: of:=AND([.G41]; [.H41]; [.I41]) -> false
A42: IRG4BC30W | B42: of:=MIN(ROUNDDOWN(([data.G42:.G222])/(cell_charged_voltage*(1+voltage_margin)); 0); max_cells) -> 100 | C42: 300 | D42: 189.393536813132 | E42: 62.1103197684493 | F42: 130.431671513744 | G42: false | H42: false | I42: false | J42: of:=AND([.G42]; [.H42]; [.I42]) -> false
A43: IRG4BC40U | B43: of:=MIN(ROUNDDOWN(([data.G43:.G223])/(cell_charged_voltage*(1+voltage_margin)); 0); max_cells) -> 100 | C43: 300 | D43: 189.393536813132 | E43: 62.1103197684493 | F43: 106.829750001733 | G43: false | H43: true | I43: false | J43: of:=AND([.G43]; [.H43]; [.I43]) -> false
A44: IRG4PH40U | B44: of:=MIN(ROUNDDOWN(([data.G44:.G224])/(cell_charged_voltage*(1+voltage_margin)); 0); max_cells) -> 123 | C44: 369 | D44: 232.954050280153 | E44: 50.4961949336986 | F44: 122.705753688888 | G44: false | H44: true | I44: false | J44: of:=AND([.G44]; [.H44]; [.I44]) -> false
A45: IRGS8B60K | B45: of:=MIN(ROUNDDOWN(([data.G45:.G225])/(cell_charged_voltage*(1+voltage_margin)); 0); max_cells) -> 100 | C45: 300 | D45: 189.393536813132 | E45: 62.1103197684493 | F45: 111.798575583209 | G45: false | H45: true | I45: false | J45: of:=AND([.G45]; [.H45]; [.I45]) -> false
A46: IRG4BC40WL | B46: of:=MIN(ROUNDDOWN(([data.G46:.G226])/(cell_charged_voltage*(1+voltage_margin)); 0); max_cells) -> 100 | C46: 300 | D46: 189.393536813132 | E46: 62.1103197684493 | F46: 127.326155525321 | G46: false | H46: true | I46: false | J46: of:=AND([.G46]; [.H46]; [.I46]) -> false
A47: IRG4PH50K | B47: of:=MIN(ROUNDDOWN(([data.G47:.G227])/(cell_charged_voltage*(1+voltage_margin)); 0); max_cells) -> 123 | C47: 369 | D47: 232.954050280153 | E47: 50.4961949336986 | F47: 122.705753688888 | G47: false | H47: true | I47: false | J47: of:=AND([.G47]; [.H47]; [.I47]) -> false
A48: IRG7PH30K10 | B48: of:=MIN(ROUNDDOWN(([data.G48:.G228])/(cell_charged_voltage*(1+voltage_margin)); 0); max_cells) -> 123 | C48: 369 | D48: 232.954050280153 | E48: 50.4961949336986 | F48: 103.517199614082 | G48: false | H48: true | I48: false | J48: of:=AND([.G48]; [.H48]; [.I48]) -> false
A49: IRGPS40B120U | B49: of:=MIN(ROUNDDOWN(([data.G49:.G229])/(cell_charged_voltage*(1+voltage_margin)); 0); max_cells) -> 123 | C49: 369 | D49: 232.954050280153 | E49: 50.4961949336986 | F49: 157.54812819314 | G49: false | H49: true | I49: false | J49: of:=AND([.G49]; [.H49]; [.I49]) -> false
A50: IRG7I313U | B50: of:=MIN(ROUNDDOWN(([data.G50:.G230])/(cell_charged_voltage*(1+voltage_margin)); 0); max_cells) -> 55 | C50: 165 | D50: 104.166445247223 | E50: 112.927854124453 | F50: 136.642703490588 | G50: false | H50: false | I50: false | J50: of:=AND([.G50]; [.H50]; [.I50]) -> false
A51: IRGP20B120U-E | B51: of:=MIN(ROUNDDOWN(([data.G51:.G231])/(cell_charged_voltage*(1+voltage_margin)); 0); max_cells) -> 123 | C51: 369 | D51: 232.954050280153 | E51: 50.4961949336986 | F51: 154.013394547781 | G51: false | H51: true | I51: false | J51: of:=AND([.G51]; [.H51]; [.I51]) -> false
A52: IRG4PC50K | B52: of:=MIN(ROUNDDOWN(([data.G52:.G232])/(cell_charged_voltage*(1+voltage_margin)); 0); max_cells) -> 100 | C52: 300 | D52: 189.393536813132 | E52: 62.1103197684493 | F52: 114.282988373947 | G52: false | H52: true | I52: false | J52: of:=AND([.G52]; [.H52]; [.I52]) -> false
A53: IRG4PF50W | B53: of:=MIN(ROUNDDOWN(([data.G53:.G233])/(cell_charged_voltage*(1+voltage_margin)); 0); max_cells) -> 123 | C53: 369 | D53: 232.954050280153 | E53: 50.4961949336986 | F53: 113.616438600822 | G53: false | H53: true | I53: false | J53: of:=AND([.G53]; [.H53]; [.I53]) -> false
A54: IRG7PSH73K10 | B54: of:=MIN(ROUNDDOWN(([data.G54:.G234])/(cell_charged_voltage*(1+voltage_margin)); 0); max_cells) -> 123 | C54: 369 | D54: 232.954050280153 | E54: 50.4961949336986 | F54: 100.992389867397 | G54: true | H54: true | I54: false | J54: of:=AND([.G54]; [.H54]; [.I54]) -> false
A55: IRG7R313U | B55: of:=MIN(ROUNDDOWN(([data.G55:.G235])/(cell_charged_voltage*(1+voltage_margin)); 0); max_cells) -> 55 | C55: 165 | D55: 104.166445247223 | E55: 112.927854124453 | F55: 136.642703490588 | G55: false | H55: false | I55: false | J55: of:=AND([.G55]; [.H55]; [.I55]) -> false
A56: IRG4PH40K | B56: of:=MIN(ROUNDDOWN(([data.G56:.G236])/(cell_charged_voltage*(1+voltage_margin)); 0); max_cells) -> 123 | C56: 369 | D56: 232.954050280153 | E56: 50.4961949336986 | F56: 138.359574118334 | G56: false | H56: true | I56: false | J56: of:=AND([.G56]; [.H56]; [.I56]) -> false
A57: IRG4BC20W-S | B57: of:=MIN(ROUNDDOWN(([data.G57:.G237])/(cell_charged_voltage*(1+voltage_margin)); 0); max_cells) -> 100 | C57: 300 | D57: 189.393536813132 | E57: 62.1103197684493 | F57: 134.158290699851 | G57: false | H57: false | I57: false | J57: of:=AND([.G57]; [.H57]; [.I57]) -> false
A58: IRG7IA13U | B58: of:=MIN(ROUNDDOWN(([data.G58:.G238])/(cell_charged_voltage*(1+voltage_margin)); 0); max_cells) -> 60 | C58: 180 | D58: 113.636122087879 | E58: 103.517199614082 | F58: 130.431671513744 | G58: false | H58: false | I58: false | J58: of:=AND([.G58]; [.H58]; [.I58]) -> false
A59: IRG4PC60U | B59: of:=MIN(ROUNDDOWN(([data.G59:.G239])/(cell_charged_voltage*(1+voltage_margin)); 0); max_cells) -> 100 | C59: 300 | D59: 189.393536813132 | E59: 62.1103197684493 | F59: 105.587543606364 | G59: false | H59: true | I59: false | J59: of:=AND([.G59]; [.H59]; [.I59]) -> false
A60: IRG4BC20W | B60: of:=MIN(ROUNDDOWN(([data.G60:.G240])/(cell_charged_voltage*(1+voltage_margin)); 0); max_cells) -> 100 | C60: 300 | D60: 189.393536813132 | E60: 62.1103197684493 | F60: 134.158290699851 | G60: false | H60: false | I60: false | J60: of:=AND([.G60]; [.H60]; [.I60]) -> false
A61: IRG4RC10U | B61: of:=MIN(ROUNDDOWN(([data.G61:.G241])/(cell_charged_voltage*(1+voltage_margin)); 0); max_cells) -> 100 | C61: 300 | D61: 189.393536813132 | E61: 62.1103197684493 | F61: 133.537187502166 | G61: false | H61: false | I61: false | J61: of:=AND([.G61]; [.H61]; [.I61]) -> false
A62: IRG4BC40W | B62: of:=MIN(ROUNDDOWN(([data.G62:.G242])/(cell_charged_voltage*(1+voltage_margin)); 0); max_cells) -> 100 | C62: 300 | D62: 189.393536813132 | E62: 62.1103197684493 | F62: 127.326155525321 | G62: false | H62: true | I62: false | J62: of:=AND([.G62]; [.H62]; [.I62]) -> false
A63: IRG7PH46U | B63: of:=MIN(ROUNDDOWN(([data.G63:.G243])/(cell_charged_voltage*(1+voltage_margin)); 0); max_cells) -> 123 | C63: 369 | D63: 232.954050280153 | E63: 50.4961949336986 | F63: 85.8435313872877 | G63: true | H63: true | I63: true | J63: of:=AND([.G63]; [.H63]; [.I63]) -> true
A64: IRGP4266 | B64: of:=MIN(ROUNDDOWN(([data.G64:.G244])/(cell_charged_voltage*(1+voltage_margin)); 0); max_cells) -> 108 | C64: 324 | D64: 204.545019758183 | E64: 57.5095553411568 | F64: 97.7662440799665 | G64: true | H64: true | I64: false | J64: of:=AND([.G64]; [.H64]; [.I64]) -> false
A65: IRG7S313U | B65: of:=MIN(ROUNDDOWN(([data.G65:.G245])/(cell_charged_voltage*(1+voltage_margin)); 0); max_cells) -> 55 | C65: 165 | D65: 104.166445247223 | E65: 112.927854124453 | F65: 136.642703490588 | G65: false | H65: false | I65: false | J65: of:=AND([.G65]; [.H65]; [.I65]) -> false
A66: IRG4BC40WS | B66: of:=MIN(ROUNDDOWN(([data.G66:.G246])/(cell_charged_voltage*(1+voltage_margin)); 0); max_cells) -> 100 | C66: 300 | D66: 189.393536813132 | E66: 62.1103197684493 | F66: 127.326155525321 | G66: false | H66: true | I66: false | J66: of:=AND([.G66]; [.H66]; [.I66]) -> false
A67: IRGP4063 | B67: of:=MIN(ROUNDDOWN(([data.G67:.G247])/(cell_charged_voltage*(1+voltage_margin)); 0); max_cells) -> 100 | C67: 300 | D67: 189.393536813132 | E67: 62.1103197684493 | F67: 102.482027617941 | G67: false | H67: true | I67: false | J67: of:=AND([.G67]; [.H67]; [.I67]) -> false
A68: IRGP4062-E | B68: of:=MIN(ROUNDDOWN(([data.G68:.G248])/(cell_charged_voltage*(1+voltage_margin)); 0); max_cells) -> 100 | C68: 300 | D68: 189.393536813132 | E68: 62.1103197684493 | F68: 99.3765116295189 | G68: false | H68: true | I68: false | J68: of:=AND([.G68]; [.H68]; [.I68]) -> false
A69: IRG7IA19U | B69: of:=MIN(ROUNDDOWN(([data.G69:.G249])/(cell_charged_voltage*(1+voltage_margin)); 0); max_cells) -> 60 | C69: 180 | D69: 113.636122087879 | E69: 103.517199614082 | F69: 130.431671513744 | G69: false | H69: false | I69: false | J69: of:=AND([.G69]; [.H69]; [.I69]) -> false
A70: IRG7SC28U | B70: of:=MIN(ROUNDDOWN(([data.G70:.G250])/(cell_charged_voltage*(1+voltage_margin)); 0); max_cells) -> 100 | C70: 300 | D70: 189.393536813132 | E70: 62.1103197684493 | F70: 105.587543606364 | G70: false | H70: true | I70: false | J70: of:=AND([.G70]; [.H70]; [.I70]) -> false
A71: IRGB6B60K | B71: of:=MIN(ROUNDDOWN(([data.G71:.G251])/(cell_charged_voltage*(1+voltage_margin)); 0); max_cells) -> 100 | C71: 300 | D71: 189.393536813132 | E71: 62.1103197684493 | F71: 111.798575583209 | G71: false | H71: false | I71: false | J71: of:=AND([.G71]; [.H71]; [.I71]) -> false
A72: IRGS6B60K | B72: of:=MIN(ROUNDDOWN(([data.G72:.G252])/(cell_charged_voltage*(1+voltage_margin)); 0); max_cells) -> 100 | C72: 300 | D72: 189.393536813132 | E72: 62.1103197684493 | F72: 111.798575583209 | G72: false | H72: false | I72: false | J72: of:=AND([.G72]; [.H72]; [.I72]) -> false
A73: IRG4PC40W | B73: of:=MIN(ROUNDDOWN(([data.G73:.G253])/(cell_charged_voltage*(1+voltage_margin)); 0); max_cells) -> 100 | C73: 300 | D73: 189.393536813132 | E73: 62.1103197684493 | F73: 127.326155525321 | G73: false | H73: true | I73: false | J73: of:=AND([.G73]; [.H73]; [.I73]) -> false
A74: IRG4BC30K | B74: of:=MIN(ROUNDDOWN(([data.G74:.G254])/(cell_charged_voltage*(1+voltage_margin)); 0); max_cells) -> 100 | C74: 300 | D74: 189.393536813132 | E74: 62.1103197684493 | F74: 137.263806688273 | G74: false | H74: false | I74: false | J74: of:=AND([.G74]; [.H74]; [.I74]) -> false
A75: IRG7PA19U | B75: of:=MIN(ROUNDDOWN(([data.G75:.G255])/(cell_charged_voltage*(1+voltage_margin)); 0); max_cells) -> 60 | C75: 180 | D75: 113.636122087879 | E75: 103.517199614082 | F75: 130.431671513744 | G75: false | H75: false | I75: false | J75: of:=AND([.G75]; [.H75]; [.I75]) -> false
A76: IRG4PSC71K | B76: of:=MIN(ROUNDDOWN(([data.G76:.G256])/(cell_charged_voltage*(1+voltage_margin)); 0); max_cells) -> 100 | C76: 300 | D76: 189.393536813132 | E76: 62.1103197684493 | F76: 113.661885176262 | G76: false | H76: true | I76: false | J76: of:=AND([.G76]; [.H76]; [.I76]) -> false
A77: 0 | B77: of:=MIN(ROUNDDOWN(([data.G77:.G257])/(cell_charged_voltage*(1+voltage_margin)); 0); max_cells) -> 0 | C77: 0 | D77: 0 | E77: 0 | F77: 0 | G77: false | H77: false | I77: false | J77: of:=AND([.G77]; [.H77]; [.I77]) -> false
A78: IRGPS40B120UD | B78: of:=MIN(ROUNDDOWN(([data.G78:.G258])/(cell_charged_voltage*(1+voltage_margin)); 0); max_cells) -> 123 | C78: 369 | D78: 232.954050280153 | E78: 50.4961949336986 | F78: 157.54812819314 | G78: false | H78: true | I78: false | J78: of:=AND([.G78]; [.H78]; [.I78]) -> false
A79: IRG4BC15UD | B79: of:=MIN(ROUNDDOWN(([data.G79:.G259])/(cell_charged_voltage*(1+voltage_margin)); 0); max_cells) -> 100 | C79: 300 | D79: 189.393536813132 | E79: 62.1103197684493 | F79: 125.462845932268 | G79: false | H79: false | I79: false | J79: of:=AND([.G79]; [.H79]; [.I79]) -> false
A80: IRGB4059D | B80: of:=MIN(ROUNDDOWN(([data.G80:.G260])/(cell_charged_voltage*(1+voltage_margin)); 0); max_cells) -> 100 | C80: 300 | D80: 189.393536813132 | E80: 62.1103197684493 | F80: 108.693059594786 | G80: false | H80: false | I80: false | J80: of:=AND([.G80]; [.H80]; [.I80]) -> false
A81: IRGP4063D | B81: of:=MIN(ROUNDDOWN(([data.G81:.G261])/(cell_charged_voltage*(1+voltage_margin)); 0); max_cells) -> 100 | C81: 300 | D81: 189.393536813132 | E81: 62.1103197684493 | F81: 102.482027617941 | G81: false | H81: true | I81: false | J81: of:=AND([.G81]; [.H81]; [.I81]) -> false
A82: IRGP4650D | B82: of:=MIN(ROUNDDOWN(([data.G82:.G262])/(cell_charged_voltage*(1+voltage_margin)); 0); max_cells) -> 100 | C82: 300 | D82: 189.393536813132 | E82: 62.1103197684493 | F82: 99.3765116295189 | G82: false | H82: true | I82: false | J82: of:=AND([.G82]; [.H82]; [.I82]) -> false
A83: IRG4BC30KD | B83: of:=MIN(ROUNDDOWN(([data.G83:.G263])/(cell_charged_voltage*(1+voltage_margin)); 0); max_cells) -> 100 | C83: 300 | D83: 189.393536813132 | E83: 62.1103197684493 | F83: 137.263806688273 | G83: false | H83: false | I83: false | J83: of:=AND([.G83]; [.H83]; [.I83]) -> false
A84: IRGP35B60PD | B84: of:=MIN(ROUNDDOWN(([data.G84:.G264])/(cell_charged_voltage*(1+voltage_margin)); 0); max_cells) -> 100 | C84: 300 | D84: 189.393536813132 | E84: 62.1103197684493 | F84: 139.748219479011 | G84: false | H84: true | I84: false | J84: of:=AND([.G84]; [.H84]; [.I84]) -> false
A85: IRG7PH28UD1 | B85: of:=MIN(ROUNDDOWN(([data.G85:.G265])/(cell_charged_voltage*(1+voltage_margin)); 0); max_cells) -> 123 | C85: 369 | D85: 232.954050280153 | E85: 50.4961949336986 | F85: 98.4675801207123 | G85: false | H85: true | I85: false | J85: of:=AND([.G85]; [.H85]; [.I85]) -> false
A86: IRG4PH40UD2-E | B86: of:=MIN(ROUNDDOWN(([data.G86:.G266])/(cell_charged_voltage*(1+voltage_margin)); 0); max_cells) -> 123 | C86: 369 | D86: 232.954050280153 | E86: 50.4961949336986 | F86: 122.705753688888 | G86: false | H86: true | I86: false | J86: of:=AND([.G86]; [.H86]; [.I86]) -> false
A87: IRG4IBC20UD | B87: of:=MIN(ROUNDDOWN(([data.G87:.G267])/(cell_charged_voltage*(1+voltage_margin)); 0); max_cells) -> 100 | C87: 300 | D87: 189.393536813132 | E87: 62.1103197684493 | F87: 114.904091571631 | G87: false | H87: false | I87: false | J87: of:=AND([.G87]; [.H87]; [.I87]) -> false
A88: IRG4PH40UD | B88: of:=MIN(ROUNDDOWN(([data.G88:.G268])/(cell_charged_voltage*(1+voltage_margin)); 0); max_cells) -> 123 | C88: 369 | D88: 232.954050280153 | E88: 50.4961949336986 | F88: 122.705753688888 | G88: false | H88: true | I88: false | J88: of:=AND([.G88]; [.H88]; [.I88]) -> false
A89: IRGP20B60PD | B89: of:=MIN(ROUNDDOWN(([data.G89:.G269])/(cell_charged_voltage*(1+voltage_margin)); 0); max_cells) -> 100 | C89: 300 | D89: 189.393536813132 | E89: 62.1103197684493 | F89: 155.275799421123 | G89: false | H89: true | I89: false | J89: of:=AND([.G89]; [.H89]; [.I89]) -> false
A90: IRG4BC20UD-S | B90: of:=MIN(ROUNDDOWN(([data.G90:.G270])/(cell_charged_voltage*(1+voltage_margin)); 0); max_cells) -> 100 | C90: 300 | D90: 189.393536813132 | E90: 62.1103197684493 | F90: 114.904091571631 | G90: false | H90: false | I90: false | J90: of:=AND([.G90]; [.H90]; [.I90]) -> false
A91: IRG4PH30KD | B91: of:=MIN(ROUNDDOWN(([data.G91:.G271])/(cell_charged_voltage*(1+voltage_margin)); 0); max_cells) -> 123 | C91: 369 | D91: 232.954050280153 | E91: 50.4961949336986 | F91: 156.538204294466 | G91: false | H91: false | I91: false | J91: of:=AND([.G91]; [.H91]; [.I91]) -> false
A92: IRGP4068D-E | B92: of:=MIN(ROUNDDOWN(([data.G92:.G272])/(cell_charged_voltage*(1+voltage_margin)); 0); max_cells) -> 100 | C92: 300 | D92: 189.393536813132 | E92: 62.1103197684493 | F92: 102.482027617941 | G92: false | H92: true | I92: false | J92: of:=AND([.G92]; [.H92]; [.I92]) -> false
A93: IRGP4660D | B93: of:=MIN(ROUNDDOWN(([data.G93:.G273])/(cell_charged_voltage*(1+voltage_margin)); 0); max_cells) -> 100 | C93: 300 | D93: 189.393536813132 | E93: 62.1103197684493 | F93: 99.3765116295189 | G93: false | H93: true | I93: false | J93: of:=AND([.G93]; [.H93]; [.I93]) -> false
A94: IRGIB7B60KD | B94: of:=MIN(ROUNDDOWN(([data.G94:.G274])/(cell_charged_voltage*(1+voltage_margin)); 0); max_cells) -> 100 | C94: 300 | D94: 189.393536813132 | E94: 62.1103197684493 | F94: 111.798575583209 | G94: false | H94: false | I94: false | J94: of:=AND([.G94]; [.H94]; [.I94]) -> false
A95: IRG4PC40KD | B95: of:=MIN(ROUNDDOWN(([data.G95:.G275])/(cell_charged_voltage*(1+voltage_margin)); 0); max_cells) -> 100 | C95: 300 | D95: 189.393536813132 | E95: 62.1103197684493 | F95: 130.431671513744 | G95: false | H95: true | I95: false | J95: of:=AND([.G95]; [.H95]; [.I95]) -> false
A96: IRG4PH50UD | B96: of:=MIN(ROUNDDOWN(([data.G96:.G276])/(cell_charged_voltage*(1+voltage_margin)); 0); max_cells) -> 123 | C96: 369 | D96: 232.954050280153 | E96: 50.4961949336986 | F96: 140.379421915682 | G96: false | H96: true | I96: false | J96: of:=AND([.G96]; [.H96]; [.I96]) -> false
A97: IRGB15B60KD | B97: of:=MIN(ROUNDDOWN(([data.G97:.G277])/(cell_charged_voltage*(1+voltage_margin)); 0); max_cells) -> 100 | C97: 300 | D97: 189.393536813132 | E97: 62.1103197684493 | F97: 111.798575583209 | G97: false | H97: true | I97: false | J97: of:=AND([.G97]; [.H97]; [.I97]) -> false
A98: IRG7PH42UD | B98: of:=MIN(ROUNDDOWN(([data.G98:.G278])/(cell_charged_voltage*(1+voltage_margin)); 0); max_cells) -> 123 | C98: 369 | D98: 232.954050280153 | E98: 50.4961949336986 | F98: 85.8435313872877 | G98: false | H98: true | I98: true | J98: of:=AND([.G98]; [.H98]; [.I98]) -> false
A99: IRG4BC15UD-L | B99: of:=MIN(ROUNDDOWN(([data.G99:.G279])/(cell_charged_voltage*(1+voltage_margin)); 0); max_cells) -> 100 | C99: 300 | D99: 189.393536813132 | E99: 62.1103197684493 | F99: 125.462845932268 | G99: false | H99: false | I99: false | J99: of:=AND([.G99]; [.H99]; [.I99]) -> false
A100: IRG7PH35UD | B100: of:=MIN(ROUNDDOWN(([data.G100:.G280])/(cell_charged_voltage*(1+voltage_margin)); 0); max_cells) -> 123 | C100: 369 | D100: 232.954050280153 | E100: 50.4961949336986 | F100: 95.9427703740274 | G100: false | H100: true | I100: false | J100: of:=AND([.G100]; [.H100]; [.I100]) -> false
A101: IRG4PC30KD | B101: of:=MIN(ROUNDDOWN(([data.G101:.G281])/(cell_charged_voltage*(1+voltage_margin)); 0); max_cells) -> 100 | C101: 300 | D101: 189.393536813132 | E101: 62.1103197684493 | F101: 137.263806688273 | G101: false | H101: false | I101: false | J101: of:=AND([.G101]; [.H101]; [.I101]) -> false
A102: IRG4PC50KD | B102: of:=MIN(ROUNDDOWN(([data.G102:.G282])/(cell_charged_voltage*(1+voltage_margin)); 0); max_cells) -> 100 | C102: 300 | D102: 189.393536813132 | E102: 62.1103197684493 | F102: 114.282988373947 | G102: false | H102: false | I102: false | J102: of:=AND([.G102]; [.H102]; [.I102]) -> false
A103: IRG4BC20KD | B103: of:=MIN(ROUNDDOWN(([data.G103:.G283])/(cell_charged_voltage*(1+voltage_margin)); 0); max_cells) -> 100 | C103: 300 | D103: 189.393536813132 | E103: 62.1103197684493 | F103: 140.99042587438 | G103: false | H103: false | I103: false | J103: of:=AND([.G103]; [.H103]; [.I103]) -> false
A104: IRGP4068D | B104: of:=MIN(ROUNDDOWN(([data.G104:.G284])/(cell_charged_voltage*(1+voltage_margin)); 0); max_cells) -> 100 | C104: 300 | D104: 189.393536813132 | E104: 62.1103197684493 | F104: 102.482027617941 | G104: false | H104: true | I104: false | J104: of:=AND([.G104]; [.H104]; [.I104]) -> false
A105: IRGP35B60PD-E | B105: of:=MIN(ROUNDDOWN(([data.G105:.G285])/(cell_charged_voltage*(1+voltage_margin)); 0); max_cells) -> 100 | C105: 300 | D105: 189.393536813132 | E105: 62.1103197684493 | F105: 139.748219479011 | G105: false | H105: true | I105: false | J105: of:=AND([.G105]; [.H105]; [.I105]) -> false
A106: IRGB4056D | B106: of:=MIN(ROUNDDOWN(([data.G106:.G286])/(cell_charged_voltage*(1+voltage_margin)); 0); max_cells) -> 100 | C106: 300 | D106: 189.393536813132 | E106: 62.1103197684493 | F106: 96.2709956410965 | G106: false | H106: true | I106: false | J106: of:=AND([.G106]; [.H106]; [.I106]) -> false
A107: IRGP50B60PD | B107: of:=MIN(ROUNDDOWN(([data.G107:.G287])/(cell_charged_voltage*(1+voltage_margin)); 0); max_cells) -> 100 | C107: 300 | D107: 189.393536813132 | E107: 62.1103197684493 | F107: 124.220639536899 | G107: false | H107: true | I107: false | J107: of:=AND([.G107]; [.H107]; [.I107]) -> false
A108: IRG4IBC10UD | B108: of:=MIN(ROUNDDOWN(([data.G108:.G288])/(cell_charged_voltage*(1+voltage_margin)); 0); max_cells) -> 100 | C108: 300 | D108: 189.393536813132 | E108: 62.1103197684493 | F108: 133.537187502166 | G108: false | H108: false | I108: false | J108: of:=AND([.G108]; [.H108]; [.I108]) -> false
A109: IRG7PH46UD | B109: of:=MIN(ROUNDDOWN(([data.G109:.G289])/(cell_charged_voltage*(1+voltage_margin)); 0); max_cells) -> 123 | C109: 369 | D109: 232.954050280153 | E109: 50.4961949336986 | F109: 85.8435313872877 | G109: true | H109: true | I109: true | J109: of:=AND([.G109]; [.H109]; [.I109]) -> true
A110: IRG4PSH71KD | B110: of:=MIN(ROUNDDOWN(([data.G110:.G290])/(cell_charged_voltage*(1+voltage_margin)); 0); max_cells) -> 123 | C110: 369 | D110: 232.954050280153 | E110: 50.4961949336986 | F110: 149.973698953085 | G110: false | H110: true | I110: false | J110: of:=AND([.G110]; [.H110]; [.I110]) -> false
A111: IRGP30B60KD-E | B111: of:=MIN(ROUNDDOWN(([data.G111:.G291])/(cell_charged_voltage*(1+voltage_margin)); 0); max_cells) -> 100 | C111: 300 | D111: 189.393536813132 | E111: 62.1103197684493 | F111: 121.115123548476 | G111: false | H111: true | I111: false | J111: of:=AND([.G111]; [.H111]; [.I111]) -> false
A112: IRGB4062D | B112: of:=MIN(ROUNDDOWN(([data.G112:.G292])/(cell_charged_voltage*(1+voltage_margin)); 0); max_cells) -> 100 | C112: 300 | D112: 189.393536813132 | E112: 62.1103197684493 | F112: 99.3765116295189 | G112: false | H112: true | I112: false | J112: of:=AND([.G112]; [.H112]; [.I112]) -> false
A113: IRGSL4B60KD1 | B113: of:=MIN(ROUNDDOWN(([data.G113:.G293])/(cell_charged_voltage*(1+voltage_margin)); 0); max_cells) -> 100 | C113: 300 | D113: 189.393536813132 | E113: 62.1103197684493 | F113: 130.431671513744 | G113: false | H113: false | I113: false | J113: of:=AND([.G113]; [.H113]; [.I113]) -> false
A114: IRGR3B60KD2 | B114: of:=MIN(ROUNDDOWN(([data.G114:.G294])/(cell_charged_voltage*(1+voltage_margin)); 0); max_cells) -> 100 | C114: 300 | D114: 189.393536813132 | E114: 62.1103197684493 | F114: 118.009607560054 | G114: false | H114: false | I114: false | J114: of:=AND([.G114]; [.H114]; [.I114]) -> false
A115: IRGPS60B120KD | B115: of:=MIN(ROUNDDOWN(([data.G115:.G295])/(cell_charged_voltage*(1+voltage_margin)); 0); max_cells) -> 123 | C115: 369 | D115: 232.954050280153 | E115: 50.4961949336986 | F115: 126.240487334247 | G115: true | H115: true | I115: false | J115: of:=AND([.G115]; [.H115]; [.I115]) -> false
A116: IRGP50B60PD1-E | B116: of:=MIN(ROUNDDOWN(([data.G116:.G296])/(cell_charged_voltage*(1+voltage_margin)); 0); max_cells) -> 100 | C116: 300 | D116: 189.393536813132 | E116: 62.1103197684493 | F116: 124.220639536899 | G116: false | H116: true | I116: false | J116: of:=AND([.G116]; [.H116]; [.I116]) -> false
A117: IRGSL15B60KD | B117: of:=MIN(ROUNDDOWN(([data.G117:.G297])/(cell_charged_voltage*(1+voltage_margin)); 0); max_cells) -> 100 | C117: 300 | D117: 189.393536813132 | E117: 62.1103197684493 | F117: 111.798575583209 | G117: false | H117: true | I117: false | J117: of:=AND([.G117]; [.H117]; [.I117]) -> false
A118: IRGS4B60KD1 | B118: of:=MIN(ROUNDDOWN(([data.G118:.G298])/(cell_charged_voltage*(1+voltage_margin)); 0); max_cells) -> 100 | C118: 300 | D118: 189.393536813132 | E118: 62.1103197684493 | F118: 130.431671513744 | G118: false | H118: false | I118: false | J118: of:=AND([.G118]; [.H118]; [.I118]) -> false
A119: IRGB6B60KD | B119: of:=MIN(ROUNDDOWN(([data.G119:.G299])/(cell_charged_voltage*(1+voltage_margin)); 0); max_cells) -> 100 | C119: 300 | D119: 189.393536813132 | E119: 62.1103197684493 | F119: 111.798575583209 | G119: false | H119: false | I119: false | J119: of:=AND([.G119]; [.H119]; [.I119]) -> false
A120: IRG4PH20KD | B120: of:=MIN(ROUNDDOWN(([data.G120:.G300])/(cell_charged_voltage*(1+voltage_margin)); 0); max_cells) -> 123 | C120: 369 | D120: 232.954050280153 | E120: 50.4961949336986 | F120: 160.072937939825 | G120: false | H120: false | I120: false | J120: of:=AND([.G120]; [.H120]; [.I120]) -> false
A121: IRG4IBC30UD | B121: of:=MIN(ROUNDDOWN(([data.G121:.G301])/(cell_charged_voltage*(1+voltage_margin)); 0); max_cells) -> 100 | C121: 300 | D121: 189.393536813132 | E121: 62.1103197684493 | F121: 121.115123548476 | G121: false | H121: false | I121: false | J121: of:=AND([.G121]; [.H121]; [.I121]) -> false
A122: IRG4BC15UD-S | B122: of:=MIN(ROUNDDOWN(([data.G122:.G302])/(cell_charged_voltage*(1+voltage_margin)); 0); max_cells) -> 100 | C122: 300 | D122: 189.393536813132 | E122: 62.1103197684493 | F122: 125.462845932268 | G122: false | H122: false | I122: false | J122: of:=AND([.G122]; [.H122]; [.I122]) -> false
A123: IRGSL6B60KD | B123: of:=MIN(ROUNDDOWN(([data.G123:.G303])/(cell_charged_voltage*(1+voltage_margin)); 0); max_cells) -> 100 | C123: 300 | D123: 189.393536813132 | E123: 62.1103197684493 | F123: 111.798575583209 | G123: false | H123: false | I123: false | J123: of:=AND([.G123]; [.H123]; [.I123]) -> false
A124: IRG7PH35UD1M | B124: of:=MIN(ROUNDDOWN(([data.G124:.G304])/(cell_charged_voltage*(1+voltage_margin)); 0); max_cells) -> 123 | C124: 369 | D124: 232.954050280153 | E124: 50.4961949336986 | F124: 95.9427703740274 | G124: false | H124: true | I124: false | J124: of:=AND([.G124]; [.H124]; [.I124]) -> false
A125: IRGB20B60PD1 | B125: of:=MIN(ROUNDDOWN(([data.G125:.G305])/(cell_charged_voltage*(1+voltage_margin)); 0); max_cells) -> 100 | C125: 300 | D125: 189.393536813132 | E125: 62.1103197684493 | F125: 155.275799421123 | G125: false | H125: true | I125: false | J125: of:=AND([.G125]; [.H125]; [.I125]) -> false
A126: IRG7PSH50UD | B126: of:=MIN(ROUNDDOWN(([data.G126:.G306])/(cell_charged_voltage*(1+voltage_margin)); 0); max_cells) -> 123 | C126: 369 | D126: 232.954050280153 | E126: 50.4961949336986 | F126: 85.8435313872877 | G126: true | H126: true | I126: true | J126: of:=AND([.G126]; [.H126]; [.I126]) -> true
A127: IRG4BC30KD-S | B127: of:=MIN(ROUNDDOWN(([data.G127:.G307])/(cell_charged_voltage*(1+voltage_margin)); 0); max_cells) -> 100 | C127: 300 | D127: 189.393536813132 | E127: 62.1103197684493 | F127: 137.263806688273 | G127: false | H127: false | I127: false | J127: of:=AND([.G127]; [.H127]; [.I127]) -> false
A128: IRG7PH30K10D | B128: of:=MIN(ROUNDDOWN(([data.G128:.G308])/(cell_charged_voltage*(1+voltage_margin)); 0); max_cells) -> 123 | C128: 369 | D128: 232.954050280153 | E128: 50.4961949336986 | F128: 103.517199614082 | G128: false | H128: true | I128: false | J128: of:=AND([.G128]; [.H128]; [.I128]) -> false
A129: IRG4PH40KD | B129: of:=MIN(ROUNDDOWN(([data.G129:.G309])/(cell_charged_voltage*(1+voltage_margin)); 0); max_cells) -> 123 | C129: 369 | D129: 232.954050280153 | E129: 50.4961949336986 | F129: 138.359574118334 | G129: false | H129: true | I129: false | J129: of:=AND([.G129]; [.H129]; [.I129]) -> false
A130: IRGP4072D | B130: of:=MIN(ROUNDDOWN(([data.G130:.G310])/(cell_charged_voltage*(1+voltage_margin)); 0); max_cells) -> 50 | C130: 150 | D130: 94.6967684065662 | E130: 124.220639536899 | F130: 181.362133723872 | G130: false | H130: false | I130: false | J130: of:=AND([.G130]; [.H130]; [.I130]) -> false
A131: IRG7PH35UD1 | B131: of:=MIN(ROUNDDOWN(([data.G131:.G311])/(cell_charged_voltage*(1+voltage_margin)); 0); max_cells) -> 123 | C131: 369 | D131: 232.954050280153 | E131: 50.4961949336986 | F131: 95.9427703740274 | G131: false | H131: true | I131: false | J131: of:=AND([.G131]; [.H131]; [.I131]) -> false
A132: IRG4BC30UD | B132: of:=MIN(ROUNDDOWN(([data.G132:.G312])/(cell_charged_voltage*(1+voltage_margin)); 0); max_cells) -> 100 | C132: 300 | D132: 189.393536813132 | E132: 62.1103197684493 | F132: 121.115123548476 | G132: false | H132: false | I132: false | J132: of:=AND([.G132]; [.H132]; [.I132]) -> false
A133: IRGB5B120KD | B133: of:=MIN(ROUNDDOWN(([data.G133:.G313])/(cell_charged_voltage*(1+voltage_margin)); 0); max_cells) -> 123 | C133: 369 | D133: 232.954050280153 | E133: 50.4961949336986 | F133: 138.864536067671 | G133: false | H133: false | I133: false | J133: of:=AND([.G133]; [.H133]; [.I133]) -> false
A134: IRG4PC30UD | B134: of:=MIN(ROUNDDOWN(([data.G134:.G314])/(cell_charged_voltage*(1+voltage_margin)); 0); max_cells) -> 100 | C134: 300 | D134: 189.393536813132 | E134: 62.1103197684493 | F134: 121.115123548476 | G134: false | H134: false | I134: false | J134: of:=AND([.G134]; [.H134]; [.I134]) -> false
A135: IRG4IBC30KD | B135: of:=MIN(ROUNDDOWN(([data.G135:.G315])/(cell_charged_voltage*(1+voltage_margin)); 0); max_cells) -> 100 | C135: 300 | D135: 189.393536813132 | E135: 62.1103197684493 | F135: 137.263806688273 | G135: false | H135: false | I135: false | J135: of:=AND([.G135]; [.H135]; [.I135]) -> false
A136: IRGPS4067D | B136: of:=MIN(ROUNDDOWN(([data.G136:.G316])/(cell_charged_voltage*(1+voltage_margin)); 0); max_cells) -> 100 | C136: 300 | D136: 189.393536813132 | E136: 62.1103197684493 | F136: 105.587543606364 | G136: true | H136: true | I136: false | J136: of:=AND([.G136]; [.H136]; [.I136]) -> false
A137: IRGB4061D | B137: of:=MIN(ROUNDDOWN(([data.G137:.G317])/(cell_charged_voltage*(1+voltage_margin)); 0); max_cells) -> 100 | C137: 300 | D137: 189.393536813132 | E137: 62.1103197684493 | F137: 102.482027617941 | G137: false | H137: true | I137: false | J137: of:=AND([.G137]; [.H137]; [.I137]) -> false
A138: IRGP30B120KD-E | B138: of:=MIN(ROUNDDOWN(([data.G138:.G318])/(cell_charged_voltage*(1+voltage_margin)); 0); max_cells) -> 123 | C138: 369 | D138: 232.954050280153 | E138: 50.4961949336986 | F138: 124.220639536899 | G138: false | H138: true | I138: false | J138: of:=AND([.G138]; [.H138]; [.I138]) -> false
A139: IRG6B330UD | B139: of:=MIN(ROUNDDOWN(([data.G139:.G319])/(cell_charged_voltage*(1+voltage_margin)); 0); max_cells) -> 55 | C139: 165 | D139: 104.166445247223 | E139: 112.927854124453 | F139: 153.581881609256 | G139: false | H139: true | I139: false | J139: of:=AND([.G139]; [.H139]; [.I139]) -> false
A140: IRG4BC10UD | B140: of:=MIN(ROUNDDOWN(([data.G140:.G320])/(cell_charged_voltage*(1+voltage_margin)); 0); max_cells) -> 100 | C140: 300 | D140: 189.393536813132 | E140: 62.1103197684493 | F140: 133.537187502166 | G140: false | H140: false | I140: false | J140: of:=AND([.G140]; [.H140]; [.I140]) -> false
A141: IRGP4066D | B141: of:=MIN(ROUNDDOWN(([data.G141:.G321])/(cell_charged_voltage*(1+voltage_margin)); 0); max_cells) -> 100 | C141: 300 | D141: 189.393536813132 | E141: 62.1103197684493 | F141: 105.587543606364 | G141: true | H141: true | I141: false | J141: of:=AND([.G141]; [.H141]; [.I141]) -> false
A142: IRG4PSH71UD | B142: of:=MIN(ROUNDDOWN(([data.G142:.G322])/(cell_charged_voltage*(1+voltage_margin)); 0); max_cells) -> 123 | C142: 369 | D142: 232.954050280153 | E142: 50.4961949336986 | F142: 127.250411232921 | G142: false | H142: true | I142: false | J142: of:=AND([.G142]; [.H142]; [.I142]) -> false
A143: IRG4PC40UD | B143: of:=MIN(ROUNDDOWN(([data.G143:.G323])/(cell_charged_voltage*(1+voltage_margin)); 0); max_cells) -> 100 | C143: 300 | D143: 189.393536813132 | E143: 62.1103197684493 | F143: 106.829750001733 | G143: false | H143: true | I143: false | J143: of:=AND([.G143]; [.H143]; [.I143]) -> false
A144: IRGP4078D | B144: of:=MIN(ROUNDDOWN(([data.G144:.G324])/(cell_charged_voltage*(1+voltage_margin)); 0); max_cells) -> 100 | C144: 300 | D144: 189.393536813132 | E144: 62.1103197684493 | F144: 118.009607560054 | G144: false | H144: true | I144: false | J144: of:=AND([.G144]; [.H144]; [.I144]) -> false
A145: IRGB4B60KD1 | B145: of:=MIN(ROUNDDOWN(([data.G145:.G325])/(cell_charged_voltage*(1+voltage_margin)); 0); max_cells) -> 100 | C145: 300 | D145: 189.393536813132 | E145: 62.1103197684493 | F145: 130.431671513744 | G145: false | H145: false | I145: false | J145: of:=AND([.G145]; [.H145]; [.I145]) -> false
A146: IRG7PH50K10D | B146: of:=MIN(ROUNDDOWN(([data.G146:.G326])/(cell_charged_voltage*(1+voltage_margin)); 0); max_cells) -> 123 | C146: 369 | D146: 232.954050280153 | E146: 50.4961949336986 | F146: 95.9427703740274 | G146: false | H146: true | I146: false | J146: of:=AND([.G146]; [.H146]; [.I146]) -> false
A147: IRGS15B60KD | B147: of:=MIN(ROUNDDOWN(([data.G147:.G327])/(cell_charged_voltage*(1+voltage_margin)); 0); max_cells) -> 100 | C147: 300 | D147: 189.393536813132 | E147: 62.1103197684493 | F147: 111.798575583209 | G147: false | H147: true | I147: false | J147: of:=AND([.G147]; [.H147]; [.I147]) -> false
A148: IRGB4045D | B148: of:=MIN(ROUNDDOWN(([data.G148:.G328])/(cell_charged_voltage*(1+voltage_margin)); 0); max_cells) -> 100 | C148: 300 | D148: 189.393536813132 | E148: 62.1103197684493 | F148: 105.587543606364 | G148: false | H148: false | I148: false | J148: of:=AND([.G148]; [.H148]; [.I148]) -> false
A149: IRGSL4062D | B149: of:=MIN(ROUNDDOWN(([data.G149:.G329])/(cell_charged_voltage*(1+voltage_margin)); 0); max_cells) -> 100 | C149: 300 | D149: 189.393536813132 | E149: 62.1103197684493 | F149: 99.3765116295189 | G149: false | H149: true | I149: false | J149: of:=AND([.G149]; [.H149]; [.I149]) -> false
A150: IRG4PH50KD | B150: of:=MIN(ROUNDDOWN(([data.G150:.G330])/(cell_charged_voltage*(1+voltage_margin)); 0); max_cells) -> 123 | C150: 369 | D150: 232.954050280153 | E150: 50.4961949336986 | F150: 139.874459966345 | G150: false | H150: true | I150: false | J150: of:=AND([.G150]; [.H150]; [.I150]) -> false
A151: IRG4PSC71UD | B151: of:=MIN(ROUNDDOWN(([data.G151:.G331])/(cell_charged_voltage*(1+voltage_margin)); 0); max_cells) -> 100 | C151: 300 | D151: 189.393536813132 | E151: 62.1103197684493 | F151: 103.72423401331 | G151: false | H151: true | I151: false | J151: of:=AND([.G151]; [.H151]; [.I151]) -> false
A152: IRG4IBC20KD | B152: of:=MIN(ROUNDDOWN(([data.G152:.G332])/(cell_charged_voltage*(1+voltage_margin)); 0); max_cells) -> 100 | C152: 300 | D152: 189.393536813132 | E152: 62.1103197684493 | F152: 140.99042587438 | G152: false | H152: false | I152: false | J152: of:=AND([.G152]; [.H152]; [.I152]) -> false
A153: IRGB10B60KD | B153: of:=MIN(ROUNDDOWN(([data.G153:.G333])/(cell_charged_voltage*(1+voltage_margin)); 0); max_cells) -> 100 | C153: 300 | D153: 189.393536813132 | E153: 62.1103197684493 | F153: 111.798575583209 | G153: false | H153: false | I153: false | J153: of:=AND([.G153]; [.H153]; [.I153]) -> false
A154: IRGB4060D | B154: of:=MIN(ROUNDDOWN(([data.G154:.G334])/(cell_charged_voltage*(1+voltage_margin)); 0); max_cells) -> 100 | C154: 300 | D154: 189.393536813132 | E154: 62.1103197684493 | F154: 96.2709956410965 | G154: false | H154: true | I154: false | J154: of:=AND([.G154]; [.H154]; [.I154]) -> false
A155: IRGP4062D | B155: of:=MIN(ROUNDDOWN(([data.G155:.G335])/(cell_charged_voltage*(1+voltage_margin)); 0); max_cells) -> 100 | C155: 300 | D155: 189.393536813132 | E155: 62.1103197684493 | F155: 99.3765116295189 | G155: false | H155: true | I155: false | J155: of:=AND([.G155]; [.H155]; [.I155]) -> false
A156: IRGIB6B60KD | B156: of:=MIN(ROUNDDOWN(([data.G156:.G336])/(cell_charged_voltage*(1+voltage_margin)); 0); max_cells) -> 100 | C156: 300 | D156: 189.393536813132 | E156: 62.1103197684493 | F156: 111.798575583209 | G156: false | H156: false | I156: false | J156: of:=AND([.G156]; [.H156]; [.I156]) -> false
A157: IRGIB15B60KD1 | B157: of:=MIN(ROUNDDOWN(([data.G157:.G337])/(cell_charged_voltage*(1+voltage_margin)); 0); max_cells) -> 100 | C157: 300 | D157: 189.393536813132 | E157: 62.1103197684493 | F157: 111.798575583209 | G157: false | H157: false | I157: false | J157: of:=AND([.G157]; [.H157]; [.I157]) -> false
A158: IRGS4045D | B158: of:=MIN(ROUNDDOWN(([data.G158:.G338])/(cell_charged_voltage*(1+voltage_margin)); 0); max_cells) -> 100 | C158: 300 | D158: 189.393536813132 | E158: 62.1103197684493 | F158: 105.587543606364 | G158: false | H158: false | I158: false | J158: of:=AND([.G158]; [.H158]; [.I158]) -> false
A159: IRG4BC20UD | B159: of:=MIN(ROUNDDOWN(([data.G159:.G339])/(cell_charged_voltage*(1+voltage_margin)); 0); max_cells) -> 100 | C159: 300 | D159: 189.393536813132 | E159: 62.1103197684493 | F159: 114.904091571631 | G159: false | H159: false | I159: false | J159: of:=AND([.G159]; [.H159]; [.I159]) -> false
A160: IRG4PC50UD | B160: of:=MIN(ROUNDDOWN(([data.G160:.G340])/(cell_charged_voltage*(1+voltage_margin)); 0); max_cells) -> 100 | C160: 300 | D160: 189.393536813132 | E160: 62.1103197684493 | F160: 102.482027617941 | G160: false | H160: true | I160: false | J160: of:=AND([.G160]; [.H160]; [.I160]) -> false
A161: IRGS4056D | B161: of:=MIN(ROUNDDOWN(([data.G161:.G341])/(cell_charged_voltage*(1+voltage_margin)); 0); max_cells) -> 100 | C161: 300 | D161: 189.393536813132 | E161: 62.1103197684493 | F161: 96.2709956410965 | G161: false | H161: true | I161: false | J161: of:=AND([.G161]; [.H161]; [.I161]) -> false
A162: IRGP4069D | B162: of:=MIN(ROUNDDOWN(([data.G162:.G342])/(cell_charged_voltage*(1+voltage_margin)); 0); max_cells) -> 100 | C162: 300 | D162: 189.393536813132 | E162: 62.1103197684493 | F162: 99.3765116295189 | G162: false | H162: true | I162: false | J162: of:=AND([.G162]; [.H162]; [.I162]) -> false
A163: IRGS6B60KD | B163: of:=MIN(ROUNDDOWN(([data.G163:.G343])/(cell_charged_voltage*(1+voltage_margin)); 0); max_cells) -> 100 | C163: 300 | D163: 189.393536813132 | E163: 62.1103197684493 | F163: 111.798575583209 | G163: false | H163: false | I163: false | J163: of:=AND([.G163]; [.H163]; [.I163]) -> false
A164: IRGS4062D | B164: of:=MIN(ROUNDDOWN(([data.G164:.G344])/(cell_charged_voltage*(1+voltage_margin)); 0); max_cells) -> 100 | C164: 300 | D164: 189.393536813132 | E164: 62.1103197684493 | F164: 99.3765116295189 | G164: false | H164: true | I164: false | J164: of:=AND([.G164]; [.H164]; [.I164]) -> false
A165: IRGSL10B60KD | B165: of:=MIN(ROUNDDOWN(([data.G165:.G345])/(cell_charged_voltage*(1+voltage_margin)); 0); max_cells) -> 100 | C165: 300 | D165: 189.393536813132 | E165: 62.1103197684493 | F165: 111.798575583209 | G165: false | H165: false | I165: false | J165: of:=AND([.G165]; [.H165]; [.I165]) -> false
A166: IRG7PH42UD1M | B166: of:=MIN(ROUNDDOWN(([data.G166:.G346])/(cell_charged_voltage*(1+voltage_margin)); 0); max_cells) -> 123 | C166: 369 | D166: 232.954050280153 | E166: 50.4961949336986 | F166: 85.8435313872877 | G166: false | H166: true | I166: true | J166: of:=AND([.G166]; [.H166]; [.I166]) -> false
A167: IRGS10B60KD | B167: of:=MIN(ROUNDDOWN(([data.G167:.G347])/(cell_charged_voltage*(1+voltage_margin)); 0); max_cells) -> 100 | C167: 300 | D167: 189.393536813132 | E167: 62.1103197684493 | F167: 111.798575583209 | G167: false | H167: false | I167: false | J167: of:=AND([.G167]; [.H167]; [.I167]) -> false
A168: IRGP4640D | B168: of:=MIN(ROUNDDOWN(([data.G168:.G348])/(cell_charged_voltage*(1+voltage_margin)); 0); max_cells) -> 100 | C168: 300 | D168: 189.393536813132 | E168: 62.1103197684493 | F168: 99.3765116295189 | G168: false | H168: true | I168: false | J168: of:=AND([.G168]; [.H168]; [.I168]) -> false
A169: IRGIB10B60KD1 | B169: of:=MIN(ROUNDDOWN(([data.G169:.G349])/(cell_charged_voltage*(1+voltage_margin)); 0); max_cells) -> 100 | C169: 300 | D169: 189.393536813132 | E169: 62.1103197684493 | F169: 105.587543606364 | G169: false | H169: false | I169: false | J169: of:=AND([.G169]; [.H169]; [.I169]) -> false
A170: IRGR2B60KD | B170: of:=MIN(ROUNDDOWN(([data.G170:.G350])/(cell_charged_voltage*(1+voltage_margin)); 0); max_cells) -> 100 | C170: 300 | D170: 189.393536813132 | E170: 62.1103197684493 | F170: 121.115123548476 | G170: false | H170: false | I170: false | J170: of:=AND([.G170]; [.H170]; [.I170]) -> false
A171: IRGB4064D | B171: of:=MIN(ROUNDDOWN(([data.G171:.G351])/(cell_charged_voltage*(1+voltage_margin)); 0); max_cells) -> 100 | C171: 300 | D171: 189.393536813132 | E171: 62.1103197684493 | F171: 99.3765116295189 | G171: false | H171: true | I171: false | J171: of:=AND([.G171]; [.H171]; [.I171]) -> false
A172: IRG4BC10KD | B172: of:=MIN(ROUNDDOWN(([data.G172:.G352])/(cell_charged_voltage*(1+voltage_margin)); 0); max_cells) -> 100 | C172: 300 | D172: 189.393536813132 | E172: 62.1103197684493 | F172: 148.443664246594 | G172: false | H172: false | I172: false | J172: of:=AND([.G172]; [.H172]; [.I172]) -> false
A173: IRG7PH42UD1 | B173: of:=MIN(ROUNDDOWN(([data.G173:.G353])/(cell_charged_voltage*(1+voltage_margin)); 0); max_cells) -> 123 | C173: 369 | D173: 232.954050280153 | E173: 50.4961949336986 | F173: 85.8435313872877 | G173: false | H173: true | I173: true | J173: of:=AND([.G173]; [.H173]; [.I173]) -> false
A174: IRGP4066D-E | B174: of:=MIN(ROUNDDOWN(([data.G174:.G354])/(cell_charged_voltage*(1+voltage_margin)); 0); max_cells) -> 100 | C174: 300 | D174: 189.393536813132 | E174: 62.1103197684493 | F174: 105.587543606364 | G174: true | H174: true | I174: false | J174: of:=AND([.G174]; [.H174]; [.I174]) -> false
A175: IRGR4045D | B175: of:=MIN(ROUNDDOWN(([data.G175:.G355])/(cell_charged_voltage*(1+voltage_margin)); 0); max_cells) -> 100 | C175: 300 | D175: 189.393536813132 | E175: 62.1103197684493 | F175: 105.587543606364 | G175: false | H175: false | I175: false | J175: of:=AND([.G175]; [.H175]; [.I175]) -> false
A176: IRG4PF50WD | B176: of:=MIN(ROUNDDOWN(([data.G176:.G356])/(cell_charged_voltage*(1+voltage_margin)); 0); max_cells) -> 123 | C176: 369 | D176: 232.954050280153 | E176: 50.4961949336986 | F176: 113.616438600822 | G176: false | H176: true | I176: false | J176: of:=AND([.G176]; [.H176]; [.I176]) -> false
A177: IRG4PSC71KD | B177: of:=MIN(ROUNDDOWN(([data.G177:.G357])/(cell_charged_voltage*(1+voltage_margin)); 0); max_cells) -> 100 | C177: 300 | D177: 189.393536813132 | E177: 62.1103197684493 | F177: 113.661885176262 | G177: false | H177: true | I177: false | J177: of:=AND([.G177]; [.H177]; [.I177]) -> false
A178: IRGP4063D1 | B178: of:=MIN(ROUNDDOWN(([data.G178:.G358])/(cell_charged_voltage*(1+voltage_margin)); 0); max_cells) -> 100 | C178: 300 | D178: 189.393536813132 | E178: 62.1103197684493 | F178: 102.482027617941 | G178: false | H178: true | I178: false | J178: of:=AND([.G178]; [.H178]; [.I178]) -> false
A179: IRG4BC20FD | B179: of:=MIN(ROUNDDOWN(([data.G179:.G359])/(cell_charged_voltage*(1+voltage_margin)); 0); max_cells) -> 100 | C179: 300 | D179: 189.393536813132 | E179: 62.1103197684493 | F179: 103.103130815626 | G179: false | H179: false | I179: false | J179: of:=AND([.G179]; [.H179]; [.I179]) -> false
A180: IRGS4064D | B180: of:=MIN(ROUNDDOWN(([data.G180:.G360])/(cell_charged_voltage*(1+voltage_margin)); 0); max_cells) -> 100 | C180: 300 | D180: 189.393536813132 | E180: 62.1103197684493 | F180: 99.3765116295189 | G180: false | H180: true | I180: false | J180: of:=AND([.G180]; [.H180]; [.I180]) -> false
A181: IRGP20B120UD-E | B181: of:=MIN(ROUNDDOWN(([data.G181:.G361])/(cell_charged_voltage*(1+voltage_margin)); 0); max_cells) -> 123 | C181: 369 | D181: 232.954050280153 | E181: 50.4961949336986 | F181: 154.013394547781 | G181: false | H181: true | I181: false | J181: of:=AND([.G181]; [.H181]; [.I181]) -> false
A182: IRG4RC10UD | B182: of:=MIN(ROUNDDOWN(([data.G182:.G362])/(cell_charged_voltage*(1+voltage_margin)); 0); max_cells) -> 100 | C182: 300 | D182: 189.393536813132 | E182: 62.1103197684493 | F182: 133.537187502166 | G182: false | H182: false | I182: false | J182: of:=AND([.G182]; [.H182]; [.I182]) -> false

Sheet: ranking
A1: Model | B1: Fits | C1: Price | E1: sorted: | F1: Model | G1: Fits | H1: Price
A2: of:=[calculations.$A2] -> IRGP4066-E | B2: of:=[calculations.$J2] -> false | C2: of:=[data.$R2] -> 5.45 | F2: of:=[calculations.$A38] -> IRG7PH50U-E | G2: of:=[calculations.$J38] -> true | H2: of:=[data.$R38] -> 0
A3: of:=[calculations.$A3] -> IRG7PH35U | B3: of:=[calculations.$J3] -> false | C3: of:=[data.$R3] -> 2.912 | F3: of:=[calculations.$A126] -> IRG7PSH50UD | G3: of:=[calculations.$J126] -> true | H3: of:=[data.$R126] -> 0
A4: of:=[calculations.$A4] -> IRG4BC20U | B4: of:=[calculations.$J4] -> false | C4: of:=[data.$R4] -> 0.886 | F4: of:=[calculations.$A19] -> IRG7PH42U | G4: of:=[calculations.$J19] -> true | H4: of:=[data.$R19] -> 4.395
A5: of:=[calculations.$A5] -> IRG4BC30W-S | B5: of:=[calculations.$J5] -> false | C5: of:=[data.$R5] -> 1.25 | F5: of:=[calculations.$A63] -> IRG7PH46U | G5: of:=[calculations.$J63] -> true | H5: of:=[data.$R63] -> 6.125
A6: of:=[calculations.$A6] -> IRGP4069 | B6: of:=[calculations.$J6] -> false | C6: of:=[data.$R6] -> 2.875 | F6: of:=[calculations.$A109] -> IRG7PH46UD | G6: of:=[calculations.$J109] -> true | H6: of:=[data.$R109] -> 6.562
A7: of:=[calculations.$A7] -> IRGB8B60K | B7: of:=[calculations.$J7] -> false | C7: of:=[data.$R7] -> 1.144 | F7: of:=[calculations.$A34] -> IRG7PH50U | G7: of:=[calculations.$J34] -> true | H7: of:=[data.$R34] -> 7.5
A8: of:=[calculations.$A8] -> IRG4PH20K | B8: of:=[calculations.$J8] -> false | C8: of:=[data.$R8] -> 1.6 | F8: of:=[calculations.$A18] -> IRG7P313U | G8: of:=[calculations.$J18] -> false | H8: of:=[data.$R18] -> 0
A9: of:=[calculations.$A9] -> IRG4PC50W | B9: of:=[calculations.$J9] -> false | C9: of:=[data.$R9] -> 3.069 | F9: of:=[calculations.$A21] -> IRG7IC28U | G9: of:=[calculations.$J21] -> false | H9: of:=[data.$R21] -> 0
A10: of:=[calculations.$A10] -> IRG4PC40U | B10: of:=[calculations.$J10] -> false | C10: of:=[data.$R10] -> 2.128 | F10: of:=[calculations.$A29] -> IRG7PC28U | G10: of:=[calculations.$J29] -> false | H10: of:=[data.$R29] -> 0
A11: of:=[calculations.$A11] -> IRGB4B60K | B11: of:=[calculations.$J11] -> false | C11: of:=[data.$R11] -> 0.94 | F11: of:=[calculations.$A36] -> IRGS4B60K | G11: of:=[calculations.$J36] -> false | H11: of:=[data.$R36] -> 0
A12: of:=[calculations.$A12] -> IRGP4066 | B12: of:=[calculations.$J12] -> false | C12: of:=[data.$R12] -> 5.375 | F12: of:=[calculations.$A70] -> IRG7SC28U | G12: of:=[calculations.$J70] -> false | H12: of:=[data.$R70] -> 0
A13: of:=[calculations.$A13] -> IRG4BH20K-L | B13: of:=[calculations.$J13] -> false | C13: of:=[data.$R13] -> 0.97 | F13: of:=[calculations.$A77] -> 0 | G13: of:=[calculations.$J77] -> false | H13: of:=[data.$R77] -> 0
A14: of:=[calculations.$A14] -> IRG4PC40K | B14: of:=[calculations.$J14] -> false | C14: of:=[data.$R14] -> 2.112 | F14: of:=[calculations.$A117] -> IRGSL15B60KD | G14: of:=[calculations.$J117] -> false | H14: of:=[data.$R117] -> 0
A15: of:=[calculations.$A15] -> IRG4PH30K | B15: of:=[calculations.$J15] -> false | C15: of:=[data.$R15] -> 1.9 | F15: of:=[calculations.$A124] -> IRG7PH35UD1M | G15: of:=[calculations.$J124] -> false | H15: of:=[data.$R124] -> 0
A16: of:=[calculations.$A16] -> IRG4PC50U | B16: of:=[calculations.$J16] -> false | C16: of:=[data.$R16] -> 2.771 | F16: of:=[calculations.$A139] -> IRG6B330UD | G16: of:=[calculations.$J139] -> false | H16: of:=[data.$R139] -> 0
A17: of:=[calculations.$A17] -> IRG4PSC71U | B17: of:=[calculations.$J17] -> false | C17: of:=[data.$R17] -> 5.411 | F17: of:=[calculations.$A166] -> IRG7PH42UD1M | G17: of:=[calculations.$J166] -> false | H17: of:=[data.$R166] -> 0
A18: of:=[calculations.$A18] -> IRG7P313U | B18: of:=[calculations.$J18] -> false | C18: of:=[data.$R18] -> 0 | F18: of:=[calculations.$A180] -> IRGS4064D | G18: of:=[calculations.$J180] -> false | H18: of:=[data.$R180] -> 0
A19: of:=[calculations.$A19] -> IRG7PH42U | B19: of:=[calculations.$J19] -> true | C19: of:=[data.$R19] -> 4.395 | F19: of:=[calculations.$A170] -> IRGR2B60KD | G19: of:=[calculations.$J170] -> false | H19: of:=[data.$R170] -> 0.39
A20: of:=[calculations.$A20] -> IRG4PC30U | B20: of:=[calculations.$J20] -> false | C20: of:=[data.$R20] -> 1.785 | F20: of:=[calculations.$A33] -> IRG7RA13U | G20: of:=[calculations.$J33] -> false | H20: of:=[data.$R33] -> 0.65
A21: of:=[calculations.$A21] -> IRG7IC28U | B21: of:=[calculations.$J21] -> false | C21: of:=[data.$R21] -> 0 | F21: of:=[calculations.$A61] -> IRG4RC10U | G21: of:=[calculations.$J61] -> false | H21: of:=[data.$R61] -> 0.656
A22: of:=[calculations.$A22] -> IRG4PC30W | B22: of:=[calculations.$J22] -> false | C22: of:=[data.$R22] -> 1.8 | F22: of:=[calculations.$A60] -> IRG4BC20W | G22: of:=[calculations.$J60] -> false | H22: of:=[data.$R60] -> 0.868
A23: of:=[calculations.$A23] -> IRG4BC40K | B23: of:=[calculations.$J23] -> false | C23: of:=[data.$R23] -> 1.443 | F23: of:=[calculations.$A4] -> IRG4BC20U | G23: of:=[calculations.$J4] -> false | H23: of:=[data.$R4] -> 0.886
A24: of:=[calculations.$A24] -> IRGS30B60K | B24: of:=[calculations.$J24] -> false | C24: of:=[data.$R24] -> 1.85 | F24: of:=[calculations.$A57] -> IRG4BC20W-S | G24: of:=[calculations.$J57] -> false | H24: of:=[data.$R57] -> 0.888
A25: of:=[calculations.$A25] -> IRG4BH20K-S | B25: of:=[calculations.$J25] -> false | C25: of:=[data.$R25] -> 1.229 | F25: of:=[calculations.$A172] -> IRG4BC10KD | G25: of:=[calculations.$J172] -> false | H25: of:=[data.$R172] -> 0.932
A26: of:=[calculations.$A26] -> IRG4IBC30W | B26: of:=[calculations.$J26] -> false | C26: of:=[data.$R26] -> 1.27 | F26: of:=[calculations.$A11] -> IRGB4B60K | G26: of:=[calculations.$J11] -> false | H26: of:=[data.$R11] -> 0.94
A27: of:=[calculations.$A27] -> IRG7S319U | B27: of:=[calculations.$J27] -> false | C27: of:=[data.$R27] -> 1.176 | F27: of:=[calculations.$A140] -> IRG4BC10UD | G27: of:=[calculations.$J140] -> false | H27: of:=[data.$R140] -> 0.942
A28: of:=[calculations.$A28] -> IRG7I319U | B28: of:=[calculations.$J28] -> false | C28: of:=[data.$R28] -> 1.25 | F28: of:=[calculations.$A13] -> IRG4BH20K-L | G28: of:=[calculations.$J13] -> false | H28: of:=[data.$R13] -> 0.97
A29: of:=[calculations.$A29] -> IRG7PC28U | B29: of:=[calculations.$J29] -> false | C29: of:=[data.$R29] -> 0 | F29: of:=[calculations.$A71] -> IRGB6B60K | G29: of:=[calculations.$J71] -> false | H29: of:=[data.$R71] -> 0.976
A30: of:=[calculations.$A30] -> IRG4BC30U | B30: of:=[calculations.$J30] -> false | C30: of:=[data.$R30] -> 1.115 | F30: of:=[calculations.$A114] -> IRGR3B60KD2 | G30: of:=[calculations.$J114] -> false | H30: of:=[data.$R114] -> 0.979
A31: of:=[calculations.$A31] -> IRGSL30B60K | B31: of:=[calculations.$J31] -> false | C31: of:=[data.$R31] -> 1.87 | F31: of:=[calculations.$A65] -> IRG7S313U | G31: of:=[calculations.$J65] -> false | H31: of:=[data.$R65] -> 0.986
A32: of:=[calculations.$A32] -> IRGP4263 | B32: of:=[calculations.$J32] -> false | C32: of:=[data.$R32] -> 3.165 | F32: of:=[calculations.$A41] -> IRG4IBC20W | G32: of:=[calculations.$J41] -> false | H32: of:=[data.$R41] -> 1.008
A33: of:=[calculations.$A33] -> IRG7RA13U | B33: of:=[calculations.$J33] -> false | C33: of:=[data.$R33] -> 0.65 | F33: of:=[calculations.$A79] -> IRG4BC15UD | G33: of:=[calculations.$J79] -> false | H33: of:=[data.$R79] -> 1.009
A34: of:=[calculations.$A34] -> IRG7PH50U | B34: of:=[calculations.$J34] -> true | C34: of:=[data.$R34] -> 7.5 | F34: of:=[calculations.$A50] -> IRG7I313U | G34: of:=[calculations.$J50] -> false | H34: of:=[data.$R50] -> 1.021
A35: of:=[calculations.$A35] -> IRG4PH50U | B35: of:=[calculations.$J35] -> false | C35: of:=[data.$R35] -> 3.414 | F35: of:=[calculations.$A55] -> IRG7R313U | G35: of:=[calculations.$J55] -> false | H35: of:=[data.$R55] -> 1.025
A36: of:=[calculations.$A36] -> IRGS4B60K | B36: of:=[calculations.$J36] -> false | C36: of:=[data.$R36] -> 0 | F36: of:=[calculations.$A122] -> IRG4BC15UD-S | G36: of:=[calculations.$J122] -> false | H36: of:=[data.$R122] -> 1.029
A37: of:=[calculations.$A37] -> IRGB30B60K | B37: of:=[calculations.$J37] -> false | C37: of:=[data.$R37] -> 1.83 | F37: of:=[calculations.$A99] -> IRG4BC15UD-L | G37: of:=[calculations.$J99] -> false | H37: of:=[data.$R99] -> 1.049
A38: of:=[calculations.$A38] -> IRG7PH50U-E | B38: of:=[calculations.$J38] -> true | C38: of:=[data.$R38] -> 0 | F38: of:=[calculations.$A108] -> IRG4IBC10UD | G38: of:=[calculations.$J108] -> false | H38: of:=[data.$R108] -> 1.082
A39: of:=[calculations.$A39] -> IRGS15B60K | B39: of:=[calculations.$J39] -> false | C39: of:=[data.$R39] -> 2.312 | F39: of:=[calculations.$A182] -> IRG4RC10UD | G39: of:=[calculations.$J182] -> false | H39: of:=[data.$R182] -> 1.099
A40: of:=[calculations.$A40] -> IRG4PC30K | B40: of:=[calculations.$J40] -> false | C40: of:=[data.$R40] -> 1.775 | F40: of:=[calculations.$A74] -> IRG4BC30K | G40: of:=[calculations.$J74] -> false | H40: of:=[data.$R74] -> 1.105
A41: of:=[calculations.$A41] -> IRG4IBC20W | B41: of:=[calculations.$J41] -> false | C41: of:=[data.$R41] -> 1.008 | F41: of:=[calculations.$A158] -> IRGS4045D | G41: of:=[calculations.$J158] -> false | H41: of:=[data.$R158] -> 1.106
A42: of:=[calculations.$A42] -> IRG4BC30W | B42: of:=[calculations.$J42] -> false | C42: of:=[data.$R42] -> 1.13 | F42: of:=[calculations.$A30] -> IRG4BC30U | G42: of:=[calculations.$J30] -> false | H42: of:=[data.$R30] -> 1.115
A43: of:=[calculations.$A43] -> IRG4BC40U | B43: of:=[calculations.$J43] -> false | C43: of:=[data.$R43] -> 1.458 | F43: of:=[calculations.$A42] -> IRG4BC30W | G43: of:=[calculations.$J42] -> false | H43: of:=[data.$R42] -> 1.13
A44: of:=[calculations.$A44] -> IRG4PH40U | B44: of:=[calculations.$J44] -> false | C44: of:=[data.$R44] -> 2.503 | F44: of:=[calculations.$A7] -> IRGB8B60K | G44: of:=[calculations.$J7] -> false | H44: of:=[data.$R7] -> 1.144
A45: of:=[calculations.$A45] -> IRGS8B60K | B45: of:=[calculations.$J45] -> false | C45: of:=[data.$R45] -> 1.164 | F45: of:=[calculations.$A45] -> IRGS8B60K | G45: of:=[calculations.$J45] -> false | H45: of:=[data.$R45] -> 1.164
A46: of:=[calculations.$A46] -> IRG4BC40WL | B46: of:=[calculations.$J46] -> false | C46: of:=[data.$R46] -> 1.59 | F46: of:=[calculations.$A179] -> IRG4BC20FD | G46: of:=[calculations.$J179] -> false | H46: of:=[data.$R179] -> 1.168
A47: of:=[calculations.$A47] -> IRG4PH50K | B47: of:=[calculations.$J47] -> false | C47: of:=[data.$R47] -> 3.148 | F47: of:=[calculations.$A27] -> IRG7S319U | G47: of:=[calculations.$J27] -> false | H47: of:=[data.$R27] -> 1.176
A48: of:=[calculations.$A48] -> IRG7PH30K10 | B48: of:=[calculations.$J48] -> false | C48: of:=[data.$R48] -> 3.4 | F48: of:=[calculations.$A103] -> IRG4BC20KD | G48: of:=[calculations.$J103] -> false | H48: of:=[data.$R103] -> 1.184
A49: of:=[calculations.$A49] -> IRGPS40B120U | B49: of:=[calculations.$J49] -> false | C49: of:=[data.$R49] -> 5.295 | F49: of:=[calculations.$A118] -> IRGS4B60KD1 | G49: of:=[calculations.$J118] -> false | H49: of:=[data.$R118] -> 1.19
A50: of:=[calculations.$A50] -> IRG7I313U | B50: of:=[calculations.$J50] -> false | C50: of:=[data.$R50] -> 1.021 | F50: of:=[calculations.$A159] -> IRG4BC20UD | G50: of:=[calculations.$J159] -> false | H50: of:=[data.$R159] -> 1.2
A51: of:=[calculations.$A51] -> IRGP20B120U-E | B51: of:=[calculations.$J51] -> false | C51: of:=[data.$R51] -> 3.488 | F51: of:=[calculations.$A113] -> IRGSL4B60KD1 | G51: of:=[calculations.$J113] -> false | H51: of:=[data.$R113] -> 1.21
A52: of:=[calculations.$A52] -> IRG4PC50K | B52: of:=[calculations.$J52] -> false | C52: of:=[data.$R52] -> 2.748 | F52: of:=[calculations.$A90] -> IRG4BC20UD-S | G52: of:=[calculations.$J90] -> false | H52: of:=[data.$R90] -> 1.22
A53: of:=[calculations.$A53] -> IRG4PF50W | B53: of:=[calculations.$J53] -> false | C53: of:=[data.$R53] -> 3.02 | F53: of:=[calculations.$A25] -> IRG4BH20K-S | G53: of:=[calculations.$J25] -> false | H53: of:=[data.$R25] -> 1.229
A54: of:=[calculations.$A54] -> IRG7PSH73K10 | B54: of:=[calculations.$J54] -> false | C54: of:=[data.$R54] -> 11.149 | F54: of:=[calculations.$A72] -> IRGS6B60K | G54: of:=[calculations.$J72] -> false | H54: of:=[data.$R72] -> 1.23
A55: of:=[calculations.$A55] -> IRG7R313U | B55: of:=[calculations.$J55] -> false | C55: of:=[data.$R55] -> 1.025 | F55: of:=[calculations.$A145] -> IRGB4B60KD1 | G55: of:=[calculations.$J145] -> false | H55: of:=[data.$R145] -> 1.246
A56: of:=[calculations.$A56] -> IRG4PH40K | B56: of:=[calculations.$J56] -> false | C56: of:=[data.$R56] -> 2.38 | F56: of:=[calculations.$A5] -> IRG4BC30W-S | G56: of:=[calculations.$J5] -> false | H56: of:=[data.$R5] -> 1.25
A57: of:=[calculations.$A57] -> IRG4BC20W-S | B57: of:=[calculations.$J57] -> false | C57: of:=[data.$R57] -> 0.888 | F57: of:=[calculations.$A28] -> IRG7I319U | G57: of:=[calculations.$J28] -> false | H57: of:=[data.$R28] -> 1.25
A58: of:=[calculations.$A58] -> IRG7IA13U | B58: of:=[calculations.$J58] -> false | C58: of:=[data.$R58] -> 1.312 | F58: of:=[calculations.$A26] -> IRG4IBC30W | G58: of:=[calculations.$J26] -> false | H58: of:=[data.$R26] -> 1.27
A59: of:=[calculations.$A59] -> IRG4PC60U | B59: of:=[calculations.$J59] -> false | C59: of:=[data.$R59] -> 4.112 | F59: of:=[calculations.$A119] -> IRGB6B60KD | G59: of:=[calculations.$J119] -> false | H59: of:=[data.$R119] -> 1.304
A60: of:=[calculations.$A60] -> IRG4BC20W | B60: of:=[calculations.$J60] -> false | C60: of:=[data.$R60] -> 0.868 | F60: of:=[calculations.$A58] -> IRG7IA13U | G60: of:=[calculations.$J58] -> false | H60: of:=[data.$R58] -> 1.312
A61: of:=[calculations.$A61] -> IRG4RC10U | B61: of:=[calculations.$J61] -> false | C61: of:=[data.$R61] -> 0.656 | F61: of:=[calculations.$A175] -> IRGR4045D | G61: of:=[calculations.$J175] -> false | H61: of:=[data.$R175] -> 1.318
A62: of:=[calculations.$A62] -> IRG4BC40W | B62: of:=[calculations.$J62] -> false | C62: of:=[data.$R62] -> 1.55 | F62: of:=[calculations.$A152] -> IRG4IBC20KD | G62: of:=[calculations.$J152] -> false | H62: of:=[data.$R152] -> 1.324
A63: of:=[calculations.$A63] -> IRG7PH46U | B63: of:=[calculations.$J63] -> true | C63: of:=[data.$R63] -> 6.125 | F63: of:=[calculations.$A163] -> IRGS6B60KD | G63: of:=[calculations.$J163] -> false | H63: of:=[data.$R163] -> 1.324
A64: of:=[calculations.$A64] -> IRGP4266 | B64: of:=[calculations.$J64] -> false | C64: of:=[data.$R64] -> 4.838 | F64: of:=[calculations.$A87] -> IRG4IBC20UD | G64: of:=[calculations.$J87] -> false | H64: of:=[data.$R87] -> 1.34
A65: of:=[calculations.$A65] -> IRG7S313U | B65: of:=[calculations.$J65] -> false | C65: of:=[data.$R65] -> 0.986 | F65: of:=[calculations.$A123] -> IRGSL6B60KD | G65: of:=[calculations.$J123] -> false | H65: of:=[data.$R123] -> 1.344
A66: of:=[calculations.$A66] -> IRG4BC40WS | B66: of:=[calculations.$J66] -> false | C66: of:=[data.$R66] -> 1.706 | F66: of:=[calculations.$A80] -> IRGB4059D | G66: of:=[calculations.$J80] -> false | H66: of:=[data.$R80] -> 1.345
A67: of:=[calculations.$A67] -> IRGP4063 | B67: of:=[calculations.$J67] -> false | C67: of:=[data.$R67] -> 3.35 | F67: of:=[calculations.$A69] -> IRG7IA19U | G67: of:=[calculations.$J69] -> false | H67: of:=[data.$R69] -> 1.388
A68: of:=[calculations.$A68] -> IRGP4062-E | B68: of:=[calculations.$J68] -> false | C68: of:=[data.$R68] -> 2.004 | F68: of:=[calculations.$A23] -> IRG4BC40K | G68: of:=[calculations.$J23] -> false | H68: of:=[data.$R23] -> 1.443
A69: of:=[calculations.$A69] -> IRG7IA19U | B69: of:=[calculations.$J69] -> false | C69: of:=[data.$R69] -> 1.388 | F69: of:=[calculations.$A156] -> IRGIB6B60KD | G69: of:=[calculations.$J156] -> false | H69: of:=[data.$R156] -> 1.444
A70: of:=[calculations.$A70] -> IRG7SC28U | B70: of:=[calculations.$J70] -> false | C70: of:=[data.$R70] -> 0 | F70: of:=[calculations.$A43] -> IRG4BC40U | G70: of:=[calculations.$J43] -> false | H70: of:=[data.$R43] -> 1.458
A71: of:=[calculations.$A71] -> IRGB6B60K | B71: of:=[calculations.$J71] -> false | C71: of:=[data.$R71] -> 0.976 | F71: of:=[calculations.$A148] -> IRGB4045D | G71: of:=[calculations.$J148] -> false | H71: of:=[data.$R148] -> 1.464
A72: of:=[calculations.$A72] -> IRGS6B60K | B72: of:=[calculations.$J72] -> false | C72: of:=[data.$R72] -> 1.23 | F72: of:=[calculations.$A62] -> IRG4BC40W | G72: of:=[calculations.$J62] -> false | H72: of:=[data.$R62] -> 1.55
A73: of:=[calculations.$A73] -> IRG4PC40W | B73: of:=[calculations.$J73] -> false | C73: of:=[data.$R73] -> 2.22 | F73: of:=[calculations.$A154] -> IRGB4060D | G73: of:=[calculations.$J154] -> false | H73: of:=[data.$R154] -> 1.55
A74: of:=[calculations.$A74] -> IRG4BC30K | B74: of:=[calculations.$J74] -> false | C74: of:=[data.$R74] -> 1.105 | F74: of:=[calculations.$A83] -> IRG4BC30KD | G74: of:=[calculations.$J83] -> false | H74: of:=[data.$R83] -> 1.561
A75: of:=[calculations.$A75] -> IRG7PA19U | B75: of:=[calculations.$J75] -> false | C75: of:=[data.$R75] -> 1.938 | F75: of:=[calculations.$A127] -> IRG4BC30KD-S | G75: of:=[calculations.$J127] -> false | H75: of:=[data.$R127] -> 1.581
A76: of:=[calculations.$A76] -> IRG4PSC71K | B76: of:=[calculations.$J76] -> false | C76: of:=[data.$R76] -> 5.359 | F76: of:=[calculations.$A132] -> IRG4BC30UD | G76: of:=[calculations.$J132] -> false | H76: of:=[data.$R132] -> 1.584
A77: of:=[calculations.$A77] -> 0 | B77: of:=[calculations.$J77] -> false | C77: of:=[data.$R77] -> 0 | F77: of:=[calculations.$A46] -> IRG4BC40WL | G77: of:=[calculations.$J46] -> false | H77: of:=[data.$R46] -> 1.59
A78: of:=[calculations.$A78] -> IRGPS40B120UD | B78: of:=[calculations.$J78] -> false | C78: of:=[data.$R78] -> 7.741 | F78: of:=[calculations.$A8] -> IRG4PH20K | G78: of:=[calculations.$J8] -> false | H78: of:=[data.$R8] -> 1.6
A79: of:=[calculations.$A79] -> IRG4BC15UD | B79: of:=[calculations.$J79] -> false | C79: of:=[data.$R79] -> 1.009 | F79: of:=[calculations.$A153] -> IRGB10B60KD | G79: of:=[calculations.$J153] -> false | H79: of:=[data.$R153] -> 1.694
A80: of:=[calculations.$A80] -> IRGB4059D | B80: of:=[calculations.$J80] -> false | C80: of:=[data.$R80] -> 1.345 | F80: of:=[calculations.$A135] -> IRG4IBC30KD | G80: of:=[calculations.$J135] -> false | H80: of:=[data.$R135] -> 1.701
A81: of:=[calculations.$A81] -> IRGP4063D | B81: of:=[calculations.$J81] -> false | C81: of:=[data.$R81] -> 4.132 | F81: of:=[calculations.$A66] -> IRG4BC40WS | G81: of:=[calculations.$J66] -> false | H81: of:=[data.$R66] -> 1.706
A82: of:=[calculations.$A82] -> IRGP4650D | B82: of:=[calculations.$J82] -> false | C82: of:=[data.$R82] -> 2.979 | F82: of:=[calculations.$A94] -> IRGIB7B60KD | G82: of:=[calculations.$J94] -> false | H82: of:=[data.$R94] -> 1.713
A83: of:=[calculations.$A83] -> IRG4BC30KD | B83: of:=[calculations.$J83] -> false | C83: of:=[data.$R83] -> 1.561 | F83: of:=[calculations.$A167] -> IRGS10B60KD | G83: of:=[calculations.$J167] -> false | H83: of:=[data.$R167] -> 1.714
A84: of:=[calculations.$A84] -> IRGP35B60PD | B84: of:=[calculations.$J84] -> false | C84: of:=[data.$R84] -> 3.578 | F84: of:=[calculations.$A169] -> IRGIB10B60KD1 | G84: of:=[calculations.$J169] -> false | H84: of:=[data.$R169] -> 1.716
A85: of:=[calculations.$A85] -> IRG7PH28UD1 | B85: of:=[calculations.$J85] -> false | C85: of:=[data.$R85] -> 1.794 | F85: of:=[calculations.$A121] -> IRG4IBC30UD | G85: of:=[calculations.$J121] -> false | H85: of:=[data.$R121] -> 1.724
A86: of:=[calculations.$A86] -> IRG4PH40UD2-E | B86: of:=[calculations.$J86] -> false | C86: of:=[data.$R86] -> 3.234 | F86: of:=[calculations.$A165] -> IRGSL10B60KD | G86: of:=[calculations.$J165] -> false | H86: of:=[data.$R165] -> 1.734
A87: of:=[calculations.$A87] -> IRG4IBC20UD | B87: of:=[calculations.$J87] -> false | C87: of:=[data.$R87] -> 1.34 | F87: of:=[calculations.$A40] -> IRG4PC30K | G87: of:=[calculations.$J40] -> false | H87: of:=[data.$R40] -> 1.775
A88: of:=[calculations.$A88] -> IRG4PH40UD | B88: of:=[calculations.$J88] -> false | C88: of:=[data.$R88] -> 3.484 | F88: of:=[calculations.$A20] -> IRG4PC30U | G88: of:=[calculations.$J20] -> false | H88: of:=[data.$R20] -> 1.785
A89: of:=[calculations.$A89] -> IRGP20B60PD | B89: of:=[calculations.$J89] -> false | C89: of:=[data.$R89] -> 2.755 | F89: of:=[calculations.$A85] -> IRG7PH28UD1 | G89: of:=[calculations.$J85] -> false | H89: of:=[data.$R85] -> 1.794
A90: of:=[calculations.$A90] -> IRG4BC20UD-S | B90: of:=[calculations.$J90] -> false | C90: of:=[data.$R90] -> 1.22 | F90: of:=[calculations.$A22] -> IRG4PC30W | G90: of:=[calculations.$J22] -> false | H90: of:=[data.$R22] -> 1.8
A91: of:=[calculations.$A91] -> IRG4PH30KD | B91: of:=[calculations.$J91] -> false | C91: of:=[data.$R91] -> 2.5 | F91: of:=[calculations.$A37] -> IRGB30B60K | G91: of:=[calculations.$J37] -> false | H91: of:=[data.$R37] -> 1.83
A92: of:=[calculations.$A92] -> IRGP4068D-E | B92: of:=[calculations.$J92] -> false | C92: of:=[data.$R92] -> 4.363 | F92: of:=[calculations.$A24] -> IRGS30B60K | G92: of:=[calculations.$J24] -> false | H92: of:=[data.$R24] -> 1.85
A93: of:=[calculations.$A93] -> IRGP4660D | B93: of:=[calculations.$J93] -> false | C93: of:=[data.$R93] -> 3.409 | F93: of:=[calculations.$A171] -> IRGB4064D | G93: of:=[calculations.$J171] -> false | H93: of:=[data.$R171] -> 1.859
A94: of:=[calculations.$A94] -> IRGIB7B60KD | B94: of:=[calculations.$J94] -> false | C94: of:=[data.$R94] -> 1.713 | F94: of:=[calculations.$A31] -> IRGSL30B60K | G94: of:=[calculations.$J31] -> false | H94: of:=[data.$R31] -> 1.87
A95: of:=[calculations.$A95] -> IRG4PC40KD | B95: of:=[calculations.$J95] -> false | C95: of:=[data.$R95] -> 2.832 | F95: of:=[calculations.$A15] -> IRG4PH30K | G95: of:=[calculations.$J15] -> false | H95: of:=[data.$R15] -> 1.9
A96: of:=[calculations.$A96] -> IRG4PH50UD | B96: of:=[calculations.$J96] -> false | C96: of:=[data.$R96] -> 5.034 | F96: of:=[calculations.$A125] -> IRGB20B60PD1 | G96: of:=[calculations.$J125] -> false | H96: of:=[data.$R125] -> 1.93
A97: of:=[calculations.$A97] -> IRGB15B60KD | B97: of:=[calculations.$J97] -> false | C97: of:=[data.$R97] -> 2.03 | F97: of:=[calculations.$A75] -> IRG7PA19U | G97: of:=[calculations.$J75] -> false | H97: of:=[data.$R75] -> 1.938
A98: of:=[calculations.$A98] -> IRG7PH42UD | B98: of:=[calculations.$J98] -> false | C98: of:=[data.$R98] -> 5.712 | F98: of:=[calculations.$A120] -> IRG4PH20KD | G98: of:=[calculations.$J120] -> false | H98: of:=[data.$R120] -> 1.975
A99: of:=[calculations.$A99] -> IRG4BC15UD-L | B99: of:=[calculations.$J99] -> false | C99: of:=[data.$R99] -> 1.049 | F99: of:=[calculations.$A106] -> IRGB4056D | G99: of:=[calculations.$J106] -> false | H99: of:=[data.$R106] -> 1.98
A100: of:=[calculations.$A100] -> IRG7PH35UD | B100: of:=[calculations.$J100] -> false | C100: of:=[data.$R100] -> 4.5 | F100: of:=[calculations.$A161] -> IRGS4056D | G100: of:=[calculations.$J161] -> false | H100: of:=[data.$R161] -> 2
A101: of:=[calculations.$A101] -> IRG4PC30KD | B101: of:=[calculations.$J101] -> false | C101: of:=[data.$R101] -> 2.231 | F101: of:=[calculations.$A68] -> IRGP4062-E | G101: of:=[calculations.$J68] -> false | H101: of:=[data.$R68] -> 2.004
A102: of:=[calculations.$A102] -> IRG4PC50KD | B102: of:=[calculations.$J102] -> false | C102: of:=[data.$R102] -> 3.859 | F102: of:=[calculations.$A157] -> IRGIB15B60KD1 | G102: of:=[calculations.$J157] -> false | H102: of:=[data.$R157] -> 2.02
A103: of:=[calculations.$A103] -> IRG4BC20KD | B103: of:=[calculations.$J103] -> false | C103: of:=[data.$R103] -> 1.184 | F103: of:=[calculations.$A97] -> IRGB15B60KD | G103: of:=[calculations.$J97] -> false | H103: of:=[data.$R97] -> 2.03
A104: of:=[calculations.$A104] -> IRGP4068D | B104: of:=[calculations.$J104] -> false | C104: of:=[data.$R104] -> 4.462 | F104: of:=[calculations.$A147] -> IRGS15B60KD | G104: of:=[calculations.$J147] -> false | H104: of:=[data.$R147] -> 2.05
A105: of:=[calculations.$A105] -> IRGP35B60PD-E | B105: of:=[calculations.$J105] -> false | C105: of:=[data.$R105] -> 3.678 | F105: of:=[calculations.$A14] -> IRG4PC40K | G105: of:=[calculations.$J14] -> false | H105: of:=[data.$R14] -> 2.112
A106: of:=[calculations.$A106] -> IRGB4056D | B106: of:=[calculations.$J106] -> false | C106: of:=[data.$R106] -> 1.98 | F106: of:=[calculations.$A10] -> IRG4PC40U | G106: of:=[calculations.$J10] -> false | H106: of:=[data.$R10] -> 2.128
A107: of:=[calculations.$A107] -> IRGP50B60PD | B107: of:=[calculations.$J107] -> false | C107: of:=[data.$R107] -> 4.454 | F107: of:=[calculations.$A168] -> IRGP4640D | G107: of:=[calculations.$J168] -> false | H107: of:=[data.$R168] -> 2.15
A108: of:=[calculations.$A108] -> IRG4IBC10UD | B108: of:=[calculations.$J108] -> false | C108: of:=[data.$R108] -> 1.082 | F108: of:=[calculations.$A137] -> IRGB4061D | G108: of:=[calculations.$J137] -> false | H108: of:=[data.$R137] -> 2.18
A109: of:=[calculations.$A109] -> IRG7PH46UD | B109: of:=[calculations.$J109] -> true | C109: of:=[data.$R109] -> 6.562 | F109: of:=[calculations.$A73] -> IRG4PC40W | G109: of:=[calculations.$J73] -> false | H109: of:=[data.$R73] -> 2.22
A110: of:=[calculations.$A110] -> IRG4PSH71KD | B110: of:=[calculations.$J110] -> false | C110: of:=[data.$R110] -> 11.416 | F110: of:=[calculations.$A101] -> IRG4PC30KD | G110: of:=[calculations.$J101] -> false | H110: of:=[data.$R101] -> 2.231
A111: of:=[calculations.$A111] -> IRGP30B60KD-E | B111: of:=[calculations.$J111] -> false | C111: of:=[data.$R111] -> 3.44 | F111: of:=[calculations.$A134] -> IRG4PC30UD | G111: of:=[calculations.$J134] -> false | H111: of:=[data.$R134] -> 2.254
A112: of:=[calculations.$A112] -> IRGB4062D | B112: of:=[calculations.$J112] -> false | C112: of:=[data.$R112] -> 2.755 | F112: of:=[calculations.$A39] -> IRGS15B60K | G112: of:=[calculations.$J39] -> false | H112: of:=[data.$R39] -> 2.312
A113: of:=[calculations.$A113] -> IRGSL4B60KD1 | B113: of:=[calculations.$J113] -> false | C113: of:=[data.$R113] -> 1.21 | F113: of:=[calculations.$A144] -> IRGP4078D | G113: of:=[calculations.$J144] -> false | H113: of:=[data.$R144] -> 2.365
A114: of:=[calculations.$A114] -> IRGR3B60KD2 | B114: of:=[calculations.$J114] -> false | C114: of:=[data.$R114] -> 0.979 | F114: of:=[calculations.$A56] -> IRG4PH40K | G114: of:=[calculations.$J56] -> false | H114: of:=[data.$R56] -> 2.38
A115: of:=[calculations.$A115] -> IRGPS60B120KD | B115: of:=[calculations.$J115] -> false | C115: of:=[data.$R115] -> 9.758 | F115: of:=[calculations.$A91] -> IRG4PH30KD | G115: of:=[calculations.$J91] -> false | H115: of:=[data.$R91] -> 2.5
A116: of:=[calculations.$A116] -> IRGP50B60PD1-E | B116: of:=[calculations.$J116] -> false | C116: of:=[data.$R116] -> 4.24 | F116: of:=[calculations.$A44] -> IRG4PH40U | G116: of:=[calculations.$J44] -> false | H116: of:=[data.$R44] -> 2.503
A117: of:=[calculations.$A117] -> IRGSL15B60KD | B117: of:=[calculations.$J117] -> false | C117: of:=[data.$R117] -> 0 | F117: of:=[calculations.$A52] -> IRG4PC50K | G117: of:=[calculations.$J52] -> false | H117: of:=[data.$R52] -> 2.748
A118: of:=[calculations.$A118] -> IRGS4B60KD1 | B118: of:=[calculations.$J118] -> false | C118: of:=[data.$R118] -> 1.19 | F118: of:=[calculations.$A89] -> IRGP20B60PD | G118: of:=[calculations.$J89] -> false | H118: of:=[data.$R89] -> 2.755
A119: of:=[calculations.$A119] -> IRGB6B60KD | B119: of:=[calculations.$J119] -> false | C119: of:=[data.$R119] -> 1.304 | F119: of:=[calculations.$A112] -> IRGB4062D | G119: of:=[calculations.$J112] -> false | H119: of:=[data.$R112] -> 2.755
A120: of:=[calculations.$A120] -> IRG4PH20KD | B120: of:=[calculations.$J120] -> false | C120: of:=[data.$R120] -> 1.975 | F120: of:=[calculations.$A133] -> IRGB5B120KD | G120: of:=[calculations.$J133] -> false | H120: of:=[data.$R133] -> 2.755
A121: of:=[calculations.$A121] -> IRG4IBC30UD | B121: of:=[calculations.$J121] -> false | C121: of:=[data.$R121] -> 1.724 | F121: of:=[calculations.$A16] -> IRG4PC50U | G121: of:=[calculations.$J16] -> false | H121: of:=[data.$R16] -> 2.771
A122: of:=[calculations.$A122] -> IRG4BC15UD-S | B122: of:=[calculations.$J122] -> false | C122: of:=[data.$R122] -> 1.029 | F122: of:=[calculations.$A164] -> IRGS4062D | G122: of:=[calculations.$J164] -> false | H122: of:=[data.$R164] -> 2.775
A123: of:=[calculations.$A123] -> IRGSL6B60KD | B123: of:=[calculations.$J123] -> false | C123: of:=[data.$R123] -> 1.344 | F123: of:=[calculations.$A149] -> IRGSL4062D | G123: of:=[calculations.$J149] -> false | H123: of:=[data.$R149] -> 2.795
A124: of:=[calculations.$A124] -> IRG7PH35UD1M | B124: of:=[calculations.$J124] -> false | C124: of:=[data.$R124] -> 0 | F124: of:=[calculations.$A143] -> IRG4PC40UD | G124: of:=[calculations.$J143] -> false | H124: of:=[data.$R143] -> 2.831
A125: of:=[calculations.$A125] -> IRGB20B60PD1 | B125: of:=[calculations.$J125] -> false | C125: of:=[data.$R125] -> 1.93 | F125: of:=[calculations.$A95] -> IRG4PC40KD | G125: of:=[calculations.$J95] -> false | H125: of:=[data.$R95] -> 2.832
A126: of:=[calculations.$A126] -> IRG7PSH50UD | B126: of:=[calculations.$J126] -> true | C126: of:=[data.$R126] -> 0 | F126: of:=[calculations.$A6] -> IRGP4069 | G126: of:=[calculations.$J6] -> false | H126: of:=[data.$R6] -> 2.875
A127: of:=[calculations.$A127] -> IRG4BC30KD-S | B127: of:=[calculations.$J127] -> false | C127: of:=[data.$R127] -> 1.581 | F127: of:=[calculations.$A3] -> IRG7PH35U | G127: of:=[calculations.$J3] -> false | H127: of:=[data.$R3] -> 2.912
A128: of:=[calculations.$A128] -> IRG7PH30K10D | B128: of:=[calculations.$J128] -> false | C128: of:=[data.$R128] -> 4.28 | F128: of:=[calculations.$A82] -> IRGP4650D | G128: of:=[calculations.$J82] -> false | H128: of:=[data.$R82] -> 2.979
A129: of:=[calculations.$A129] -> IRG4PH40KD | B129: of:=[calculations.$J129] -> false | C129: of:=[data.$R129] -> 3.34 | F129: of:=[calculations.$A53] -> IRG4PF50W | G129: of:=[calculations.$J53] -> false | H129: of:=[data.$R53] -> 3.02
A130: of:=[calculations.$A130] -> IRGP4072D | B130: of:=[calculations.$J130] -> false | C130: of:=[data.$R130] -> 3.425 | F130: of:=[calculations.$A9] -> IRG4PC50W | G130: of:=[calculations.$J9] -> false | H130: of:=[data.$R9] -> 3.069
A131: of:=[calculations.$A131] -> IRG7PH35UD1 | B131: of:=[calculations.$J131] -> false | C131: of:=[data.$R131] -> 3.45 | F131: of:=[calculations.$A47] -> IRG4PH50K | G131: of:=[calculations.$J47] -> false | H131: of:=[data.$R47] -> 3.148
A132: of:=[calculations.$A132] -> IRG4BC30UD | B132: of:=[calculations.$J132] -> false | C132: of:=[data.$R132] -> 1.584 | F132: of:=[calculations.$A32] -> IRGP4263 | G132: of:=[calculations.$J32] -> false | H132: of:=[data.$R32] -> 3.165
A133: of:=[calculations.$A133] -> IRGB5B120KD | B133: of:=[calculations.$J133] -> false | C133: of:=[data.$R133] -> 2.755 | F133: of:=[calculations.$A86] -> IRG4PH40UD2-E | G133: of:=[calculations.$J86] -> false | H133: of:=[data.$R86] -> 3.234
A134: of:=[calculations.$A134] -> IRG4PC30UD | B134: of:=[calculations.$J134] -> false | C134: of:=[data.$R134] -> 2.254 | F134: of:=[calculations.$A129] -> IRG4PH40KD | G134: of:=[calculations.$J129] -> false | H134: of:=[data.$R129] -> 3.34
A135: of:=[calculations.$A135] -> IRG4IBC30KD | B135: of:=[calculations.$J135] -> false | C135: of:=[data.$R135] -> 1.701 | F135: of:=[calculations.$A67] -> IRGP4063 | G135: of:=[calculations.$J67] -> false | H135: of:=[data.$R67] -> 3.35
A136: of:=[calculations.$A136] -> IRGPS4067D | B136: of:=[calculations.$J136] -> false | C136: of:=[data.$R136] -> 8.99 | F136: of:=[calculations.$A48] -> IRG7PH30K10 | G136: of:=[calculations.$J48] -> false | H136: of:=[data.$R48] -> 3.4
A137: of:=[calculations.$A137] -> IRGB4061D | B137: of:=[calculations.$J137] -> false | C137: of:=[data.$R137] -> 2.18 | F137: of:=[calculations.$A93] -> IRGP4660D | G137: of:=[calculations.$J93] -> false | H137: of:=[data.$R93] -> 3.409
A138: of:=[calculations.$A138] -> IRGP30B120KD-E | B138: of:=[calculations.$J138] -> false | C138: of:=[data.$R138] -> 5.7 | F138: of:=[calculations.$A35] -> IRG4PH50U | G138: of:=[calculations.$J35] -> false | H138: of:=[data.$R35] -> 3.414
A139: of:=[calculations.$A139] -> IRG6B330UD | B139: of:=[calculations.$J139] -> false | C139: of:=[data.$R139] -> 0 | F139: of:=[calculations.$A130] -> IRGP4072D | G139: of:=[calculations.$J130] -> false | H139: of:=[data.$R130] -> 3.425
A140: of:=[calculations.$A140] -> IRG4BC10UD | B140: of:=[calculations.$J140] -> false | C140: of:=[data.$R140] -> 0.942 | F140: of:=[calculations.$A155] -> IRGP4062D | G140: of:=[calculations.$J155] -> false | H140: of:=[data.$R155] -> 3.425
A141: of:=[calculations.$A141] -> IRGP4066D | B141: of:=[calculations.$J141] -> false | C141: of:=[data.$R141] -> 6 | F141: of:=[calculations.$A111] -> IRGP30B60KD-E | G141: of:=[calculations.$J111] -> false | H141: of:=[data.$R111] -> 3.44
A142: of:=[calculations.$A142] -> IRG4PSH71UD | B142: of:=[calculations.$J142] -> false | C142: of:=[data.$R142] -> 13.06 | F142: of:=[calculations.$A131] -> IRG7PH35UD1 | G142: of:=[calculations.$J131] -> false | H142: of:=[data.$R131] -> 3.45
A143: of:=[calculations.$A143] -> IRG4PC40UD | B143: of:=[calculations.$J143] -> false | C143: of:=[data.$R143] -> 2.831 | F143: of:=[calculations.$A88] -> IRG4PH40UD | G143: of:=[calculations.$J88] -> false | H143: of:=[data.$R88] -> 3.484
A144: of:=[calculations.$A144] -> IRGP4078D | B144: of:=[calculations.$J144] -> false | C144: of:=[data.$R144] -> 2.365 | F144: of:=[calculations.$A51] -> IRGP20B120U-E | G144: of:=[calculations.$J51] -> false | H144: of:=[data.$R51] -> 3.488
A145: of:=[calculations.$A145] -> IRGB4B60KD1 | B145: of:=[calculations.$J145] -> false | C145: of:=[data.$R145] -> 1.246 | F145: of:=[calculations.$A84] -> IRGP35B60PD | G145: of:=[calculations.$J84] -> false | H145: of:=[data.$R84] -> 3.578
A146: of:=[calculations.$A146] -> IRG7PH50K10D | B146: of:=[calculations.$J146] -> false | C146: of:=[data.$R146] -> 4.67 | F146: of:=[calculations.$A105] -> IRGP35B60PD-E | G146: of:=[calculations.$J105] -> false | H146: of:=[data.$R105] -> 3.678
A147: of:=[calculations.$A147] -> IRGS15B60KD | B147: of:=[calculations.$J147] -> false | C147: of:=[data.$R147] -> 2.05 | F147: of:=[calculations.$A162] -> IRGP4069D | G147: of:=[calculations.$J162] -> false | H147: of:=[data.$R162] -> 3.688
A148: of:=[calculations.$A148] -> IRGB4045D | B148: of:=[calculations.$J148] -> false | C148: of:=[data.$R148] -> 1.464 | F148: of:=[calculations.$A102] -> IRG4PC50KD | G148: of:=[calculations.$J102] -> false | H148: of:=[data.$R102] -> 3.859
A149: of:=[calculations.$A149] -> IRGSL4062D | B149: of:=[calculations.$J149] -> false | C149: of:=[data.$R149] -> 2.795 | F149: of:=[calculations.$A160] -> IRG4PC50UD | G149: of:=[calculations.$J160] -> false | H149: of:=[data.$R160] -> 3.916
A150: of:=[calculations.$A150] -> IRG4PH50KD | B150: of:=[calculations.$J150] -> false | C150: of:=[data.$R150] -> 4.684 | F150: of:=[calculations.$A178] -> IRGP4063D1 | G150: of:=[calculations.$J178] -> false | H150: of:=[data.$R178] -> 4.082
A151: of:=[calculations.$A151] -> IRG4PSC71UD | B151: of:=[calculations.$J151] -> false | C151: of:=[data.$R151] -> 7.885 | F151: of:=[calculations.$A59] -> IRG4PC60U | G151: of:=[calculations.$J59] -> false | H151: of:=[data.$R59] -> 4.112
A152: of:=[calculations.$A152] -> IRG4IBC20KD | B152: of:=[calculations.$J152] -> false | C152: of:=[data.$R152] -> 1.324 | F152: of:=[calculations.$A81] -> IRGP4063D | G152: of:=[calculations.$J81] -> false | H152: of:=[data.$R81] -> 4.132
A153: of:=[calculations.$A153] -> IRGB10B60KD | B153: of:=[calculations.$J153] -> false | C153: of:=[data.$R153] -> 1.694 | F153: of:=[calculations.$A116] -> IRGP50B60PD1-E | G153: of:=[calculations.$J116] -> false | H153: of:=[data.$R116] -> 4.24
A154: of:=[calculations.$A154] -> IRGB4060D | B154: of:=[calculations.$J154] -> false | C154: of:=[data.$R154] -> 1.55 | F154: of:=[calculations.$A128] -> IRG7PH30K10D | G154: of:=[calculations.$J128] -> false | H154: of:=[data.$R128] -> 4.28
A155: of:=[calculations.$A155] -> IRGP4062D | B155: of:=[calculations.$J155] -> false | C155: of:=[data.$R155] -> 3.425 | F155: of:=[calculations.$A92] -> IRGP4068D-E | G155: of:=[calculations.$J92] -> false | H155: of:=[data.$R92] -> 4.363
A156: of:=[calculations.$A156] -> IRGIB6B60KD | B156: of:=[calculations.$J156] -> false | C156: of:=[data.$R156] -> 1.444 | F156: of:=[calculations.$A107] -> IRGP50B60PD | G156: of:=[calculations.$J107] -> false | H156: of:=[data.$R107] -> 4.454
A157: of:=[calculations.$A157] -> IRGIB15B60KD1 | B157: of:=[calculations.$J157] -> false | C157: of:=[data.$R157] -> 2.02 | F157: of:=[calculations.$A104] -> IRGP4068D | G157: of:=[calculations.$J104] -> false | H157: of:=[data.$R104] -> 4.462
A158: of:=[calculations.$A158] -> IRGS4045D | B158: of:=[calculations.$J158] -> false | C158: of:=[data.$R158] -> 1.106 | F158: of:=[calculations.$A100] -> IRG7PH35UD | G158: of:=[calculations.$J100] -> false | H158: of:=[data.$R100] -> 4.5
A159: of:=[calculations.$A159] -> IRG4BC20UD | B159: of:=[calculations.$J159] -> false | C159: of:=[data.$R159] -> 1.2 | F159: of:=[calculations.$A176] -> IRG4PF50WD | G159: of:=[calculations.$J176] -> false | H159: of:=[data.$R176] -> 4.528
A160: of:=[calculations.$A160] -> IRG4PC50UD | B160: of:=[calculations.$J160] -> false | C160: of:=[data.$R160] -> 3.916 | F160: of:=[calculations.$A146] -> IRG7PH50K10D | G160: of:=[calculations.$J146] -> false | H160: of:=[data.$R146] -> 4.67
A161: of:=[calculations.$A161] -> IRGS4056D | B161: of:=[calculations.$J161] -> false | C161: of:=[data.$R161] -> 2 | F161: of:=[calculations.$A150] -> IRG4PH50KD | G161: of:=[calculations.$J150] -> false | H161: of:=[data.$R150] -> 4.684
A162: of:=[calculations.$A162] -> IRGP4069D | B162: of:=[calculations.$J162] -> false | C162: of:=[data.$R162] -> 3.688 | F162: of:=[calculations.$A64] -> IRGP4266 | G162: of:=[calculations.$J64] -> false | H162: of:=[data.$R64] -> 4.838
A163: of:=[calculations.$A163] -> IRGS6B60KD | B163: of:=[calculations.$J163] -> false | C163: of:=[data.$R163] -> 1.324 | F163: of:=[calculations.$A173] -> IRG7PH42UD1 | G163: of:=[calculations.$J173] -> false | H163: of:=[data.$R173] -> 4.875
A164: of:=[calculations.$A164] -> IRGS4062D | B164: of:=[calculations.$J164] -> false | C164: of:=[data.$R164] -> 2.775 | F164: of:=[calculations.$A96] -> IRG4PH50UD | G164: of:=[calculations.$J96] -> false | H164: of:=[data.$R96] -> 5.034
A165: of:=[calculations.$A165] -> IRGSL10B60KD | B165: of:=[calculations.$J165] -> false | C165: of:=[data.$R165] -> 1.734 | F165: of:=[calculations.$A181] -> IRGP20B120UD-E | G165: of:=[calculations.$J181] -> false | H165: of:=[data.$R181] -> 5.089
A166: of:=[calculations.$A166] -> IRG7PH42UD1M | B166: of:=[calculations.$J166] -> false | C166: of:=[data.$R166] -> 0 | F166: of:=[calculations.$A49] -> IRGPS40B120U | G166: of:=[calculations.$J49] -> false | H166: of:=[data.$R49] -> 5.295
A167: of:=[calculations.$A167] -> IRGS10B60KD | B167: of:=[calculations.$J167] -> false | C167: of:=[data.$R167] -> 1.714 | F167: of:=[calculations.$A76] -> IRG4PSC71K | G167: of:=[calculations.$J76] -> false | H167: of:=[data.$R76] -> 5.359
A168: of:=[calculations.$A168] -> IRGP4640D | B168: of:=[calculations.$J168] -> false | C168: of:=[data.$R168] -> 2.15 | F168: of:=[calculations.$A12] -> IRGP4066 | G168: of:=[calculations.$J12] -> false | H168: of:=[data.$R12] -> 5.375
A169: of:=[calculations.$A169] -> IRGIB10B60KD1 | B169: of:=[calculations.$J169] -> false | C169: of:=[data.$R169] -> 1.716 | F169: of:=[calculations.$A17] -> IRG4PSC71U | G169: of:=[calculations.$J17] -> false | H169: of:=[data.$R17] -> 5.411
A170: of:=[calculations.$A170] -> IRGR2B60KD | B170: of:=[calculations.$J170] -> false | C170: of:=[data.$R170] -> 0.39 | F170: of:=[calculations.$A2] -> IRGP4066-E | G170: of:=[calculations.$J2] -> false | H170: of:=[data.$R2] -> 5.45
A171: of:=[calculations.$A171] -> IRGB4064D | B171: of:=[calculations.$J171] -> false | C171: of:=[data.$R171] -> 1.859 | F171: of:=[calculations.$A138] -> IRGP30B120KD-E | G171: of:=[calculations.$J138] -> false | H171: of:=[data.$R138] -> 5.7
A172: of:=[calculations.$A172] -> IRG4BC10KD | B172: of:=[calculations.$J172] -> false | C172: of:=[data.$R172] -> 0.932 | F172: of:=[calculations.$A98] -> IRG7PH42UD | G172: of:=[calculations.$J98] -> false | H172: of:=[data.$R98] -> 5.712
A173: of:=[calculations.$A173] -> IRG7PH42UD1 | B173: of:=[calculations.$J173] -> false | C173: of:=[data.$R173] -> 4.875 | F173: of:=[calculations.$A141] -> IRGP4066D | G173: of:=[calculations.$J141] -> false | H173: of:=[data.$R141] -> 6
A174: of:=[calculations.$A174] -> IRGP4066D-E | B174: of:=[calculations.$J174] -> false | C174: of:=[data.$R174] -> 6.075 | F174: of:=[calculations.$A174] -> IRGP4066D-E | G174: of:=[calculations.$J174] -> false | H174: of:=[data.$R174] -> 6.075
A175: of:=[calculations.$A175] -> IRGR4045D | B175: of:=[calculations.$J175] -> false | C175: of:=[data.$R175] -> 1.318 | F175: of:=[calculations.$A78] -> IRGPS40B120UD | G175: of:=[calculations.$J78] -> false | H175: of:=[data.$R78] -> 7.741
A176: of:=[calculations.$A176] -> IRG4PF50WD | B176: of:=[calculations.$J176] -> false | C176: of:=[data.$R176] -> 4.528 | F176: of:=[calculations.$A177] -> IRG4PSC71KD | G176: of:=[calculations.$J177] -> false | H176: of:=[data.$R177] -> 7.761
A177: of:=[calculations.$A177] -> IRG4PSC71KD | B177: of:=[calculations.$J177] -> false | C177: of:=[data.$R177] -> 7.761 | F177: of:=[calculations.$A151] -> IRG4PSC71UD | G177: of:=[calculations.$J151] -> false | H177: of:=[data.$R151] -> 7.885
A178: of:=[calculations.$A178] -> IRGP4063D1 | B178: of:=[calculations.$J178] -> false | C178: of:=[data.$R178] -> 4.082 | F178: of:=[calculations.$A136] -> IRGPS4067D | G178: of:=[calculations.$J136] -> false | H178: of:=[data.$R136] -> 8.99
A179: of:=[calculations.$A179] -> IRG4BC20FD | B179: of:=[calculations.$J179] -> false | C179: of:=[data.$R179] -> 1.168 | F179: of:=[calculations.$A115] -> IRGPS60B120KD | G179: of:=[calculations.$J115] -> false | H179: of:=[data.$R115] -> 9.758
A180: of:=[calculations.$A180] -> IRGS4064D | B180: of:=[calculations.$J180] -> false | C180: of:=[data.$R180] -> 0 | F180: of:=[calculations.$A54] -> IRG7PSH73K10 | G180: of:=[calculations.$J54] -> false | H180: of:=[data.$R54] -> 11.149
A181: of:=[calculations.$A181] -> IRGP20B120UD-E | B181: of:=[calculations.$J181] -> false | C181: of:=[data.$R181] -> 5.089 | F181: of:=[calculations.$A110] -> IRG4PSH71KD | G181: of:=[calculations.$J110] -> false | H181: of:=[data.$R110] -> 11.416
A182: of:=[calculations.$A182] -> IRG4RC10UD | B182: of:=[calculations.$J182] -> false | C182: of:=[data.$R182] -> 1.099 | F182: of:=[calculations.$A142] -> IRG4PSH71UD | G182: of:=[calculations.$J142] -> false | H182: of:=[data.$R142] -> 13.06